Name,English,Translation,Restrictions,Comment
RoomEditor_InvalidDragLayers,"Unable to drag resources into room, ensure one layer is selected","Não é possível arrastar recursos em um cena, certifique-se de que uma camada foi selecionada",, Information warning for dropping resource gadgets on the room but layer selection is invalid
RoomEditor_InvalidDragLayerFrozenOrInvisible,"Unable to drag resources into room, ensure selected layer '{0}' is unlocked and visible","Não é possível arrastar recursos em um cena, certifique-se de que a camada selecionada “{0}” está desbloqueada e visível",,Information warning for dropping resource gadgets on a locked or invisible selected layer
RoomEditor_InvalidTileSet,The selected tile set has no associated sprite please select a valid tile set,"O conjunto de tiles selecionado não tem um sprite associado, selecione um conjunto de tiles válido",,message to be shown when the user has selected a tileset that is not valid (ie. no sprite selected)
RoomEditor_NoTilesetMessage,Your tile set preview will appear here when you select a tile set,A prévia do conjunto de tiles aparecerá quando você selecionar um conjunto de tiles,,message to be shown when the user has not selected a tile set
RoomEditor_NoLayer,No Tile Layer Selected,Nenhuma camada de bloco selecionada,, message to be shown when the user has not selected a tile layer
InvalidName_NameInUse,"Invalid name, already in use: {0}. Names must be unique.","Nome inválido, já está sendo usado: {0}. Os nomes devem ser únicos.",,Name not unique message
InvalidName_KeywordReserved,"Invalid name, reserved keyword: {0}.","Nome inválido, palavra-chave reservada: {0}.",,Name is a reserved keyword message
InvalidName_InvalidCharacters,"Invalid name, contains invalid characters: {0}. Should only contain 0-9, a-z, A-Z or _ and not start with 0-9.","Nome inválido, contém caracteres inválidos: {0}. Deve conter apenas 0-9, a-z, A-Z ou _ e não deve começar com 0-9.",,Name contains invalid characters message
InvalidName_InvalidModel,Invalid model.,Modelo inválido,,Invalid model message
InvalidName_DuplicateGroupName,Group name '{0}' is already in use,O nome do grupo “{0}” já está sendo usado,,invalid group folder name
InvalidMove_DuplicateChildName,A group with name '{0}' already exists at this location,Um grupo com o nome “{0}” já existe nessa localização,,Parent folders or project cannot have multiple child folder with the same name message
ResourceTree_View,View,Exibição,View,View
ResourceTree_Views,Views,Exibições,,Views selector button label
ResourceTree_View_Add,Add New View,Adicionar nova exibição,,Add New View Prompt
ResourceTree_View_Default,Default,Padrão,,default tag
ResourceTree_View_Cannot_Delete_Default,You cannot delete the default view.,Você não pode excluir a exibição padrão.,,You cannot delete the default view
ResourceTree_View_Title,Resource Tree,Árvore de recurso,,Title for above message
ResourceTree_View_DuplicateName,A view with this name already exists. Views must be unique.,Uma exibição com esse nome já existe. As exibições devem ser únicas.,,Duplicate name warning
ResourceTree_Filter, Filter Tree, Filtrar árvore,, 'Filter Tree' checkbox label
ResourceTree_WholeWord, Whole Word, Palavra inteira,, 'Whole Word' checkbox label
ResourceTree_FindNext, Find Next, Localizar próximo,, 'Find Next' button label
ResourceTree_FindPrevious, Find Previous, Localizar anterior,, 'Find Previous' button label
ResourceTree_SearchResources,Search...,Pesquisar...,, default contents of the resource tree search resources box
ResourceTree_SearchOptions,Search Options,Opções de pesquisa,,Additional Search Options
SearchInScript_Search,Find...,Localizar...,,Search in Script Search default box text
SearchInScript_Replace,Replace...,Substituir...,,Search in Script Replace default box text
SearchInScript_SelectionOnly,Selection Only,Apenas seleção,,Search in Script Selection Only
GMLVisual_Gadget_DirectionalInput,Directional Input,Entrada direcional,,GML Visual gadget for directional input
GMLVisual_Gadget_NumericInput,Numeric Input,Entrada numérica,,GML Visual gadget for numeric input
GMLVisual_Gadget_ApplyTo,Apply To,Aplicar em,,GML Visual gadget for applying to a specific object or instance
GMLVisual_Gadget_IsRelative,Is Relative,É relativo,,GML Visual gadget for determining if a change is relative
GMLVisual_Gadget_IsTemp,Is Temp,É temporário,,GML Visual gadget for determining if a target is temp
GMLVisual_Gadget_TextInput,Text Input,Entrada de texto,,GML Visual gadget for text input
GMLVisual_Gadget_ExpressionInput,Expression,Expressão,,GML Visual gadget for expression input
GMLVisual_Gadget_MenuInput,Menu Input,Entrada de menu,,GML Visual gadget for menu input
GMLVisual_Gadget_MenuExpressionInput,Menu Expression Input,Entrada de expressão de menu,,GML Visual gadget for menu expression input
GMLVisual_Gadget_ResourceSelection,Resource Selection,Seleção de recurso,,GML Visual gadget for resource selection
GMLVisual_Gadget_ResourceSelection_SelectResource,Select Asset,Selecionar Recurso,,GML Visualâ„¢ gadget list view explorer title
GMLVisual_Gadget_BooleanInput,Boolean Input,Entrada booleana,,GML Visual gadget for boolean input
GMLVisual_Gadget_BooleanExprInput,Boolean Expression Input,Entrada de expressão booleana,,GML Visual gadget for boolean input
GMLVisual_Gadget_ColorPicker,Colour Picker,Seletor de cores,,GML Visual gadget for picking a color
GMLVisual_Gadget_ColorPalette,Colour Palette,Paleta de cores,,GML Visual gadget for picking a color
GMLVisual_Gadget_MultiLineTextInput,Text Input (MultiLine),Entrada de texto (multilinha),,GML Visual gadget for multiline text input
GMLVisual_Gadget_CodeInput,Code Input,Entrada de código,,GML Visual gadget for code input
GMLVisual_Gadget_Caption_GroupSelector,Options,Opções,,GML Visual label caption for the group selector gadget
GMLVisual_Gadget_GroupSelector,Group Selector,Seletor de grupo,,GML Visual group selector gadget name
GMLVisual_Gadget_Caption_IsRelative,Relative,Relativo,,GML Visual gadget caption name for Is Relative
GMLVisual_Gadget_Caption_IsTemp,Temp,Temporário,,GML Visual gadget caption name for Is Temp
GMLVisual_Gadget_Caption_ApplyTo,Apply To,Aplicar em,,GML Visual gadget caption name for Apply To
GMLVisualMaker_AppTitle,GML Visual Maker,GML Visual Maker,,GML Visual Maker application title
GMLVisualMaker_Arguments,Arguments,Argumentos,,GML Visual Maker argument gadgets header
GMLVisualMaker_Gadgets,Gadgets,Gadgets,,GML Visual Maker gui gadgets header
GMLVisualMaker_Properties,Argument Properties,Propriedades do argumento,,GML Visual Maker properties header
GMLVisualMaker_Layout,Argument Layout,Layout do argumento,,GML Visual Maker layout header
GMLVisualMaker_LivePreview,Node Designer ({0}),Designer de nó ({0}),,GML Visual Maker live preview header
GMLVisualMaker_NoAction,No Action,Sem ação,,GML Visual Maker designer title no action selected
GMLVisualMaker_Groups,Layout Groups,Grupos de layout,,GML Visual Maker layout groups view header
GMLVisualMaker_Menu_Library,Library,Biblioteca,,GML Visual Maker menu entry
GMLVisualMaker_Menu_Nodes,Nodes,Nós,,GML Visual Maker menu entry
GMLVisualMaker_Menu_Layout,Layout,Layout,,GML Visual Maker menu entry
GMLVisualMaker_Menu_Translation,Translations,Traduções,,GML Visual Maker menu entry
GMLVisualMaker_LangName,Name,Nome,,column
GMLVisualMaker_LangEng,English,Inglês,,column
GMLVisualMaker_LangTrans,Translation,Tradução,,column
GMLVisualMaker_LangRes,Restrictions,Restrições,,column
GMLVisualMaker_LangDesc,Description,Descrição,,column
GMLVisualMaker_Menu_Languages,Languages,Idiomas,,GML Visual Maker menu entry
GMLVisualMaker_Menu_NewLang,New Language,Novo idioma,,GML Visual Maker menu entry
GMLVisualMaker_Menu_EditLang,Edit Language,Editar idioma,,GML Visual Maker menu entry
GMLVisualMaker_Group_Default,Default,Padrão,,GML Visual Maker default group name
GMLVisualMaker_NewGroup,Group,Grupo,,GML Visual Maker default new group name
GMLVisualMaker_NewSection,New Section,Nova seção,,GML Visual Maker default new section name
GMLVisualMaker_NewAction,New Action,Nova ação,,GML Visual Maker default new action name
GMLVisualMaker_Menu_NewNode,New Node,Novo nó,,GML Visual Maker new node menu item
GMLVisualMaker_Menu_SaveNode,Save Node,Salvar nó,,GML Visual Maker save node menu item
GMLVisualMaker_Menu_PreviewNode,Preview,Prévia,,GML Visual Maker preview node menu item
GMLVisualMaker_Menu_EvaluateNode,Evaluate,Avaliar,,GML Visual Maker evaluate node menu item
GMLVisualMaker_Menu_LoadLibrary,Load Library,Carregar biblioteca,,GML Visual Maker load library menu item
GMLVisualMaker_Menu_SaveLibrary,Save Library,Salvar biblioteca,,GML Visual Maker save library menu item
GMLVisualMaker_Menu_NewLibrary,New Library,Nova biblioteca,,GML Visual Maker new library menu item
GMLVisualMaker_Library,My Library,Minha biblioteca,,GML Visual Maker library header text
GMLVisualMaker_Menu_ExportLibrary,Export Library,Exportar biblioteca,,GML Visual Maker export library menu item
GMLVisualMaker_LibWizard_Label,Write new library name,Escrever novo nome de biblioteca,,GML Visual Maker library wizard name label
GMLVisualMaker_LibWizard_OK,Create Library,Criar biblioteca,,GML Visual Maker library wizard OK button
GMLVisualMaker_LibWizard_Cancel,Cancel,Cancelar,,GML Visual Maker library wizard Cancel button
GMLVisualMaker_Menu_Sections,Sections,Seções,,GML Visual Maker sections menu item
GMLVisualMaker_Menu_AddSection,Add Section,Adicionar seção,,GML Visual Maker add section menu item
GMLVisualMaker_Menu_LayoutWizard,Open Layout Wizard...,Abrir assistente de layout...,,GML Visual Maker Open Layout Wizard menu item
GMLVisualMaker_Menu_ExpandLocalisation,Expand Localisation,Expandir localização,,GML Visual Maker Open Layout Wizard menu item
GMLVisualMaker_Menu_AddGroup,Add Layout Group,Adicionar grupo de layout,,GML Visual Maker add layout group menu item
GMLVisualMaker_Menu_RenameGroup,Rename Layout Group,Renomear grupo de layout,,GML Visual Maker rename layout group menu item
GMLVisualMaker_Menu_RemoveGroup,Remove Layout Group,Remover grupo de layout,,GML Visual Maker remove layout group menu item
GMLVisualMaker_CMenu_AddSection,Add Section,Adicionar seção,,GML Visual Maker context menu add section caption
GMLVisualMaker_CMenu_RemoveSectionOrAction,Remove,Remover,,GML Visual Maker library context menu remove caption
GMLVisualMaker_CMenu_RenameSectionOrAction,Rename,Renomear,,GML Visual Maker library context menu rename caption
GMLVisualMaker_CMenu_EditAction,Edit Action,Editar ação,,GML Visual Maker library context menu edit caption
GMLVisualMaker_CMenu_RemoveGadget,Remove Gadget,Remover Gadget,,GML Visual Maker designer remove gadget menu entry
GMLVisualMaker_CMenu_CopyGadget,Copy Gadget,Copiar Gadget,,GML Visual Maker designer copy gadget menu entry
GMLVisualMaker_CMenu_CutGadget,Cut Gadget,Cortar Gadget,,GML Visual Maker designer cut gadget menu entry
GMLVisualMaker_CMenu_PasteGadget,Paste Gadget,Colar Gadget,,GML Visual Maker designer paste gadget menu entry
GMLVisualMaker_PopUp_OK,OK,OK,,GML Visual Maker popup window OK button
GMLVisualMaker_MustMakeLibrary,No library loaded.,Nenhuma biblioteca carregada.,,GML Visual Maker no library loaded warning message
GMLVisualMaker_CMenu_AddGroup,Add Group,Adicionar grupo,,GML Visual Maker add group menu entry
GMLVisualMaker_CMenu_RenameGroup,Rename Group,Renomear grupo,,GML Visual Maker rename group menu entry
GMLVisualMaker_CMenu_RemoveGroup,Remove Group,Remover grupo,,GML Visual Maker remove group menu entry
GMLVisualMaker_CannotDeleteDefaultGroup,Default group cannot be deleted.,O grupo padrão não pode ser excluído.,,GML Visual Maker warning message
GMLVisualMaker_CannotDeleteLibrary,Library cannot be deleted.,A biblioteca não pode ser excluída.,,GML Visual Maker cannot delete library node warning message
GMLVisualMaker_InvalidActionName,Invalid action name: must be XML compatible.,Nome de ação inválido: deve ser compatível com XML.,,GML Visual Maker invalid action name warning message
GMLVisualMaker_NoActionLayout,This action has no layout.,Essa ação não tem layout.,,GML Visual Maker invalid action layout warning message
GMLVisualMaker_CantShowPreview,Error -- Cannot show preview.,Erro: não é possível mostrar prévia.,,GML Visual Maker cannot show preview warning message
GMLVisualMaker_NotEditingAction,You are not editing an action.,Você não está editando uma ação.,,GML Visual Maker not editing action warning message
GMLVisualMaker_NotPreviewingAction,You are not previewing an action.,Você não está exibindo uma prévia de ação.,,GML Visual Maker not previewing action warning message
GMLVisualMaker_EvaluationResult,Evaluation Result,Resultado da avaliação,,GML Visual Maker evaluation result window caption
GMLVisualMaker_ActionProperties,Action Properties,Propriedades da ação,,GML Visual Maker action properties caption
GMLVisualMaker_DefaultCode,// Your code here,// Seu código aqui,,GML Visual Maker default code input for group
GMLVisualMaker_CodeCaption,Code (Group: {0}),Código (Grupo: {0}),,GML Visual Maker code for selected group caption
GMLVisualMaker_SaveError,Saving failed.,Falha ao salvar.,,GML Visual Maker save error message
GMLVisualMaker_SaveComplete,Library saved.,Biblioteca salva.,,GML Visual Maker library save message
GMLVisualMaker_DialogTitle,GML Visual Maker,GML Visual Maker,,GML Visual Maker dialog title
GMLVisualMaker_UnsavedChanges,There are unsaved changes. Do you want to save?,Há alterações não salvas. Deseja salvar?,,GML Visual Maker unsaved changes confirmation dialog
GMLVisualMaker_UnsavedLibrary,Do you want to save the current library before continuing?,Deseja salvar a biblioteca atual antes de continuar?,,GML Visual Maker unsaved library
GMLVisualMaker_ExportFailed,Exporting library failed.,Falha ao exportar biblioteca.,,GML Visual Maker export failed message
GMLVisualMaker_OpenFailed,Couldn't open the specified library.,Não foi possível abril a biblioteca especificada.,,GML Visual Maker open library error message
GMLVisualMaker_CantParentAction,Actions can't be parents.,As ações não podem ser relacionadas.,,GML Visual Maker drag into action error
GMLVisualMaker_CantParentGadget,Gadgets can't be parents.,Os gadgets não podem ser relacionados.,,GML Visual Maker drag into Gadgets error
GMLVisualMaker_NoSelectedGadget,You have not selected a gadget.,Você não tem um gadget selecionado.,,GML Visual Maker no selected gadget error
GMLVisualMaker_NoCopiedGadget,You have not copied a gadget.,Você não tem um gadget copiado.,,GML Visual Maker no copied gadget error
GMLVisualMaker_LayoutWizard,Layout Wizard,Assistente de layout,,GML Visual Maker layout wizard name
GMLVisualMaker_LayoutWizardHelpText,This wizard helps you easily create a layout for your GML Visual action.,Esse assistente ajuda você a criar facilmente um layout para sua ação de GML Visual.,,GML Visual Maker layout wizard help text
GMLVisualMaker_LayoutWizardArgCount,How many arguments do you need?,De quantos argumentos você precisa?,,GML Visual Maker layout wizard arg count
GMLVisualMaker_LayoutWizardArgCaption,Caption,Legenda,,GML Visual Maker layout wizard arg caption label
GMLVisualMaker_LayoutWizardArgGadget,Gadget,Gadget,,GML Visual Maker layout wizard arg gadget label
GMLVisualMaker_LayoutWizardArgTagName,Tag Name,Marcar nome,,GML Visual Maker layout wizard arg tag name label
GMLVisualMaker_LayoutWizardIsRelative,Can Be Relative?,Pode ser relativo?,,GML Visual Maker layout wizard can be relative label
GMLVisualMaker_LayoutWizardProperties,Properties,Propriedades,,GML Visual Maker layout wizard properties label
GMLVisualMaker_LayoutWizardIsTemp,Can Be Temp?,Pode ser temporário?,,GML Visual Maker layout wizard can be temp label
GMLVisualMaker_NoLayoutWizardLayout,Layout wizard layout is missing.,Layout do assistente de layout está faltando.,,GML Visual Maker layout wizard error
GMLVisual_Loading,Loading...,Carregando...,,Loading GML Visual script
GMLVisualMaker_ExpandLocalisationFailed,Failed to expand localisation,Falha ao expandir a localização,,expand localisation error message
GMLVisual_Gadget_Label,Label,Rótulo,,GML Visual Label gadget localised name
GMLVisual_Gadget_StackPanel,Stack Panel,Painel de pilha,,GML Visual Stack Panel gadget localised name
GMLVisual_Gadget_Grid,Grid,Grade,,GML Visual Grid gadget localised name
GMLVisual_Gadget_MKConstantSelector,Mouse & Key Selector,Seletor de tecla e mouse,,GML Visual gadget localised name
kbv_type_default,Default,Padrão,,Default virtual keyboard type
kbv_type_ascii,ASCII,ASCII,,ASCII virtual keyboard type
kbv_type_url,URL,URL,,URL virtual keyboard type
kbv_type_email,Email,E-mail,,Email virtual keyboard type
kbv_type_numbers,Numbers,Números,,Numbers virtual keyboard type
kbv_type_phone,Phone,Telefone,,Phone virtual keyboard type
kbv_type_phone_name,Alphanumeric,Alfanumérico,,Phone name virtual keyboard type
kbv_returnkey_default,Default,Padrão,,Return key type of virtual keyboard
kbv_returnkey_go,Go,Ir,,Return key type of virtual keyboard
kbv_returnkey_google,Google,Google,,Return key type of virtual keyboard
kbv_returnkey_join,Join,Participar,,Return key type of virtual keyboardG
kbv_returnkey_next,Next,Avançar,,Return key type of virtual keyboard
kbv_returnkey_route,Route,Rota,,Return key type of virtual keyboard
kbv_returnkey_search,Search,Pesquisar,,Return key type of virtual keyboard
kbv_returnkey_send,Send,Enviar,,Return key type of virtual keyboard
kbv_returnkey_yahoo,Yahoo,Yahoo,,Return key type of virtual keyboard
kbv_returnkey_done,Done,Concluído,,Return key type of virtual keyboard
kbv_returnkey_continue,Continue,Continuar,,Return key type of virtual keyboard
kbv_returnkey_emergency,Emergency,Emergência,,Return key type of virtual keyboard
kbv_autocapitalize_none,None,Nenhum,,No autocapitalization
kbv_autocapitalize_words,Words,Palavras,,Words autocapitalization
kbv_autocapitalize_sentences,Sentences,Sentenças,,Sentence autocapitalization
kbv_autocapitalize_characters,Characters,Caracteres,,Character autocapitalization
Tutorial_Install_NoTutorials,Failed to find any tutorials in the installed package,Falha ao encontrar um tutorial no pacote instalado,,tutorial install error message
Tutorial_Install_Complete,Tutorial install complete!,Instalação do tutorial completa!,,tutorial install complete message
Tutorial_Download_Error,Error Downloading Tutorial: '{0}',Erro ao baixar o tutorial: “{0}”,,tutorial download error message
Tutorial_Install_Failed,Tutorial Install Failed,Falha ao instalar o tutorial,,tutorial install failed message
Tutorial_Menu_OpenInBrowser,Open in browser,Abrir no navegador,,tutorial context menu entry
Tutorial_WindowTitle,Tutorial: {0},Tutorial: {0},,tutorial window title
Tutorial_LoadFailed,Error loading tutorial file: {0},Erro ao carregar o arquivo do tutorial: {0},,tutorial load error message
Tutorial_Install_Title,Installing Tutorial,Instalando o tutorial,,tutorial install window title
Tutorial_Installing_Label,Installing:{0},Instalando:{0},,tutorial install window name label
Tutorial_Install_ErrorTitle,Error installing tutorial,Erro ao instalar o tutorial,,turorial install error
Tutorial_Install_ErrorMessage,Failed to install tutorial package: {0},Falha ao instalar o pacote de tutorial: {0},,tutorial install fail message
Tutorial_ProjectFileMissing,Unable to locate tutorial project file: {0},Não foi possível localizar o arquivo do projeto do tutorial: {0},,missing tutorial project file
Tutorial_Create_DisplayNameMissing,Display name must be set,O nome de exibição deve ser definido,,tutorial create error
Tutorial_DisplayNameLabel,Display Name:,Nome de exibição:,,tutorial settings display name
Tutorial_IconFileLabel,Icon File:,Arquivo do ícone:,,tutorial setting icon file label
Tutorial_VideoSettingsLabel,Optional video settings,Configurações de vídeo opcional,,tutorial settings optional video label
Tutorial_VideoUrlLabel,Video URL:,URL do vídeo:,,tutorial setting label
Tutorial_VideoHtmlLabel,HTML Video Page:,Página de vídeo HTML:,,tutorial setting label
Tutorial_StartPageLabel,HTML Start Page:,Página inicial HTML:,,tutorial setting label
Tutorial_Settings_Description,Tutorial Content Settings:,Configurações do conteúdo do tutorial:,,tutorial setting description
Tutorial_Dock_Title,Tutorial,Tutorial,,tutorial dock tab title
Tutorial_FileMissing,Could not find {0},Não foi possível encontrar {0},,tutorial missing file message
Tutorial_DisplayNameMissing,Display name must be set,O nome de exibição deve ser definido,,tutorial missing display name message
Tutorial_PurchaseFailed,Error acquiring tutorial: {0},Erro ao adquirir o tutorial: {0},,tutorial purchase error message
Tutorial_CreateInfo,Add content to Included Files "TutorialContent" folder,Adicione conteúdo à pasta "TutorialContent" de Arquivos Incluídos,,tutorial package create info label
Tutorial_CreateInfo2,Add files for the user to import to Included Files "TutorialResources" folder,Adicione arquivos para o usuário importar à pasta "TutorialResources" de Arquivos Incluídos,,tutorial package create info label
Tutorial_UpdateAvailableNotification,Update Available: {0},Atualização disponível: {0},,tutorial package update available notification
Demo_PurchaseFailed,Error Acquiring Demo: {0},Erro ao adquirir demonstração: {0},,demo purchase error message
Demo_Download_Error,Error Downloading Demo: '{0}',Erro ao baixar demonstração: '{0}',,demo download error
yyzimporter_message,YYZ Importer,Importar YYZ,,YYZ Importer Message Title
yyzimporter_failed,Failed to import YYZ,Falha ao importar YYZ,,Failed to import YYZ error message
yyzexport_message,YYZ Exporter,Exportar YYZ,,YYZ Exporter Message Title
yyzexport_success,YYZ Exported Successfully,YYZ exportado com sucesso,,YYZ Exported Successfully
yyzexport_failed,YYZ Export Failed,Falha ao exportar YYZ,,YYZ Export Failed
InheritFromDialog_Title,Inherit From Project,Herdar do projeto,,title for inherit from project dialog
GMLVisualEditor_Menu_Workspace,Workspace,Espaço de trabalho,,GML Visual Editor Workspace caption
GMLVisualEditor_Menu_Save,Save,Salvar,,GML Visual Editor Workspace Save caption
GMLVisualEditor_Menu_Reload,Reload,Recarregar,,GML Visual Editor Workspace Reload caption
GMLVisualEditor_CMenu_Preview,Live Preview,Prévia ao vivo,,GML Visual Editor Workspace Reload caption
GMLVisualEditor_LivePreviewTitle,GML Preview,Pré-visualização do GML,,GML Visual live preview tab title
GMLVisualNodeWindow_CMenu_PanToThis,Pan,Deslocar,,GML Visual node window context menu
GMLVisualNodeWindow_CMenu_Copy,Copy,Copiar,,GML Visual node window context menu
GMLVisualNodeWindow_CMenu_Cut,Cut,Cortar,,GML Visual node window context menu
GMLVisualNodeWindow_CMenu_Help,Show Help...,Mostrar ajuda...,,GML Visual node window context menu
GMLVisualNodeWindow_CMenu_Paste,Paste,Colar,,GML Visual node window context menu
GMLVisualNodeWindow_CMenu_CollapseAll,Collapse All,Recolher tudo,,GML Visual node window context menu collapse all nodes
GMLVisualNodeWindow_CMenu_ExpandAll,Expand All,Expandir tudo,,GML Visual node window context menu expand all nodes
GMLVisualNodeWindow_CMenu_Evaluate,Evaluate...,Avaliar...,,GML Visual node window context menu
ggs_graphics_scale,Scaling,Ajuste de escala,,Game Settings Graphics Scale title
ggs_graphics_scale_keepaspectratio,Keep aspect ratio,Manter taxa de proporção,,Game Settings Graphics Scale - Keep Aspect Ratio option
ggs_launchscreen_fill,Launchscreen fill,Preenchimento da tela de inicialização,,Launchscreen fill
ggs_graphics_scale_fullscale,Full scale,Escala real,,Game Settings Graphics Scale - Full scale option
ggs_version,Version,Versão,,Game Settings Version title
ImagePath_ImageError,Error Selecting Image,Erro ao selecionar imagem,,Error when using image_path gadget to select an image
ImagePath_NotExpectedDimensions,The image is expected to be of {0}x{1} but received {2}x{3},"A imagem esperada deveria ser {0}x{1}, mas foi recebida {2}x{3}",,Image wrong size with 0x1 being expected size and 2x3 being the image size
ImagePath_NotExpectedAlpha,The image is expected to have an alpha channel (i.e. be 32-bit),"A imagem esperada deve ter um canal alfa (ou seja, 32 bits)",,The image needs to have an alpha channel but the selected one does not
ImagePath_FileError,Cannot access file: {0},Não é possível acessar o arquivo: {0},,Error when trying to access file where 0 is the filename
ImagePath_NotExpectedFormat,Selected image is not a valid '{0}' format.,A imagem selecionada não tem o formato válido “{0}”.,,invalid image format message
ggs_windows_save_localappdata,%localappdata%\<Game Name>,%localappdata%\<Game Name>,,Save Path to Local App Data
ggs_windows_save_appdata,%appdata%\<Game Name>,%appdata%\<Game Name>,,Save Path to Local App Data
ggs_vertex_buffer_method,Vertex Buffer Method,Método de buffer de vértices,,Vertex Buffer Method
ggs_graphics_vbuffer_fast,Fast,Rápido,,Fast vertex buffer method
ggs_graphics_vbuffer_compatible,Compatible,Compatível,,Compatible vertex buffer method
ggs_graphics_vbuffer_most_compatible,Most Compatible,Mais compatível,,Most Compatible vertex buffer method
ggs_texturepage_256,256x256,256x256,,256x256 Texture Page Size
ggs_texturepage_512,512x512,512x512,,512x512 Texture Page Size
ggs_texturepage_1024,1024x1024,1024x1024,,1024x1024 Texture Page Size
ggs_texturepage_2048,2048x2048,2048x2048,,2048x2048 Texture Page Size
ggs_texturepage_4096,4096x4096,4096x4096,,4096x4096 Texture Page Size
ggs_texturepage_8192,8192x8192,8192x8192,,8192x8192 Texture Page Size
ggs_certificate_install,Install,Instalar,,Install Certificate
ggs_win8_logo_foreground_light,Light,Claro,,Light foreground text on Windows 8 logo
ggs_win8_logo_foreground_dark,Dark,Escuro,,Dark foreground text on Windows 8 logo
Edit,Edit,Editar,,Edit label
