Name,English,Translation,Restrictions,Comment
SequenceDopeSheet_Components,Components,Componentes,,Components label
SequenceDopeSheet_Tracks,Tracks,Faixas,,Tracks label
SequenceDopeSheet_SelectResource,Select Asset,Selecionar Recurso,,Select resource to add as new track
SequenceDopeSheet_SelectComponent,Select Component,Selecionar componente,,Select component to add as new track
SequenceDopeSheet_SearchResults,{0} of {1} results,{0} de {1} resultados,,Sequence track panel hierarchy search results
SequenceDopeSheet_SearchResultsNone,No results found,Nenhum resultado foi encontrado,,Sequence track panel hierarchy search results
Sequence_Tooltip_Dopesheet_Zoom_Bar_BG,Zoom Bar,Barra de zoom,,Zoom Bar tooltip
Sequence_Tooltip_Dopesheet_Track_New_Group,Add New Group ,Adicionar Novo Grupo ,,Add New Group tooltip
Sequence_Tooltip_Dopesheet_Track_New_ClipMask,Add New Clip Mask ,Adicionar Nova Máscara de Corte ,,Add New Clip Mask tooltip
Sequence_Tooltip_Dopesheet_Track_Add,Add Track,Adicionar faixa,,Add Track tooltip
Sequence_Tooltip_Dopesheet_Track_Copy,Duplicate Track,Duplicar faixa,,Duplicate Track tooltip
Sequence_Tooltip_Dopesheet_Track_Delete,Delete Track,Excluir faixa,,Delete Track tooltip
SequenceHierarchy_Tooltip_KeyNavPrev,Jump to previous key,Ir para chave anterior,,Jump to prev key tooltip
SequenceHierarchy_Tooltip_KeyNavNext,Jump to next key,Ir para próxima chave,,Jump to next key tooltip
SequenceHierarchy_Tooltip_KeyToggleOn,Toggle key on,Botão de alternância ativado,,Toggle key on tooltip
SequenceHierarchy_Tooltip_KeyToggleOff,Toggle key off,Botão de alternância desativado,,Toggle key on tooltip
SequenceHierarchy_Tooltip_AddParameter,Add parameter track,Adicionar faixa de parâmetro,,Add parameter track tooltip
SequenceHierarchy_Tooltip_KeyEditorLink,Link values,Vincular valores,,Link values tooltip
SequenceHierarchy_Tooltip_ToggleVisibility,Toggle visiblity,Alternar visibilidade,,Toggle visiblity tooltip
SequenceHierarchy_Tooltip_ToggleLocked,Toggle lock,Alternar bloqueio,,Toggle lock tooltip
SequenceHierarchy_Tooltip_ChangeColour,Change track colour,Alterar cor da faixa,,Change track colour tooltip
ListBoxEnum_eSequencePlayback_Normal,Normal,Normal,,Normal playback
ListBoxEnum_eSequencePlayback_Loop,Loop,Loop,,Loop playback
ListBoxEnum_eSequencePlayback_PingPong,Ping Pong,Pingue-pongue,,Ping pong playback
Tooltip_eSequencePlayback_Normal,Normal playback of the indicated range,Reprodução normal do intervalo indicado,,Normal playback
Tooltip_eSequencePlayback_Loop,Looped playback of the indicated range,Reprodução em loop do intervalo indicado,,Loop playback
Tooltip_eSequencePlayback_PingPong,Ping pong between start and end of indicated range,Pingue-pongue entre o início e o final do intervalo indicado,,Ping pong playback
Tooltip_EventsRaised,Events raised:\n{0},Eventos gerados:\n{0},,Events raised tooltip
CodeKey_ScriptDeletedTitle,Script missing,Script ausente,,Message title
CodeKey_ScriptDeleted,Script resource has been deleted.,O recurso do script foi excluído.,,Script deleted message
CodeKey_TabTitle,Sequence Keyframe,Quadro-chave em sequência,,Keyframe code tab title
CurveKey_OpenInEditor,Open Editor...,Abrir editor...,,Open an animation curve in a pop-out editor
AnimCurve_ToggleChannel,Toggle channel visibility,Alternar visibilidade do canal,,Toggle channel visibility tooltip
ResourceNode_Edit,Edit,Editar,,Edit resource from resource tree
ResourceNode_EditAll,Edit All,Editar tudo,,Edit All resource from a resource tree group
AssetBrowser_Title,Asset Browser,Navegador de recursos,,Asset browser window title
AssetBrowser_Title_Arg,Asset Browser: {0},Navegador do ativo: {0},,Asset browser window title with argument
AssetBrowser_CreateNew,Create Asset,Criar Recurso,,Asset browser create new
AssetBrowser_ImportAssets,Import Asset,Importar ativo,,Asset browser import assets
AssetBrowser_SortFilter,Filter/Sort,Filtrar/classificar,,Asset browser filter/sort tooltip
AssetBrowser_NoResults,No results found,Nenhum resultado foi encontrado,,Asset browser no results
AssetBrowser_SortAZ,A-Z,A-Z,,asset browser sort type label
AssetBrowser_SortZA,Z-A,Z-A,,asset browser sort type label
AssetBrowser_SortGroupFirst,Groups First,Grupos Primeiro,,asset browser sort type label
AssetBrowser_SortCustom,Custom Order,Pedidos personalizados,,asset browser custom sort order label
AssetBrowser_QuickAccess,Quick Access,Acesso rápido,,quick access node title
AssetBrowser_Recent,Recent,Recente,,quick access node recent title
AssetBrowser_Favourites,Favourites,Favoritas,,quick access node title
AssetBrowser_RoomOrder,Room Order,Ordem dos cenas,,quick access node title
AssetBrowser_RoomInheritance,Room Inheritance,Herança de cena,,room inheritance title
AssetBrowser_RoomManager,Room Manager,Gerenciador de cena,,room manager title
AssetBrowser_SavedFilters,Saved Searches,Pesquisas salvas,,quick access node title
AssetBrowser_EditTags,Edit Tags,Editar tags,,edit tags label
AssetBrowser_CreateGroup,Create Group,Criar grupo,,create group
AssetBrowser_Create,Create,Criar,,create asset
AssetBrowser_CreateResourceType,Create {0},Criar {0},,create (resource type name)
AssetBrowser_AddFavourite,Favourite,Favorita,,add to favourites
AssetBrowser_RemoveFavourite,Unfavourite,Desmarcar como favorito,,remove from favourites or unfavourite
AssetBrowser_DefaultGroupName,group,grupo,,default name for new group/folder
AssetBrowser_NewAssetBrowser,Open in new Asset Browser,Abrir no navegador do ativo,,open in new asset browser
AssetBrowser_ClearFavourites,Clear Favourites,Limpar favoritos,,asset browser clear favourites menu entry
AssetBrowser_ClearRecent,Clear Recent Items,Limpar Itens Recentes,,asset browser clear recently edited menu entry
AssetBrowser_SaveCurrentFilter,Save Current Filter,Salvar filtro atual,,asset save current filter menu entry
AssetBrowser_ResetFilter,Reset Filter,Redefinir filtro,,reset filter menu entry
AssetBrowser_AllTypes,Any Types,Qualquer tipo,,all types label
AssetBrowser_AllTags,Any Tags,Qualquer tag,,all tags label
AssetBrowser_ApplyFilter,Apply Filter,Aplicar filtro,,apply filter menu entry
AssetBrowser_ApplyTagFilter,Filter by Tag,Filtrar por tag,,apply tag filter menu entry
AssetBrowser_Rename,Rename,Renomear,,rename
AssetBrowser_Edit,Edit,Editar,,Edit resource from resource tree
AssetBrowser_EditAll,Edit All,Editar tudo,,Edit All resource from a resource tree group
AssetBrowser_Tags,Tags,Tags,,tags
AssetBrowser,Asset Browser,Navegador de recursos,,AssetBrowser preference group heading
AssetBrowser_ResourceDelete_Confirm,Are you sure you want to delete {0}?,Tem certeza de que deseja excluir {0}?,,asset tree delete confirmation label
AssetBrowser_ResourceDelete_ConfirmWithDependents,Are you sure you want to delete {0}?\nIt is referenced by {1},Tem certeza de que deseja excluir {0}?\nEle é referenciado por {1},,asset tree delete with known dependents confirmation label
AssetBrowser_MultipleResourceDelete_Confirm,Are you sure you want to delete {0} Assets: {1}?,Tem certeza de que deseja excluir {0} Recursos: {1}?,,delete multiple resources confirmation label
AssetBrowser_ResourceDelete_Events_Confirm,Are you sure you want to delete {0}?\nCollision events with deleted objects will also be deleted,Tem certeza de que deseja excluir {0}?\nEventos de colisão com objetos excluídos também serão excluídos,,Resource tree delete events confirmation label
AssetBrowser_MultipleResourceDelete_Events_Confirm,Are you sure you want to delete these Assets: {0}?\nCollision events with deleted objects will also be deleted,Tem certeza de que deseja excluir estes Recursos: {0}?\nOs eventos de colisão com objetos excluídos também serão excluídos,,Resource tree delete confirmation label
AssetBrowser_AssignSpriteToObject,Assign Sprite to Object,Atribuir Sprite ao objeto,,assign sprite to object
AssetBrowser_CreateChildRoom,Create Child Room,Criar cena filho,,create child room
AssetBrowser_MultipleResourceSelection,<Multiple Assets>,<Vários Recursos>,,multiple resource selected
AssetBrowser_ColourCellTT,Right-click to edit,Clique com o botão direito para editar,,colour picker cell tooltip
AssetBrowser_ColourPicker,Colour Picker,Seletor de cores,,colour picker title
AssetBrowser_ResourceTreeEmpty,No Assets,Nenhum Recurso,,empty resource tree label
AssetBrowser_SearchEmpty,No Search Results,Sem resultados de pesquisa,,no search results label
AssetBrowser_ExpandChildren,Expand Children,Expandir filho,,expand child nodes menu entry
AssetBrowser_ConfigEditor,Config Editor,Configurar editor,,config editor
AssetBrowser_ItemCountSingle,{0} item,{0} item,,item count label singular
AssetBrowser_ItemCountPlural,{0} items,{0} itens,,item count label plural
AssetBrowser_SelectedCount,{0} selected,{0} selecionado,,selected count label
AssetBrowser_Filters,Filters,Filtros,,filters
AssetBrowser_ClearFilters,Clear Filters,Limpar filtros,,clear filters
AssetBrowser_AssetType,Asset Type,Tipo de Recurso,,asset type
AssetBrowser_SaveSearch,Save Search,Salvar pesquisa,,save search
AssetBrowser_ListView,List View,Exibição da lista,,list view
AssetBrowser_GridView,Grid View,Exibição da grade,,grid view
AssetBrowser_ShowTreeLocation,Show Tree Location,Mostrar local da árvore,,show main tree location
AssetBrowser_GameOptions,Game Options,Opções do jogo,,game options
AssetBrowser_IncludedFiles,Included Files,Arquivos incluídos,,included files
AssetBrowser_TTSortFilter,Sort/Filter,Classificar/Filtrar,,sort filter button tooltip
AssetBrowser_TTMenu,Menu,Menu,,menu button tooltip
ListBoxEnum_eAssetListStyle_Grid,Grid,Grade,,
ListBoxEnum_eAssetListStyle_List,List,Lista,,
ConfigEditor_CreateConfig,Create,Criar,,create config
ConfigEditor_DeleteConfig,Delete,Excluir,,delete config
ConfigEditor_AddConfig,Add Config,Adicionar configuração,,add config
ConfigEditor_RenameConfig,Rename,Renomear,,rename config
ConfigEditor_SetConfig,Set Config,Definir configuração,,set config
AnimCurveEditor_CurveType,Curve Type:,Tipo de curva:,,curve type
AnimCurveEditor_Interpolation,Interpolation,Interpolação,,interpolation
AnimCurveEditor_Graph,Graph,Gráfico,,graph
AnimCurveEditor_Curves,Curves,Curvas,,curves
AnimCurve_Editor_AddCurve,Add Curve,Adicionar curva,,add curve
AnimCurveEditor_ToggleVis,Toggle Visibility,Alternar visibilidade,,toggle visibility
AnimCurveEditor_MultipleCurves,<Multiple Curves>,<Várias curvas>,,anim curve editor multiple curves selected
AnimCurve_CurveType,Curve Type,Tipo de curva,,curve type
AnimCurve_Ease,Ease,Fácil,,ease
AnimCurve_EaseIn,Ease-In,Naturalidade-Entrando,,ease-in
AnimCurve_EaseOut,Ease-Out,Naturalidade-Saindo,,ease-out
AnimCurve_EaseInOut,Ease-In-Out,Naturalidade-Entrando-Saindo,,ease in-out
AnimCurve_Rename,Rename,Renomear,,rename
AnimCurve_Delete,Delete,Excluir,,delete
AnimCurve_DefaultChannelName,curve{0},curva{0},,default channel name
assetbrowser_defaultfolders,Create default folders in new project,Criar pastas padrão no novo projeto,,create default folders
assetbrowser_maxrecentlyedited,Maximum recently edited items,Máximo de itens editados recentemente,,max recently edited count
assetbrowser_palette_entry_count,Colour palette size,Tamanho da paleta de cores,,colour palette entry count
assetbrowser_apply_qacolours,Apply Asset colours in Quick Access,Aplicar cores do Recurso em Acesso Rápido,,apply colours in quick access 
assetbrowser_group_colour_override,Group colours override child colours,Cores do grupo substituem as cores filho,,group colour override
assetbrowser_asset_list_style,Create Asset dialogue style,Criar estilo da caixa de diálogo do Recurso,,create resource dialog style
assetbrowser_defaultsortorder,Default sort order for new Asset Browsers,Ordem de classificação padrão para novos Navegadores de Recursos,,default sort order for new Asset Browsers
assetbrowser_defaultfoldersfirst,Default sort folders first,Classificar pastas padrão primeiro,,default sort folders first
assetbrowser_duplicatefoldermove,Automatic response to duplicate group name error,Resposta automática para duplicar erro de nome de grupo,,Automatically dismiss duplicate folder error
assetbrowser_show_quickaccess,Show Quick Access,Mostrar acesso rápido,,asset browser quick access enabled pref
preferences_updateandroidtoolsversion,Pre-populate SDK values to chosen API Level,Preencher previamente os valores do SDK para escolher o nível da API,,Pre-populate SDK values to chosen API Level
preferences_android_genadaptive_icon,Generate Foregrounds From File:,Gerar primeiro plano do arquivo:,,generate adaptive icons widget foreground file label
preferences_android_genadaptive_bg,Generate Backgrounds From File:,Gerar planos de fundo do arquivo:,,generate adaptive icons widget background file label
preferences_android_genadaptive_btn,Generate,Gerar,,generate adaptive icons widget icon file button
preferences_android_genadaptive_preview,Preview Adaptive Icons:,Ícones adaptáveis da prévia:,,generate adaptive icons widget preview label
preferences_android_genadaptive_mask,Preview Icon Shape:,Forma do ícone da prévia:,,generate adaptive icons widget mask label
preferences_android_genadaptive_mask_caption,Select a mask..,Selecionar uma máscara...,,generate adaptive icons widget mask selection default caption
preferences_android_genadaptive_mask_none,No mask,Sem máscara,,generate adaptive icons widget mask selection no mask
preferences_android_genadaptive_mask_square,Square mask,Máscara quadrada,,generate adaptive icons widget mask selection square mask
preferences_android_genadaptive_mask_circle,Circle mask,Máscara circular,,generate adaptive icons widget mask selection circle mask
preferences_android_genadaptive_mask_roundedsquare,Rounded square mask,Máscara quadrada arredondada,,generate adaptive icons widget mask selection rounded square mask
preferences_android_genadaptive_mask_squircle,Squircle mask,Máscara squircle,,generate adaptive icons widget mask selection squircle mask
preferences_android_genadaptive_mask_teardrop,Teardrop mask,Máscara lágrima,,generate adaptive icons widget mask selection teardrop mask
ProgressBar_DownloadManual,Downloading Manual,Baixando manual,MAX of 18 characters,Progress bar info
Manual_Language_Selection,Manual Language,Idioma do manual,,Manual Language Selection label
LocalisedManual_NotInstalled,Would you like to download this manual?,Gostaria de baixar o manual?,,Localised manual not installed text
LocalisedManual_NotInstalledTitle,Localised manual not installed,O manual localizado não está instalado,,Localised manual not installed title
LocalisedManual_NotLocalisedTitle,Manual not localised,Manual não localizado,,Manual no localised title
LocalisedManual_NotLocalised,The manual is not currently localised for this language,O manual não está localizado no momento para este idioma,,Manual not localised message
LocalisedManual_DownloadFailedTitle,Manual download failed,Falha no download do manual,,The download of the manual failed
LocalisedManual_DownloadFailed,An error occurred while trying to download the manual,Um erro aconteceu ao tentar baixar o manual,,Error while downloading the manual
RuntimeDownload_FailedTitle,Runtime install incomplete,Instalação do Runtime incompleta,,Runtime download failed title
RuntimeDownload_Failed,The selected runtime could not fully install,O Runtime selecionado não pôde ser instalado completamente,,Runtime download failed message
sourcecontrolgit_noauthfound,No User/Pass authentication details found for {0},As informações de autenticação de senha/usuário para {0} não foram encontradas,,No User/Pass authentication details found for the given url
sourcecontrolgit_nosshfound,No SSH Keypair authentication details found for {0},As informações de autenticação de chaves de SSH para {0} não foram encontradas,,No SSH authentication details found for the given url
sourcecontrolgit_projecthasrepository,Project already has repository!,O projeto já tem um repositório!,,This project already has a repository
sourcecontrolgit_creatingrepo,Creating Repository at {0},Criando um repositório em {0},,Creating repository at the given url
sourcecontrolgit_importingrepo,Importing Project to {0},Importando projeto para {0},,Importing project to the given url
sourcecontrolgit_nocommitsinrepoonpull,There are no commits to pull. Please commit and push first,Não há confirmações para efetuar pull. Confirme e efetue push primeiro,,There are no commits when trying to pull
sourcecontrolgit_pull_uptodate,Up to date,Atualizado,,Repostory is up to date
sourcecontrolgit_pull_complete,Pull Complete,Pull concluído,,Pull Competed
sourcecontrolgit_nothingtopush,There are no commits to push,Não há confirmações para efetuar push.,,There are no commits to push
sourcecontrolgit_push_complete,Push Complete,Push concluído,,Push Completed
keystore_alias_password,Alias Password,Senha do alias,,Alias Password Label
ConfigurationProblem_MacDevice,Configuration Problem : No Mac device found. Check your target settings.,Problema de configuração: Nenhum dispositivo Mac foi encontrado. Verificar as configurações do destino.,,Configuration Problem : No Mac device found. Check your target settings.
ConfigurationProblem_MacID,Configuration Problem : Game Options - Mac / General / App Id is not set.,Problema de configuração: Opções do jogo: Mac/Geral/ID do aplicativo não está definido.,,Configuration problem when no mac app id set
ConfigurationProblem_MacAppOutput,Configuration Problem : Game Options - Mac / General / App Output is not set.,Problema de configuração: Opções do jogo: Mac/Geral/Saída do aplicativo não está definida.,,Configuration Problem : Game Options - Mac / General / App Output is not set.
ConfigurationProblem_MacSteamworksSDK,Configuration Problem : Steamworks SDK install not found. Check your Preferences.,Problema de configuração: Instalação do SDK dos trabalhos de Steam não encontrada. Verificar suas preferências.,,Configuration Problem : Steamworks SDK install not found. Check your Preferences.
ConfigurationProblem_MacAppStoreSteam,Configuration Problem : Cannot build for Mac App Store and Steam at the same time.,Problema de configuração: Não é possível compilar para Mac App Store e Steam ao mesmo tempo.,,Configuration Problem : Cannot build for Mac App Store and Steam at the same time.
ConfigurationProblem_MacSteamIDMissing,Configuration Problem : Mac Build for Steam selected but Steam App Id is not set.,"Problema de configuração: Compilação do Mac para Steam selecionada, mas o ID do aplicativo Steam não está definido.",,Configuration Problem : Mac Build for Steam selected but Steam App Id is not set.
ConfigurationProblem_MacSteamIDInvalid,Configuration Problem : Mac Build for Steam has invalid Steam App Id.,Problema de configuração: A compilação do Mac para Steam tem um ID do aplicativo Steam inválido.,,Configuration Problem : Mac Build for Steam has invalid Steam App Id.
ConfigurationProblem_iOSInstallPath,Configuration Problem : iOS install path not set. Check your Preferences.,Problema de configuração: o caminho de instalação do iOS não está definido. Verificar suas preferências.,,Configuration Problem : iOS install path not set. Check your Preferences.
ConfigurationProblem_iOSDevice,Configuration Problem : No iOS device found. Check your target settings.,Problema de configuração: Nenhum dispositivo iOS foi encontrado. Verificar as configurações do destino.,,Configuration Problem : No iOS device found. Check your target settings.
ConfigurationProblem_LinuxDevice,Configuration Problem : No Linux device found. Check your target settings.,Problema de configuração: Nenhum dispositivo Linux foi encontrado. Verificar as configurações do destino.,,Configuration Problem : No Linux device found. Check your target settings.
ConfigurationProblem_LinuxSteamsworksSDK,Configuration Problem : Steamworks SDK install not found. Check your Preferences.,Problema de configuração: Instalação do SDK dos trabalhos de Steam não encontrada. Verificar suas preferências.,,Configuration Problem : Steamworks SDK install not found. Check your Preferences.
ConfigurationProblem_LinuxSteamIDMissing,Configuration Problem : Linux Build for Steam selected but Steam App Id is not set.,"Problema de configuração: Compilação do Linux para Steam selecionada, mas o ID do aplicativo Steam não está definido.",,Configuration Problem : Linux Build for Steam selected but Steam App Id is not set.
ConfigurationProblem_LinuxSteamIDInvalid,Configuration Problem : Linux Build for Steam has invalid Steam App Id.,Problema de configuração: A compilação do Linux para Steam tem um ID do aplicativo Steam inválido.,,Configuration Problem : Linux Build for Steam has invalid Steam App Id.
ConfigurationProblem_LinuxIcon,Configuration Problem : Icon file is not a valid PNG format image.,Problema de configuração: O arquivo do ícone não é uma imagem de formato PNG válida.,,Configuration Problem : Linux icon file invalid
ConfigurationProblem_WindowsPackageName,Configuration Problem : Windows Package requires a valid Display Name.,Problema de configuração: O pacote do Windows requer um nome de exibição válido.,,Configuration Problem : Windows Package requires a valid Display Name.
ConfigurationProblem_WindowsExeName,Configuration Problem : Windows Package requires a valid Executable Name.,Problema de configuração: O pacote do Windows requer um nome de executável válido.,,Configuration Problem : Windows Package requires a valid Executable Name.
ConfigurationProblem_WindowsIcon,Configuration Problem : Icon file is not a valid '.ico' format image.,Problema de configuração: O arquivo do ícone não é uma imagem de formato “.ico” válida.,,Configuration Problem : Icon file is not a valid '.ico' format image.
ConfigurationProblem_WindowsVSPath,Configuration Problem : Windows Visual Studio Path needs to be set to point to Visual Studio (.bat) batch file.,Problema de configuração: O caminho do Visual Studio do Windows precisa ser definido para um ponto do arquivo do lote do Visual Studio (.bat).,,Configuration Problem : Windows Visual Studio Path needs to be set to point to Visual Studio (.bat) batch file.
ConfigurationProblem_WindowsSteamworksSDK,Configuration Problem : Steamworks SDK install not found. Check your Preferences.,Problema de configuração: Instalação do SDK dos trabalhos de Steam não encontrada. Verificar suas preferências.,,Configuration Problem : Steamworks SDK install not found. check your Preferences.
ConfigurationProblem_WindowsSteamIDMissing,Configuration Problem : Windows Build for Steam selected but Steam App Id is not set.,"Problema de configuração: Compilação do Windows para Steam selecionada, mas o ID do aplicativo Steam não está definido.",,Configuration Problem : Windows Build for Steam selected but Steam App Id is not set.
ConfigurationProblem_WindowsSteamIDInvalid,Configuration Problem : Windows Build for Steam has invalid Steam App Id.,Problema de configuração: A compilação do Windows para Steam tem um ID do aplicativo Steam inválido.,,Configuration Problem : Windows Build for Steam has invalid Steam App Id.
ConfigurationProblem_PS4SDK,Configuration Problem : PS4 SDK not found. Check your Preferences.,Problema de configuração: SDK do PS4 não encontrado. Verificar suas preferências.,,Configuration Problem : PS4 SDK not found. Check your Preferences.
ConfigurationProblem_PS4Tools,Configuration Problem : PS4 Tools directory not found. Check your Preferences.,Problema de configuração: Diretório de ferramentas do PS4 não encontrado. Verificar suas preferências.,,Configuration Problem : PS4 Tools directory not found. Check your Preferences.
ConfigurationProblem_PS4VSPath,Configuration Problem : PS4 Visual Studio Path needs to be set to point to Visual Studio (.bat) batch file.,Problema de configuração: O caminho do Visual Studio do PS4 precisa ser definido para um ponto do arquivo do lote do Visual Studio (.bat).,,Configuration Problem : PS4 Visual Studio Path needs to be set to point to Visual Studio (.bat) batch file.
ConfigurationProblem_tvOSDevice,Configuration Problem : No tvOS device found. Check your target settings.,Problema de configuração: Nenhum dispositivo tvOS foi encontrado. Verificar as configurações do destino.,,Configuration Problem : No tvOS device found. Check your target settings.
ConfigurationProblem_tvOSPath,Configuration Problem : tvOS install path not set. Check your Preferences.,Problema de configuração: o caminho de instalação do tvOS não está definido. Verificar suas preferências.,,Configuration Problem : tvOS install path not set. Check your Preferences.
ConfigurationProblem_WindowsUWPDevice,Configuration Problem : No Windows UWP device found. Check your target settings.,Problema de configuração: Nenhum dispositivo do Windows UWP foi encontrado. Verificar as configurações do destino.,,Configuration Problem : No Windows UWP device found. Check your target settings.
ConfigurationProblem_WindowsUWPSDK,Configuration Problem : Windows 10 SDK not found at path given in Windows UWP Preferences.,Problema de configuração: SDK do Windows 10 não encontrado em um caminho nas preferências do Windows UWP.,,Configuration Problem : Windows 10 SDK not found at path given in Windows UWP Preferences.
ConfigurationProblem_WindowsUWPVSPath,Configuration Problem : Windows UWP Visual Studio Path needs to be set to point to Visual Studio (.bat) batch file.,Problema de configuração: O caminho do Visual Studio do Windows UWP precisa ser definido para um ponto do arquivo do lote do Visual Studio (.bat).,,Configuration Problem : Windows UWP Visual Studio Path needs to be set to point to Visual Studio (.bat) batch file.
