Name,English,Translation,Restrictions,Comment
__Priority,0,0,,Order of language importance. Allows other packs to supplement or replace sections
_Argument0,{0},{0},,single unlocalised argument
_Error,Error: {0},Ошибка: {0},,General error prefix
_Language,English,Russian,,Language name - in English
_LanguageNative,English,Русский,,Language name in the native language
_LanguageCode,ru,ru,,standard windows os language code this pack represents (can be primary code only ie. en or primary-secondary ie. en-GB)
_GameMaker2016,GameMaker,GameMaker,,IDE title
_MANUAL_LOCATION,http://zeus.yoyogames.com/GMS2_English-master.zip,http://zeus.yoyogames.com/GMS2_English-master.zip,,Location of language manual
_MANUAL_ONLINE_URL,https://manual-ru.yoyogames.com,https://manual-ru.yoyogames.com,,online manual url
_TUTORIALS_ONLINE_URL,https://www.yoyogames.com/ru/tutorials,https://www.yoyogames.com/ru/tutorials,,Location of Tutorials url
$win_OpenInExplorer,Open In Explorer,Открыть в Explorer,,Windows version of Open In Explorer
$win_OpenProjectInExplorer,Open Project In Explorer,Открыть проект в Explorer,,Windows version of Open Project In Explorer
$win_ShowLogFileInExplorer,Open Log In Explorer,Открыть лог в Explorer,,Windows version of Show Log In Explorer
$win_explorer,explorer,explorer,,windows version of explorer
$mac_explorer,finder,finder,,mac version of explorer
$mac_OpenInExplorer,Show In Finder,Показать в Finder,,Mac version of Open In Explorer
$mac_OpenProjectInExplorer,Show Project In Finder,Показать проект в Finder,,Mac version of Open Project In Explorer
$mac_ShowLogFileInExplorer,Reveal Log In Finder,Открыть лог в Finder,,Mac version of Show Log In Explorer
$win_ctrl,Ctrl,Ctrl,,Windows version of ctrl key
$mac_ctrl,Command,Command,,Mac version of ctrl key
$win_FileMenuExit,Exit,Выход,,Windows version of the Exit main menu entry
$mac_FileMenuExit,Quit,Выйти,,Mac version of the Exit main menu entry
$win_IDEMenuHelpAbout,About,О программе,,Windows version of the About main menu entry
$mac_IDEMenuHelpAbout,About GameMaker,О GameMaker,,Windows version of the About main menu entry
$win_IDEMenuViews,Windows,Окна,,Windows version of the views menu entry
$mac_IDEMenuViews,Window,Окно,,Mac version of the views menu entry
$win_LaptopRHSKeys,Right Control and Right Alt,Правый Control и правый Alt,,Windows version of laptop mode keys
$mac_LaptopRHSKeys,Right Command and Right Alt,Правый Command и правый Alt,,Mac version of laptop mode keys
$win_LaptopLZoomKey,Left Control,Левый Control,,Windows laptop mode zoom key
$mac_LaptopLZoomKey,Left Command,Левый Command,,Mac laptop mode zoom key
Account_Menu_Login,Login,Войти,,"Account menu ""Login"""
Account_Menu_Logout,Logout,Выйти,,"Acount menu ""Logout"""
Account_Menu_ManageAccount,Manage Account,Управлять аккаунтом,,"Account menu ""Account"""
AnimationManager_InvalidTransition,The transition specified '{0}' is not valid,Указанный переход '{0}' недействителен,,The transition specified in the animation json is not a valid value
BackgroundLayer_HSpeed,Horizontal Speed,Горизонтальная скорость,,Numeric textbox label for horizontal scroll speed
BackgroundLayer_HTile,Horizontal Tile,Горизонтальная плитка,,Checkbox label for horizontal tiling
BackgroundLayer_NoBackground,<no background>,<no background>,,no background selected caption for the background layer button
BackgroundLayer_PosX,X Offset,Отступ X,,Numeric textbox label for x pos offset
BackgroundLayer_PosY,Y Offset,Отступ Y,,numeric textbox label for y pos offset
BackgroundLayer_Stretch,Stretch,Растянуть,,Checkbox label for stretch
BackgroundLayer_VSpeed,Vertical Speed,Вертикальная скорость,,Numeric textbox label for vertical scroll speed
BackgroundLayer_VTile,Vertical Tile,Вертикальная плитка,,Checkbox label for vertical tiling
Breakpoints,Breakpoints,Точки разрыва,,Breakpoints
Breakpoint_Delete,Delete Breakpoint,Удалить точку разрыва,,delete breakpoint menu option
Breakpoint_GotoCode,Go To Code,Перейти к коду,,breakpoint show code menu option
Breakpoint_MenuToggle,Toggle Breakpoint,Переключить точку разрыва,,toggle breakpoint menu option
Breakpoint_Help,"There are no breakpoints to display.\nTo place one, press F9 on the desired line in a code editor.",Нет точек разрыва для отображения.\nДля размещения точки разрыва нажмите F9 на требуемой линии в редакторе кода.,,Breakpoint help text to be displayed when there are no breakpoints
Build_FailedCompile,ERROR: Project failed to compile: error code {0},ОШИБКА: Ошибка составления проекта: код ошибки {0},,Error message when the project fails to compile
Build_FailedDeploy,ERROR: Project failed to deploy: error code {0},ОШИБКА: Ошибка развертывания проекта: код ошибки {0},,Error message when the project fails to deploy
Build_FailedRun,ERROR: Project failed to run: error code {0},ОШИБКА: Ошибка работы проекта: код ошибки {0},,Error message when the project fails to run
Button_Add,Add,Добавить,,Add button
Button_Cancel,Cancel,Отменить,,cancel button
Button_Delete,Delete,Удалить,,Delete button
Button_Done,Done,Готово,,Done button
Button_Import,Import,Импортировать,,import button label
Button_Manage,Manage,Управлять,,Manage button
Button_No,No,Нет,,No
Button_OK,OK,OK,,ok button
Button_Rename,Rename,Переименовать,,Rename button
Button_Resize,Resize,Изменить размер,,resize button label
Button_Scale,Scale,Масштабировать,,Image editor - scale button
Button_Yes,Yes,Да,,Yes
Button_Next,Next,Дальше,,next button label
Button_Create,Create,Создать,,create button label
Button_Apply,Apply,Применить,,apply button label
Button_Remove_All,Remove All,Удалить все,,button label - remove all
Dialog_ResetLayout_Title,Reset Layout,Сбросить схему,,Reset layout dialog title
Dialog_ResetLayout,Resetting the project layout will close any open resources. Are you sure you want to reset the layout?,"При сбросе схемы проекта будут закрыты все открытые ресурсы. Вы уверены, что хотите сбросить схему?",,Dialog message reset layout
Dialog_ResetLayout_ChoicePref,Automatic response to resetting the project layout,Автоматический ответ на сброс схемы проекта,,Default reset layout dialog choice
LicenseNotification_TrialExpiring,Your trial is due to expire in {0} days,Ваш пробный период истекает через {0} дней,,Trial licence expiry notification
LicenseNotification_Expiring,Your licence is due to expire in {0} days,Ваша лицензия истекает через {0} дней,,Licence expiry notification
LicenseNotification_BuyNow,Buy Now,Купить сейчас,,Buy Now label
LicenseNotification_ButtonBuyNow,BUY NOW,КУПИТЬ СЕЙЧАС,,BUY NOW label
IDE_License_Label,Your licence is due to expire in {0} days,Ваша лицензия истекает через {0} дней,,IDE licence label
IDE_TrialLicense_Label,Your trial is due to expire in {0} days,Ваш пробный период истекает через {0} дней,,IDE trial licence label
Certificate_GenerateSucceeded,Successfully created certificate file: {0},Удачно созданный файл сертификата: {0},,certificate create success
Certificate_GenerateFailed,Failed to create certificate file: {0},Ошибка создания файла сертификата: {0},,certificate create failed
Certificate_FileAlreadyExists,Certificate file '{0}' already exists; please choose a new filename,Файл сертификата '{0}' уже существует; выберите новое название файла,,certificate file exists
Certificate_RequiredFieldsMissing,Name and Password fields must be set,Нужно установить поля названия и пароля,,create certificate missing fields
Certificate_FileMissing,Unable to find certificate file '{0}',Не удается найти файл сертификата '{0}',,certificate file missing
Certificate_Test_Title,Certificate Check,Проверка сертификата,,certificate test title
Certificate_PasswordFail,Password is NOT valid for certificate,Пароль НЕДЕЙСТВИТЕЛЕН для сертификата,,certificate password fail
Certificate_PasswordOK,Password is valid for certificate,Пароль действителен для сертификата,,certificate password ok
CertProperties_Heading,Set .pem certificate file and password,Установить файл сертификата .pem и пароль,,certificate properties heading
CertProperties_Heading2,(you can use an existing GameMaker marketplace certificate),(вы можете использовать существующий рыночный сертификат GameMaker),,certificate properties heading 2
CertProperties_CertificateFile,Certificate File:,Файл сертификата:,,certificate file label
CertProperties_CertificatePassword,Certificate Password:,Пароль сертификата:,,certificate password label
CertProperties_Check,Check,Проверить,,certificate properties check certificate button label
CertProperties_CheckTooltip,Check that the password is valid for the selected certficate file,Проверить действительность пароля для выбранного файла сертификата,,certificate properties check tooltip
CertProperties_CreateInfoLabel,"If you don't have a certificate, you can create one:","Если у вас нет сертификата, создайте его:",,certificate properties create info
CertProperties_CreateNewCertificate,Create new certificate,Создать новый сертификат,,certificate properties create new certificate button label
CertProperties_CreateCertificate,Create Certificate,Создать сертификат,,certificate properties create certificate button label
CertProperties_EnterCertDetails,Enter new certificate details:,Ввести данные нового сертификата:,,certificate properties enter certificate details
CertProperties_PublisherName,Publisher Name:,Имя издателя:,,cert properties author name
CertProperties_CreatePublisherAccount,Create Publisher Account,Создать аккаунт издателя,,create publisher account button label
CodeWindow_2Column,2 columns,2 колонки,,Document window layout menu option - 2columns
CodeWindow_3Column,3 columns,3 колонки,,Document window layout menu option - 3 columns
CodeWindow_Fullscreen,Fullscreen workspace tab,Вкладка полноэкранного рабочего места,,Document window layout menu option - fullscreen workspace tab
CodeWindow_Menu_Help,Keyword help,Справка по клавиатуре,,Code window help menu option
CodeWindow_Menu_ShowResource,Show resource,Показать ресурс,,Code window show resource menu option
CodeWindow_SingleColumn,Single pane,Одно окно,,Document window layout menu option - 1 column
CodeWindow_Title,Code,Код,,fullscreen code editor workspace tab title
CodeWindow_RestoreToWorkspace,Restore to Workspace,Восстановить рабочее место,,code editor restore to workspace context menu option
CodeWindow_GotoObject,Go to Object,Перейти на объект,,code editor go to object context menu option
CodeWindow_AddEvent,Add/Open Event,Добавить/открыть событие,,code editor event script add event context menu option
CodeWindow_OpenInheritedEvent,Open Inherited Event,Открыть унаследованное событие,,open inherited event context menu option
GotoLine_Title,Go To Line,Перейти на линию,,goto line dialog title
GotoLine_Label,Line Number ({0} - {1}),Число линии ({0} - {1}),,goto line label
CompileErrors,Compile Errors,Ошибки компиляции,,Compile Errors tab title
CompileErrors_NoErrors,There are no compile errors to show!,Ошибки компиляции отсутствуют.,,No compile errors message
Configuration,Configuration,Конфигурация,,Configuration
Configuration_Select,Select Configuration,Выбрать конфигурацию,,Window title for config select
Configurations,Configurations,Конфигурации,,Configurations
Configurations_Add,Add New Configuration,Добавить новую конфигурацию,,Add configuration window title
Configurations_Delete,Are you sure you want to delete configuration '{0}' and all of its children?,"Вы уверены, что хотите удалить конфигурацию «{0}» и все ее дочерние конфигурации?",,Confirm for deleting a configuration
Configurations_Delete_OtherConfigs,Are you sure? Deleting configuration '{0}' will also delete the following configurations: '{1}'.,Вы уверены? Удаление конфигурации '{0}' также приведет к удалению следующих конфигураций: '{1}'.,,Warning about deleting a configuration deleting child configs
Configurations_DeleteError,Cannot delete configuration '{0}',Нельзя удалить конфигурацию '{0}',,Cannot delete a configuration error message
Configurations_DuplicateEntryError,Cannot duplicate existing configuration name,Нельзя дублировать название существующей конфигурации,,Configuration name cannot be duplicated error message
Configurations_InvalidLicenseError,Cannot create configurations with GameMaker Trial,Нельзя создать конфигурацию с GameMaker Trial,,Cannot create configurations with the Trial version of GameMaker error message
Configurations_InvalidNameError,The configuration name '{0}' is not valid,Название конфигурации '{0}' недействительно,,Configuration name provided is invalid
Configurations_Manage,Manage Configurations,Управлять конфигурациями,,Manage Configurations window title
Configurations_NameEmptyError,New configuration name cannot be empty,Название новой конфигурации не может быть пустым,,Configuration name cannot be empty error message
Configurations_NewName,New Configuration Name,Название новой конфигурации,,New configuration label
Configurations_Parent,Parent Configuration,Родительская конфигурация,,Choose parent configuration label
Configurations_Promote,Promote,Продвигать,,Promotion of a config up the config hierarchy
Configurations_Rename,Rename Configuration,Переименовать конфигурацию,,Rename configuration
Configurations_RenameError,Cannot rename '{0}' configuration,Нельзя переименовать конфигурацию '{0}',,Configuration name cannot be renamed error message
Configurations_ConfirmPromote,Are you sure? Promoting a configuration cannot be undone,Вы уверены? Продвижение конфигурации не может быть отменено,,Confirm the user really wants to promote a config
ContextMenu_AddMenuEntry,Add Menu Entry,Добавить пункт меню,,Context menu option to add a menu entry at the end of the context menu
ContextMenu_AddMenuEntryAfter,Add Menu Entry Below,Добавить пункт меню ниже,,Context menu option to add a menu entry below the selected entry
ContextMenu_AddMenuEntryBefore,Add Menu Entry Above,Добавить пункт меню выше,,Context menu option to add a menu entry above the selected entry
ContextMenu_AddMenuSeparatorAfter,Add Menu Separator Below,Добавить разделитель меню ниже,,Context menu option to add a separator below the selected entry
ContextMenu_AddMenuSeparatorBefore,Add Menu Separator Above,Добавить разделитель меню выше,,Context menu option to add a separator above the selected entry
ContextMenu_AddSubMenuEntry,Add Sub Menu Entry,Добавить пункт подменю,,Context menu option to add a sub menu entry at the end of the context menu
ContextMenu_AddSubMenuEntryAfter,Add Sub Menu Entry Below,Добавить пункт подменю ниже,,Context menu option to add a sub menu entry before the selected entry
ContextMenu_AddSubMenuEntryBefore,Add Sub Menu Entry Above,Добавить пункт подменю выше,,Context menu option to add a sub menu entry after the selected entry
ContextMenu_MoveEntryDown,Move Menu Item Down,Переместить элемент меню вниз,,Context menu option to move a menu entry or separator down
ContextMenu_MoveEntryUp,Move Menu Item Up,Переместить элемент меню вверх,,Context menu option to move a menu entry or separator up
Dialog_AreYouSure,Are you sure?,Вы уверены?,,"Generic ""Are you sure?"" dialog message"
Dialog_Confirm,Confirm,Подтвердить,,"Dialog ""confirm"" heading"
Dialog_DeleteEvent_Query,Are you sure you want to remove the event with all its actions?,"Вы уверены, что хотите удалить событие со всеми его действиями?",,Delete event dialog confirmation query
Dialog_CutEvent_Query,Are you sure you want to cut the selected event?,"Вы уверены, что хотите вырезать выбранное событие?",,Cut event dialog confirmation query
Dialog_DeleteEvent_Query_Multiple,Are you sure you want to remove {0} events with all their actions?,"Вы уверены, что хотите удалить {0} событий со всеми их действиями?",,Delete multiple event dialog confirmation query
Dialog_DeleteFrame_Query,Delete the selected frames?,Удалить выбранные кадры?,,image editor delete frames confirm query
Dialog_PasteEvent_NotReady,The event is still being copied. Please try pasting again in a few seconds.,Событие по-прежнему копируется. Попробуйте вставить через несколько секунд.,,Not ready to paste yet message
Dialog_DontShowAgain,Don't show this message again,Больше не показывать это сообщение.,,Message next to checkbox to allow the user to choose not to see this popup in future
Dialog_Error,Error,Ошибка,,error dialog title
Dialog_NotReady,Not Ready,Не готово,,not ready dialog title
Dialog_Success,Success,Успешно,,success dialog title
Dialog_Invalid,Invalid,Недействительно,,Dialog caption text for invalid input
Dialog_InvalidInput,Invalid input. Please provide the required information.,Недействительный ввод. Предоставьте требуемую информацию.,,A dialog message for invalid input in dialogs
Dialog_SaveChangesToX,Save the changes to {0}?,Сохранить изменения {0}?,,Save changes to X query
Dialog_Warning,Warning,Предупреждение,,"Dialog ""Warning"" title"
DialogEditor_AddContextMenu,Add Context Menu,Добавить контекстное меню,,Context menu option to add a context menu to the selected gadget
DialogEditor_Cell,Grid Cell,Ячейка сетки,,Layout Hierarchy heading for a grid cell group
DialogEditor_ChildGadgets,Child Gadgets,Дочерние гаджеты,,Layout Hierarchy heading for a child gadgets group
DialogEditor_ChildWindows,Child Windows,Дочерние окна,,Layout Hierarchy heading for a child windows group
DialogEditor_ClearLayoutList,Clear List,Очистить список,,Button label for clearing the open layout list
DialogEditor_Client,Client Panel,Окно клиента,,Layout Heirarchy heading for a client panel (window or tab)
DialogEditor_ClippedGadget,Clip To Parent,Прикрепить к родителю,,context menu option for setting if a gadget is clipped within its parent or not
DialogEditor_ColourDialog,Colour Dialog,Цветной диалог,,layout hierarchy label for a colour dialog window
DialogEditor_ColourSelected,Selected Colour Display,Выбранный цветной дисплей,,layout hierarchy label for the selected colour display
DialogEditor_ColumnSplitter,Grid Column Splitter,Сплиттер колонки сетки,,Layout Heirarchy heading for a grid column splitter
DialogEditor_ColumnDockSplitter,Grid Column Dock Splitter,Сплиттер дока колонки сетки,,Layout Heirarchy heading for a grid column dock splitter
DialogEditor_RowDockSplitter,Grid Row Dock Splitter,Сплиттер дока ряда сетки,,Layout Heirarchy heading for a grid row dock splitter
DialogEditor_GridSplitter,Grid Splitter,Сплиттер сетки,,gadget properties heading for a grid splitter
DialogEditor_DockSplitter,Grid Dock Splitter,Сплиттер дока сетки,,gadget properties heading for a grid dock splitter
DialogEditor_ContextMenu,Context Menu,Контекстное меню,,Layout Heirarcy heading for a context menu
DialogEditor_CopyGadget,Copy Gadget,Копировать гаджет,,menu entry for copying a gadget to clipboard
DialogEditor_CutGadget,Cut Gadget,Вырезать гаджет,,menu entry for cutting a gadget to clipboard
DialogEditor_DeleteGadget,Delete Gadget,Удалить гаджет,,menu entry for deleting the currently highlighted gadget
DialogEditor_DeleteLayout,Delete Layout,Удалить схему,,Dialog editor delete layout menu entry
DialogEditor_DeleteLayout_AreYouSure,Are you sure you want to delete this layout?,"Вы уверены, что хотите удалить эту схему?",,Check the user really wants to delete the layout
DialogEditor_DuplicateLayoutName,Dialog Editor: Duplicate Layout Name,Редактор диалога: Дублирование названия схемы,,log prompt for user to indicate the layout name is already in use
DialogEditor_DuplicateStyleName,A duplicate of stylename '{0}' was found in\n'{1}'\nthe style will continue to be saved in\n'{2}',Дубликат названия стиля '{0}' был найден в\n'{1}'\nстиль продолжит сохраняться в\n'{2}',,warning message that a duplicate of a style name was found but will be ignored
DialogEditor_Error,Error,Ошибка,,dialog editor error box title
DialogEditor_FailedToOpenJSON,Dialog Editor: Failed to open .json file: '{0}',Редактор диалога: Ошибка открытия файла .json: '{0}',,The .json file selected failed to load
DialogEditor_FileBrowse,Browse...,Просмотр...,,browse for filepath
DialogEditor_FileName,File name:,Имя файла:,,layout file name
DialogEditor_FlattenSubLayout,Flatten SubLayout,Плоская подсхема,,Context menu/menu bar entry for flattening a sub layout within a layout hierarchy
DialogEditor_Gadgets,Gadgets,Гаджеты,,Layout Hierarchy heading for a gadgets group
DialogEditor_GUIBase,GUI Base,Основание GUI,,gadget properties heading for properties coming from the GUIBase class
DialogEditor_GUIStyle,Style,Стиль,,Gadget properties heading for the guistyle class properties
DialogEditor_Hierarchy,Layout Hierarchy,Иерархия схемы,,the title for the layout hierarchy window
DialogEditor_HighlightedGadgetInfo,"relative position: ({0}px, {1}px) dimension: ({2}px, {3}px)","относительная позиция: ({0}px, {1}px) размеры: ({2}px, {3}px)",,display position and dimension of the currently highlighted gadget
DialogEditor_HSVTextEntry,HSV Input,Ввод HSV,,layout hierarchy label for the HSV input boxes
DialogEditor_InvalidJSON,The style '{0}' is not a valid json primitive. Please amend or revert the style. No changes will be saved.,Стиль '{0}' — недопустимый примитив json. Измените стиль или верните прежний стиль. Никакие изменения не будут сохранены.,,Error message when the user attempts to save a broken json style
DialogEditor_LabelAndIconCollection,Name And Icon,Название и значок,,Gadget properties heading for the LabelAndIcon class properties
DialogEditor_Layout,Layout,Схема,,Gadget properties heading for the basic layout properties group
DialogEditor_LayoutName,Layout name:,Название схемы:,,layout name
DialogEditor_ListBoxItems,List Items,Список элементов,,The layout hierarchy label for the list items
DialogEditor_LoadLayoutXML,Load Layout File,Загрузить файл схемы,,Button prompt for loading a layout xml file
DialogEditor_MenuBarEntry,Menu Bar Entry,Пункт поля меню,,layout hierarchy label for menubarentry gadget
DialogEditor_MenuEntry,Menu Entry,Пункт меню,,Layout Hierarchy heading for a menu entry
DialogEditor_NewLayout,New Layout,Новая схема,,Dialog editor new layout menu entry
DialogEditor_Node,Tree View Node,Узел древовидного списка,,Tree view node label in the gadget layout hierarchy
DialogEditor_NoJSONSelected,Dialog Editor: No JSON File Selected,Редактор диалога: Не выбран файл JSON,,There was no .json file selected by the user
