Name,English,Translation,Restrictions,Comment
TimeLine_ContextMenu_PasteMoments,Paste,Вставить,,Time line context menu entry
TimeLine_ContextMenu_RemoveMoments,Remove,Удалить,,Time line context menu entry
TimeLine_ContextMenu_SelectAll,Select All,Выбрать все,,Time line context menu entry
TimeLine_ListBox_Step,Step,Шаг,,Time line moments listbox step label
TimeLine_Moments,Moment,Момент,,Time line column header for moments
TimeLine_Name,Name:,Имя:,,Time line editor name label
TimeLine_Names,Description,Описание,,Time line editor names caption
TimeLine_WindowTitle,Timeline: {0},Временная шкала: {0},,Time line editor window caption
TimeLine_WindowTitle_CodeEditor,Timeline Moments: {0},Моменты временной шкалы: {0},,Time line code editor window title
TimeLine_ConvertType,Convert to {0},Конвертировать в {0},,Change the event from GML Visual to script or from script to GML Visual
TreeView_AddChildNode,Add Child Node,Добавить дочерний узел,,context menu option to add a child node
TreeView_AddNode,Add Node,Добавить узел,,context menu option to add a node
TreeView_AddNodeAfter,Add Node After,Добавить узел после,,context menu option to add a node after
TreeView_AddNodeBefore,Add Node Before,Добавить узел до,,context menu option to add a node before
TreeView_MoveNodeDown,Move Node Down,Переместить узел вниз,,context menu option to move the node down
TreeView_MoveNodeUp,Move Node Up,Переместить узел вверх,,context menu option to move the node up
UndoAction_AmbigousPropertyMatch,"Failed to store undo property '{0}': \nMultiple potential properties found, does this property use the 'new' keyword?","Ошибка сохранения свойства отмены '{0}': \nОбнаружены множественные потенциальные свойства, это свойство использует ключевое слово «новый»?",,Log error message for undo failing to store a property
UpdateDialogDownloadNow,Download now,Загрузить сейчас,,Update new version dialog - download now button
UpdateDialogRemindMe,Remind me later,Напомнить мне позже,,Update new version dialog - remind me later button
UpdateDialogLabel,New version is available! \nYou are on v{0}\nNew version is {1},Доступна новая версия! \nВы используете версию{0}\nНовая версия — {1},,Update new version dialog - tell user which version they are on and which version update will take them to
UpdateDialogReleaseNotes,View Release notes,Просмотреть примечания к выпуску,,Update new version dialog - view release notes button
UpdateDialogTitle,New Version,Новая версия,,Update new version dialog title
User_Login,Login,Войти,,Login button
User_Register,Register,Регистрация,,User Login dialog - Register button
User_Login_Title,YoYo Account Login,Вход в аккаунт YoYo,,User Login dialog
UserLogin_Email,Email/Username,Электронный адрес/Имя пользователя,,User Login dialog - e-mail label
UserLogin_Password,Password,Пароль,,User Login dialog - password label
UserLogin_RememberMe,Remember Me,Запомнить меня,,User Login dialog - Remember Me checkbox
User_ProxySettings,Proxy settings,Настройки прокси,,Proxy setting tool-tip
User_Authentication,Two Step Authentication,Двухфакторная аутентификация,,User Login - two step authentication title
User_OK,OK,OK,,User Login - two step authentication ok button
User_AuthenticationCode,Authentication Code,Код аутентификации,,User Login - two step authentication label for the authentication code
UserLogin_Retry,Retry,Повторить попытку,,User Login - Error Retry
UserLogin_MaxDevice,Maximum logins exceeded \nYou can manage your account sessions at accounts.yoyogames.com,Превышено максимально допустимое число входов \nВы можете управлять сеансами вашего аккаунта в accounts.yoyogames.com,,User Login Error response 29
UserLogin_Error34,Invalid session (User),Недействительный сеанс (Пользователь),,User Login Error response 34
UserLogin_Error36,Two-step login required,Требуется двухэтапная аутентификация,,User Login Error response 36
UserLogin_Error37,Required fields missing,Отсутствуют требуемые поля,,User Login Error response 37
UserLogin_Error38,User is banned,Пользователь заблокирован,,User Login Error response 38
UserLogin_Error39,Authentication failed. Please verify your username and password and try again.,"Ошибка аутентификации. Проверьте ваше имя пользователя и пароль, после чего повторите попытку.",,User Login Error response 39
UserLogin_Error40,User not found,Пользователь не найден,,User Login Error response 40
UserLogin_Error44,Device ID mismatch,Несоответствие ID устройства,,User Login Error response 44
UserLogin_Error45,Two-step code invalid,Двухэтапный код недействителен,,User Login Error response 45
UserLogin_Error47,Session not found,Сеанс не найден,,User Login Error response 47
UserLogin_Error48,Login successful,Успешный вход,,User Login Error response 48
UserLogin_Error54,No beta access,Нет бета-доступа,,User Login Error response 48
UserLogin_Error58,Session has expired,Срок действия сеанса истек.,,User Login Error response 58
UserLogin_Error69,No licence found. Please try again later or contact the helpdesk.,Лицензия не найдена. Повторите попытку позже или свяжитесь с группой поддержки клиентов.,,user login response 69
UserLogin_Error99,Errors creating session,При создании сеанса возникли ошибки,,User Login Error response 99
UserLogin_Error88,Please complete your profile to continue.,"Завершите ваш профиль, чтобы продолжить.",,User Login Error response 88 (profile incomplete)
UserLogin_EditProfile,Update Profile,Обновить профиль,,user login edit profile button
UserLogin_ProfileIncomplete,Profile Incomplete,Неполный профиль,,user login incomplete profile title
UserLogin_NoRuntime,Unable to access the Runtime Feed and no local Runtime installed. Please check your internet connection and start GameMaker again.,"Не удалось получить доступ к фиду среды выполнения, локальная среда выполнения не установлена. Проверьте ваше Интернет-соединение и запустите GameMaker еще раз.",,user login no runtime message
UserLogin_InstallRuntimeTitle,Install Runtime {0},Установить среду выполнения {0},,install runtime title
UserLogin_RuntimeSpaceWarningMessage,Destination drive {0} has only {1} GB free space available.\nAt least 2 GB of free space is recommended - please ensure there is enough free space available before proceeding.,"На целевом диске {0} доступны только {1} Гб.\nРекомендуется иметь как минимум 2 Гб свободного пространства. Перед тем, как продолжить работу, убедитесь, что у вас достаточно свободного пространства.",,runtime free space warning message
UserLogin_Continue,Continue,Продолжить,,continue label
Validate_MaxLength,{0} - Length should be less than {1},{0} - Длина должна быть менее {1},,Failed validation by passing an object whose length is too long
Validate_MinLength,{0} - Length should be greater than {1},{0} - Длина должна быть более {1},,Failed validation by passing an object whose length is too short
Validate_MVCType,{0} - Object should be of type {2}{1},{0} - Объект должен быть вида {2}{1},,Failed validation by passing an object of the wrong type
Validate_MVCType_OrInherits,or inherit from,или наследоваться из,,Injected to requested error message if the validation is checking parent type
Validate_MVCTypeList,{0} - List should only contain objects of type {2}{1},{0} - Список должен содержать только объекты типа {2}{1},,Failed validation by passing a list containing objects of the wrong type
Validate_Range,{0} - Value must be within range {1} - {2},{0} - Значение должно быть в рамках диапазона {1} - {2},,Failed validation for value range
Validate_Required,{0} - Value cannot be null,{0} - Значение не может быть нулевым,,Failed validation by passing a null value to a required property
Validate_StringLength,{0} - String length is invalid must be between {1} and {2} characters,"{0} - Длина строки недействительна, она должна быть от {1} до {2} символов",,Failed validation for string length
Validate_UniqueLayerName,Failed to set layer name '{0}' it is not unique within room,Ошибка задания имени слоя '{0}' - имя не уникально в рамках рума,,validation error message for non-unique layer name
Validate_UniqueName,Failed to set property on model '{0}' name is not unique,Ошибка задания свойства модели '{0}' - имя не уникально,,validation error message for non-unique resource name
Validate_ImageLayerName,Layer name cannot be blank,Имя слоя не может быть пустым,,validation error message for image layer name
View_Menu_Bookmarks,Bookmarks,Закладки,,Bookmarks menu item
View_Menu_Breakpoints,Breakpoints,Точки разрыва,,View breakpoints menu item
View_Menu_GlobalGameSettings,Global Game Settings,Глобальные настройки игры,,View the Global Game Settings menu item
View_Menu_OutputWindow,Output Window,Окно вывода,,View output window menu item
Views_Menu_History,History,История,,Views menu entry for undo history
Views_Menu_Output,Output,Вывод,,Views menu entry for the output panel
Views_Menu_Worker,Build Worker,Устройство сборки,,Views menu entry for the build worker window
Views_Menu_Resources,Resources,Ресурсы,,Views menu entry for resources
Views_Menu_AssetBrowser,Asset Browser,Браузер актива,,Views menu entry for resources
Views_Menu_Inspector,Inspector,Инспектор,,Views menu entry for inspector
Views_Menu_Tutorial,Tutorial Windows,Окна обучения,,Views menu entry for tutorial windows
Views_Menu_SearchResults,Search Results,Результаты поиска,,Views menu entry for the search results panel
Views_Menu_SourceControl,Source Control Output,Вывод управления источником,,Views menu entry for the source control output window
Views_Menu_Breakpoints,Breakpoints,Точки разрыва,,Views menu entry for the breakpoints window
Views_Menu_CompileErrors,Compile Errors,Ошибки компиляции,,Views menu entry for the compile errors window
Views_Menu_Macros,IDE Environment Variables,Переменные среды IDE,,View Macros window
Window_Close,Close,Закрыть,,Close window context menu entry
Window_Minimize,Minimize,Минимизировать,,Minimize window context menu entry
TimeLine_MergeWarning,Merging moments is a permanent action that cannot be undone. Are you sure you want to continue?,"Объединение моментов — это необратимое действие, которое нельзя отменить. Вы уверены, что хотите продолжить?",,Merge warning for time lines
TimeLine_MergeWarningTitle,Merge Moments,Объединить моменты,,Merge moments warning dialog title
TimeLine_DeleteWarning,Deleting moments is a permanent action that cannot be undone. Are you sure you want to continue?,"Удаление моментов — это необратимое действие, которое нельзя отменить. Вы уверены, что хотите продолжить?",,Delete warning for time lines
TimeLine_DeleteWarningTitle,Delete Moments,Удалить моменты,,Delete moments warning dialog title
Workspace_TabTitle,Workspace {0},Рабочее место {0},,The default tab name for workspace tabs
Dock_TabTitle,Dock Tab{0},Вкладка дока {0},,the default tab name for dock tabs
RoomEditor_InvalidDragGadget,"The selected layer does not accept the dragged assets, please select an appropriate layer type, ie. object -> instance layer, sprite -> asset or background layer, path -> path layer","Выбранный слой не поддерживает перетаскиваемые ресурсы. Выберите слой подходящего типа, т. е. для объекта выберите слой экземпляра, для спрайта — слой ресурса или фона, для пути — слой пути.",, Information warning for dropping resource gadgets on a layer which won't accept them
RoomEditor_InvalidDragGadgetCreateNewLayer_Instance,This asset can only be applied to an Instance Layer and you do not currently have one selected.\n\nWould you like to create a new Instance Layer?,"Этот актив может быть применим только к слою экземпляра, у вас нет выбранного на данный момент слоя экземпляра.\n\nВы хотите создать новый слой экземпляра?",, Information warning for dropping resource gadgets on a layer which won't accept them and indicating that an instance layer will be created
RoomEditor_InvalidDragGadgetCreateNewLayer_Asset,This asset can only be applied to an Asset Layer and you do not currently have one selected.\n\nWould you like to create a new Asset Layer?,"Этот актив может быть применим только к слою актива, у вас нет выбранного на данный момент слоя актива.\n\nВы хотите создать новый слой актива?",, Information warning for dropping resource gadgets on a layer which won't accept them and indicating that an asset layer will be created
Dock_FloatingDock_Title,Floating Dock,Плавающий док,,floating dock window title
RoomEditor_InvalidDragLayers,"Unable to drag resources into room, ensure one layer is selected","Не удается перетащить ресурсы в рум, убедитесь, что выбран один слой",, Information warning for dropping resource gadgets on the room but layer selection is invalid
RoomEditor_InvalidDragLayerFrozenOrInvisible,"Unable to drag resources into room, ensure selected layer '{0}' is unlocked and visible","Не удается перетащить ресурсы в рум, убедитесь, что выбранный слой '{0}' открыт, и его можно увидеть",,Information warning for dropping resource gadgets on a locked or invisible selected layer
RoomEditor_InvalidTileSet,The selected tile set has no associated sprite please select a valid tile set,"Выбранный набор плитки не имеет связанного с ним спрайта, выберите действительный набор плитки",,message to be shown when the user has selected a tileset that is not valid (ie. no sprite selected)
RoomEditor_NoTilesetMessage,Your tile set preview will appear here when you select a tile set,"Предварительный обзор вашего набора плитки появится здесь, когда вы выберете набор плитки",,message to be shown when the user has not selected a tile set
RoomEditor_NoLayer,No Tile Layer Selected,Слой плитки не выбран,, message to be shown when the user has not selected a tile layer
InvalidName_NameInUse,"Invalid name, already in use: {0}. Names must be unique.","Недействительное имя, уже используется: {0}. Имя должно быть уникальным.",,Name not unique message
InvalidName_KeywordReserved,"Invalid name, reserved keyword: {0}.","Недействительное имя, зарезервированное ключевое слово: {0}.",,Name is a reserved keyword message
InvalidName_InvalidCharacters,"Invalid name, contains invalid characters: {0}. Should only contain 0-9, a-z, A-Z or _ and not start with 0-9.","Недействительное имя, содержит недействительные символы: {0}. Должно содержать только 0-9, a-z, A-Z или _ и не начинаться с 0-9.",,Name contains invalid characters message
InvalidName_InvalidModel,Invalid model.,Недействительная модель.,,Invalid model message
InvalidName_DuplicateGroupName,Group name '{0}' is already in use,Имя группы '{0}' уже используется,,invalid group folder name
InvalidMove_DuplicateChildName,A group with name '{0}' already exists at this location,Группа с именем '{0}' уже существует в этом местоположении,,Parent folders or project cannot have multiple child folder with the same name message
ResourceTree_View,View,Обзор,View,View
ResourceTree_Views,Views,Обзоры,,Views selector button label
ResourceTree_View_Add,Add New View,Добавить новый обзор,,Add New View Prompt
ResourceTree_View_Default,Default,По умолчанию,,default tag
ResourceTree_View_Cannot_Delete_Default,You cannot delete the default view.,Вы не можете удалить этот обзор по умолчанию.,,You cannot delete the default view
ResourceTree_View_Title,Resource Tree,Дерево ресурса,,Title for above message
ResourceTree_View_DuplicateName,A view with this name already exists. Views must be unique.,Обзор с этим именем уже существует. Обзор должен быть уникальным.,,Duplicate name warning
ResourceTree_Filter, Filter Tree, Дерево фильтра,, 'Filter Tree' checkbox label
ResourceTree_WholeWord, Whole Word, Все слово,, 'Whole Word' checkbox label
ResourceTree_FindNext, Find Next, Найти далее,, 'Find Next' button label
ResourceTree_FindPrevious, Find Previous, Найти предыдущий,, 'Find Previous' button label
ResourceTree_SearchResources,Search...,Поиск...,, default contents of the resource tree search resources box
ResourceTree_SearchOptions,Search Options,Опции поиска,,Additional Search Options
SearchInScript_Search,Find...,Найти...,,Search in Script Search default box text
SearchInScript_Replace,Replace...,Заменить...,,Search in Script Replace default box text
SearchInScript_SelectionOnly,Selection Only,Только выбор,,Search in Script Selection Only
GMLVisual_Gadget_DirectionalInput,Directional Input,Направленный ввод,,GML Visual gadget for directional input
GMLVisual_Gadget_NumericInput,Numeric Input,Числовой ввод,,GML Visual gadget for numeric input
GMLVisual_Gadget_ApplyTo,Apply To,Применить к,,GML Visual gadget for applying to a specific object or instance
GMLVisual_Gadget_IsRelative,Is Relative,Относительное,,GML Visual gadget for determining if a change is relative
GMLVisual_Gadget_IsTemp,Is Temp,Временное,,GML Visual gadget for determining if a target is temp
GMLVisual_Gadget_TextInput,Text Input,Ввод текста,,GML Visual gadget for text input
GMLVisual_Gadget_ExpressionInput,Expression,Выражение,,GML Visual gadget for expression input
GMLVisual_Gadget_MenuInput,Menu Input,Ввод меню,,GML Visual gadget for menu input
GMLVisual_Gadget_MenuExpressionInput,Menu Expression Input,Ввод выражения меню,,GML Visual gadget for menu expression input
GMLVisual_Gadget_ResourceSelection,Resource Selection,Выбор ресурса,,GML Visual gadget for resource selection
GMLVisual_Gadget_ResourceSelection_SelectResource,Select Asset,Выбрать ресурс,,GML Visualâ„¢ gadget list view explorer title
GMLVisual_Gadget_BooleanInput,Boolean Input,Логические входные переменные,,GML Visual gadget for boolean input
GMLVisual_Gadget_BooleanExprInput,Boolean Expression Input,Логические входные переменные выражения,,GML Visual gadget for boolean input
GMLVisual_Gadget_ColorPicker,Colour Picker,Сортировщик цвета,,GML Visual gadget for picking a color
GMLVisual_Gadget_ColorPalette,Colour Palette,Цветовая гамма,,GML Visual gadget for picking a color
GMLVisual_Gadget_MultiLineTextInput,Text Input (MultiLine),Ввод текста (многострочный),,GML Visual gadget for multiline text input
GMLVisual_Gadget_CodeInput,Code Input,Ввод кода,,GML Visual gadget for code input
GMLVisual_Gadget_Caption_GroupSelector,Options,Опции,,GML Visual label caption for the group selector gadget
GMLVisual_Gadget_GroupSelector,Group Selector,Селектор группы,,GML Visual group selector gadget name
GMLVisual_Gadget_Caption_IsRelative,Relative,Относительный,,GML Visual gadget caption name for Is Relative
GMLVisual_Gadget_Caption_IsTemp,Temp,Врем.,,GML Visual gadget caption name for Is Temp
GMLVisual_Gadget_Caption_ApplyTo,Apply To,Применить к,,GML Visual gadget caption name for Apply To
GMLVisualMaker_AppTitle,GML Visual Maker,GML Visual Maker,,GML Visual Maker application title
GMLVisualMaker_Arguments,Arguments,Аргументы,,GML Visual Maker argument gadgets header
GMLVisualMaker_Gadgets,Gadgets,Гаджеты,,GML Visual Maker gui gadgets header
GMLVisualMaker_Properties,Argument Properties,Свойства аргумента,,GML Visual Maker properties header
GMLVisualMaker_Layout,Argument Layout,Схема аргумента,,GML Visual Maker layout header
GMLVisualMaker_LivePreview,Node Designer ({0}),Конструктор узла ({0}),,GML Visual Maker live preview header
GMLVisualMaker_NoAction,No Action,Нет действия,,GML Visual Maker designer title no action selected
GMLVisualMaker_Groups,Layout Groups,Схематические группы,,GML Visual Maker layout groups view header
GMLVisualMaker_Menu_Library,Library,Библиотека,,GML Visual Maker menu entry
GMLVisualMaker_Menu_Nodes,Nodes,Узлы,,GML Visual Maker menu entry
GMLVisualMaker_Menu_Layout,Layout,Схема,,GML Visual Maker menu entry
GMLVisualMaker_Menu_Translation,Translations,Переводы,,GML Visual Maker menu entry
GMLVisualMaker_LangName,Name,Имя,,column
GMLVisualMaker_LangEng,English,Russian,,column
GMLVisualMaker_LangTrans,Translation,Перевод,,column
GMLVisualMaker_LangRes,Restrictions,Ограничения,,column
GMLVisualMaker_LangDesc,Description,Описание,,column
GMLVisualMaker_Menu_Languages,Languages,Языки,,GML Visual Maker menu entry
GMLVisualMaker_Menu_NewLang,New Language,Новый язык,,GML Visual Maker menu entry
GMLVisualMaker_Menu_EditLang,Edit Language,Редактировать язык,,GML Visual Maker menu entry
GMLVisualMaker_Group_Default,Default,По умолчанию,,GML Visual Maker default group name
GMLVisualMaker_NewGroup,Group,Группа,,GML Visual Maker default new group name
GMLVisualMaker_NewSection,New Section,Новый раздел,,GML Visual Maker default new section name
GMLVisualMaker_NewAction,New Action,Новое действие,,GML Visual Maker default new action name
GMLVisualMaker_Menu_NewNode,New Node,Новый узел,,GML Visual Maker new node menu item
GMLVisualMaker_Menu_SaveNode,Save Node,Сохранить узел,,GML Visual Maker save node menu item
GMLVisualMaker_Menu_PreviewNode,Preview,Предварительный просмотр,,GML Visual Maker preview node menu item
GMLVisualMaker_Menu_EvaluateNode,Evaluate,Оценить,,GML Visual Maker evaluate node menu item
GMLVisualMaker_Menu_LoadLibrary,Load Library,Загрузить библиотеку,,GML Visual Maker load library menu item
GMLVisualMaker_Menu_SaveLibrary,Save Library,Сохранить библиотеку,,GML Visual Maker save library menu item
GMLVisualMaker_Menu_NewLibrary,New Library,Новая библиотека,,GML Visual Maker new library menu item
GMLVisualMaker_Library,My Library,Моя библиотека,,GML Visual Maker library header text
GMLVisualMaker_Menu_ExportLibrary,Export Library,Экспортировать библиотеку,,GML Visual Maker export library menu item
GMLVisualMaker_LibWizard_Label,Write new library name,Написать новое имя библиотеки,,GML Visual Maker library wizard name label
GMLVisualMaker_LibWizard_OK,Create Library,Создать библиотеку,,GML Visual Maker library wizard OK button
GMLVisualMaker_LibWizard_Cancel,Cancel,Отменить,,GML Visual Maker library wizard Cancel button
GMLVisualMaker_Menu_Sections,Sections,Разделы,,GML Visual Maker sections menu item
GMLVisualMaker_Menu_AddSection,Add Section,Добавить раздел,,GML Visual Maker add section menu item
