Name,English,Translation,Restrictions,Comment
ConfigurationProblem_PS4SDK,Configuration Problem : PS4 SDK not found. Check your Preferences.,Проблема конфигурации: PS4 SDK не обнаружен. Проверьте ваши предпочтения.,,Configuration Problem : PS4 SDK not found. Check your Preferences.
ConfigurationProblem_PS4Tools,Configuration Problem : PS4 Tools directory not found. Check your Preferences.,Проблема конфигурации: Директория инструментов PS4 Tools не обнаружена. Проверьте ваши предпочтения.,,Configuration Problem : PS4 Tools directory not found. Check your Preferences.
ConfigurationProblem_PS4VSPath,Configuration Problem : PS4 Visual Studio Path needs to be set to point to Visual Studio (.bat) batch file.,"Проблема конфигурации: Путь PS4 Visual Studio требуется установить так, чтобы он указывал на пакетный файл Visual Studio (.bat).",,Configuration Problem : PS4 Visual Studio Path needs to be set to point to Visual Studio (.bat) batch file.
ConfigurationProblem_tvOSDevice,Configuration Problem : No tvOS device found. Check your target settings.,Проблема конфигурации: Устройство tvOS не обнаружено. Проверьте ваши целевые настройки.,,Configuration Problem : No tvOS device found. Check your target settings.
ConfigurationProblem_tvOSPath,Configuration Problem : tvOS install path not set. Check your Preferences.,Проблема конфигурации: путь установки tvOS не задан. Проверьте ваши предпочтения.,,Configuration Problem : tvOS install path not set. Check your Preferences.
ConfigurationProblem_WindowsUWPDevice,Configuration Problem : No Windows UWP device found. Check your target settings.,Проблема конфигурации: Устройство Windows UWP не обнаружено. Проверьте ваши целевые настройки.,,Configuration Problem : No Windows UWP device found. Check your target settings.
ConfigurationProblem_WindowsUWPSDK,Configuration Problem : Windows 10 SDK not found at path given in Windows UWP Preferences.,"Проблема конфигурации: Windows 10 SDK не обнаружен на пути, заданном в предпочтениях Windows UWP.",,Configuration Problem : Windows 10 SDK not found at path given in Windows UWP Preferences.
ConfigurationProblem_WindowsUWPVSPath,Configuration Problem : Windows UWP Visual Studio Path needs to be set to point to Visual Studio (.bat) batch file.,"Проблема конфигурации: Путь Windows UWP Visual Studio должен быть задан так, чтобы указывать на пакетный файл Visual Studio (.bat).",,Configuration Problem : Windows UWP Visual Studio Path needs to be set to point to Visual Studio (.bat) batch file.
ConfigurationProblem_WindowsUWPMinVersion,Configuration Problem : Windows Target Platform Minimum Version has not been filled out.,Проблема конфигурации: Минимальная версия целевой платформы Windows еще не заполнена.,,Configuration Problem : Windows Target Platform Minimum Version has not been filled out.
ConfigurationProblem_WindowsUWPPlatformVersion,Configuration Problem : Windows Target Platform Version has not been filled out.,Проблема конфигурации: Версия целевой платформы Windows еще не заполнена.,,Configuration Problem : Windows Target Platform Version has not been filled out.
ConfigurationProblem_XboxOneTools,Configuration Problem : Xbox One Tools Directory not found. Check your Preferences.,Проблема конфигурации: Директория Xbox One Tools не обнаружена. Проверьте ваши предпочтения.,,Configuration Problem : Xbox One Tools Directory not found. Check your Preferences.
ConfigurationProblem_XboxOneSDK,Configuration Problem : Xbox One SDK Directory not found. Check your Preferences.,Проблема конфигурации: Директория Xbox One SDK не обнаружена. Проверьте ваши предпочтения.,,Configuration Problem : Xbox One SDK Directory not found. Check your Preferences.
ConfigurationProblem_XboxOneSDKVersion,Configuration Problem : Xbox One SDK Version does not match {0}. Check your Preferences.,Проблема конфигурации: Версия Xbox One SDK не соответствует {0}. Проверьте ваши предпочтения.,,Configuration Problem : Xbox One SDK Version does not match
ConfigurationProblem_XboxOneSDKDir,Configuration Problem : Microsoft Xbox One Directory not found. Check your Preferences.,Проблема конфигурации: Директория Microsoft Xbox One не обнаружена. Проверьте ваши предпочтения.,,Configuration Problem : Microsoft Xbox One Directory not found. Check your Preferences.
ConfigurationProblem_XboxOneVSPath,Configuration Problem : Xbox One Visual Studio Path needs to be set to point to Visual Studio (.bat) batch file.,"Проблема конфигурации: Путь Xbox One Visual Studio должен быть задан так, чтобы указывать на пакетный файл Visual Studio (.bat).",,Configuration Problem : Xbox One Visual Studio Path needs to be set to point to Visual Studio (.bat) batch file.
Provisioning,Provisioning,Инициализация,DO NOT TRANSLATE,tvOS provisioning preference group subheading
Base_Unit_Memory,PS4 Base Memory,Основная память PS4,,title for options related to memory pool sizes
Neo_Memory,PS4 Pro Memory,Память PS4 Pro,,title for options related to memory pool sizes
ggs_onion,CPU/GPU 'onion' memory pool size (MB),Размер пула памяти 'onion' (многослойная) CPU/GPU (MB),DO NOT TRANSLATE onion, memory pool size for 'onion' memory
ggs_garlic,GPU 'garlic' memory pool size (MB),Размер пула памяти 'garlic' («чесночная») GPU (MB),DO NOT TRANSLATE garlic,memory pool size for 'garlic' memory
ggs_ps4_garlic_memory_tooltip,The amount of memory in megabytes to dedicate to the shared GPU memory pool \nMaximum allocation must be shared between both pools,Размер памяти в мегабайтах для общего пула памяти GPU \nМаксимальный размер выделенной памяти должен распределяться между обоими пулами,,tooltip for garlic memory pool
ggs_ps4_onion_memory_tooltip,The amount of memory in megabytes to dedicate to the shared CPU/GPU memory pool \nMaximum allocation must be shared between both pools,Размер памяти в мегабайтах для общего пула памяти CPU/GPU \nМаксимальный размер выделенной памяти должен распределяться между обоими пулами,,tooltip for garlic memory pool
ggs_ps4_max_display_width,Maximum display width,Максимальная ширина отображения,,title for options relating to display resolution
ggs_ps4_max_display_height,Maximum display height,Максимальная высота отображения,,title for options relating to display resolution
ggs_ps4_max_display_tooltip,"Maximum display dimensions to allow on PS4, subject to system constraints\n-1 indicates unlimited.","Максимальные размеры отображения, разрешенные на PS4, зависят от ограничений системы\n-1 - без ограничений.",,tooltip for display resolution options
Top Shelf,Top Shelf,Top Shelf («верхняя полка»),,Top Shelf images group subheading for tvOS
ggs_top_shelf,Top Shelf Image,Изображение Top Shelf,,Top Shelf Image
ggs_top_shelf_2x,Top Shelf Image 2x,Top Shelf — Изображение 2x,,Top Shelf Image 2x
ggs_top_shelf_wide,Top Shelf Image Wide,Ширина изображения Top Shelf,,Splash Screen Image Wide
ggs_top_shelf_wide_2x,Top Shelf Image Wide 2x,Ширина изображения Top Shelf Image 2x,,Splash Screen Image Wide 2x
ggs_icon_400_2x,400x240 Icon 2x,400x240 Значок 2x,,400x240 Icon 2x
ggs_splash_screen_2x,Splash Screen Image 2x,Изображение экрана-заставки 2x,,Splash Screen Image 2x
ggs_xboxone_stats_system,Stats configuration system,Система конфигурации показателей,,Stats configuration system
ggs_xboxone_stats_2017,Stats 2017,Статистика— 2017,,the radio group option for 2017 stats
ggs_xboxone_stats_2013,Stats 2013,Статистика — 2013,,the radio group option for 2013 stats
ggs_xboxone_stats_system_tooltip,The 2013 system has been deprecated by Microsoft and should only be used for titles already in development \nThe 2017 system no longer requires a service manifest \nPlease see Microsoft documentation for more details,Система 2013 года не рекомендована компанией Microsoft и должна использоваться только для уже находящихся в разработке проектов \nДля системы 2017 года больше не требуется манифест служб \nОбратитесь к документации Microsoft для получения дополнительной информации,,tooltip for the stats sytem radio group
Error_ResourceLoadFailures_Message,Resource load failures encountered...,При загрузке ресурса произошли ошибки...,,non-blocking errors have occurred message
android_build_settings_invalid,The SDK Build Settings are invalid,Настройки сборки SDK недействительны,,Android/Amazon Fire SDK Build Settings are invalid
clean_runtimes_now,Clean Runtimes Now,Убрать среду выполнения,,Clean out older runtimes now
clean_all_runtimes,Do you want to delete older runtimes from all feeds?,Вы хотите удалить старые среды выполнения из всех фидов?,,Clean out all runtimes from runtime folder
runtime_clean_title,Runtime Deletion,Удаление среды выполнения,,Runtime Deletion title
tvos_show_file_warning,Automatic response to tvOS persistent storage limitation warning,Автоматический ответ на предупреждение о постоянных ограничениях пространства для хранения данных tvOS,,Show tvOS file system warning preference setting
tvos_file_warning,tvOS persistent storage space is currently limited to 500k via NSUserDefaults. Please consider using cloud storage for this target.,постоянное пространство для хранения данных tvOS в настоящее время ограничено 500k через NSUserDefaults. Рассмотрите возможность использования удаленного хранилища данных для этой цели.,,Warning message for the tvos file system limitations
ggs_requires_nex,Enable support for NEX libraries,Активировать поддержку для библиотек NEX,,Enable support for NEX libraries
Build_Switch_NoNMetaSlim_Message,There is no SLIM data configured. Visit https://slim.mng.nintendo.net/slim/home to create it?,Конфигурированные данные SLIM отсутствуют. Посетить https://slim.mng.nintendo.net/slim/home для их создания?,,No SLIM data message box
Error_AppleDeviceNotPaired,ERROR: Device '{0}' has not been paired. Does it have a valid provisioning profile?,ОШИБКА: Устройство '{0}' не было сопряжено. У него имеется действительный профиль инициализации?,,!AMDeviceIsPaired has been returned for an iOS/tvOS device type and is probably just missing its provisioning profile
Error_AppleDevicesNotPaired,The following devices have not been paired. Please ensure they have valid provisioning profiles.,"Следующие устройства не были сопряжены. Убедитесь, что у них имеются действительные профили инициализации.",,The following devices have not been paired. Please ensure they have valid provisioning profiles
IDE_MissingFFmpegWrapperTitle,Missing FFmpegWrapper,Отсутствует FFmpegWrapper,,Missing FFmpegWrapper Title
IDE_MissingFFmpegWrapper,The FFmpegWrapper.dll - or its dependencies - appear to be missing. This could be from a bad install or an overly aggressive virus scanner. Please check your virus scanner or reinstall.,"Кажется, отсутствует FFmpegWrapper.dll или его зависимые объекты. Это могло произойти из-за плохой установки или из-за слишком агрессивного антивирусного сканера. Проверьте или переустановите ваш антивирусный сканер.",,Missing FFmpegWrapper dll message
ProjectLoad_VerificationErrorTitle,Project Verification Error,Ошибка верификации проекта,,Project Verification Error Title
ProjectLoad_MultipleRootsMessage,This project has multiple root views and is unstable. Select Yes to attempt a repair or No to continue in an unstable state.,"У этого проекта множество просмотров корневых файлов, проект нестабилен. Выберите «Да», чтобы попробовать его стабилизировать. Выберите «Нет», чтобы продолжить работу в нестабильном состоянии.",,Multiple roots in project message
switch_tools_invalid_platform,The Switch tools are only available on Windows.,Инструментарий переключения доступен только на Windows.,,Switch tools not available on this platform
switch_tool_error,Switch Tools Error,Ошибка переключения инструментов,,Switch Tools Error title
switch_auth_editor_not_exist,The Switch Authoring Editor cannot be found. Please ensure the Nintendo SDK is properly installed and try again.,"Не удается найти редактор разработки переключения. Убедитесь, что Nintendo SDK должным образом установлен, после чего повторите попытку.",,Switch Authoring Editor not found. Please check Nintendo SDK install
switch_auth_tool_not_exist,The Switch Authoring Tool cannot be found. Please ensure the Nintendo SDK is properly installed and try again.,"Не удается найти инструмент разработки переключения. Убедитесь, что Nintendo SDK должным образом установлен, после чего повторите попытку.",,Switch Patch Tool cannot be found. Please check Nintendo SDK install
switch_runontarget_tool_not_exist,The Switch RunOnTarget Tool cannot be found. Please ensure the Nintendo SDK is properly installed and try again.,"Не удается найти инструмент переключения RunOnTarget. Убедитесь, что Nintendo SDK должным образом установлен, после чего повторите попытку.",,Switch RunOnTarget Tool cannot be found. Please check Nintendo SDK install
Beta Channel,Beta Channel,Бета-канал,,Beta Channel preferences tag
beta_1,Here you can opt in or out of the GameMaker Beta.,Здесь вы можете зарегистрироваться на GameMaker Beta или отменить регистрацию.,,beta_1 caption
beta_2,This will grant you access to upcoming versions of GameMaker before they are released to production.,"Мы предоставим вам доступ к предстоящим версиям GameMaker еще до того, как они будут выпущены в производство.",,beta_2 caption
beta_3,This product is covered by Section 2 of our,Этот продукт описан в разделе 2,,beta_3 caption
beta_4,Please note that these are early release builds. This means that they may have bugs that could corrupt your projects. We strongly recommend that you back up your project using source control and use a separate copy of it when using a beta build.,"Обратите внимание, что это сборки раннего выпуска. Это означает, что в них возможно содержатся ошибки, которые могут нанести вред вашим проектам. Мы настоятельно рекомендуем создать резервную копию вашего проекта с помощью управления источником и использовать отдельную резервную копию для бета-сборки.",,beta_4 caption
beta_5,If you do not back up your project and it is corrupted by a beta build there may be no way to recover it.,"Если вы не создадите резервную копию вашего проекта, и он будет поврежден бета-компоновкой, возможно, вы не сможете его восстановить.",,beta_5 caption
beta_6,You can revert back to a non-beta build by clicking the button below.,"Вы можете вернуться к обычной компоновке, щелкнув по расположенной ниже кнопке.",,beta_6 caption
beta_7,End User Licence Agreement,Пользовательское соглашение,,beta_7 caption
beta_check_1,I am aware that GameMaker Beta may corrupt my projects,"Я осознаю, что GameMaker Beta может нанести вред моим проектам",,beta_check_1 caption
beta_check_2,I have backed up my projects or am using source control,Я создал (-а) резервную копию моих проектов или использую управление источником,,beta_check_2 caption
beta_check_opt-in,Opt-in to GameMaker Beta,Подписаться на GameMaker Beta,,beta_check_opt-in caption
beta_check_opt-out,Opt out of GameMaker Beta,Не подписываться на GameMaker Beta,,beta_check_opt-out caption
beta_channel_warning,Apply the Beta channel opt-in and restart GMS2 now?,Применить подписку на бета-канал и повторно запустить GMS2 прямо сейчас?,,beta channel warning
beta_channel_downgrade,"After clicking OK, you should manually install a stable IDE to complete the opt-out process. See the release notes for an installer download link.",После щелчка по ОК вы должны вручную установить стабильный IDE для завершения процесса отписки. Обратитесь к анонсу выпуска новой версии для получения ссылки для загрузки инсталлятора.,,beta channel downgrade info
beta_channel_splash,Please note that these are early release builds. This means that they may have bugs that could corrupt your projects. We strongly recommend that you back up your project using source control and use a separate copy of it when using a beta build.,"Обратите внимание, что это сборки раннего выпуска. Это означает, что в них возможно содержатся ошибки, которые могут нанести вред вашим проектам. Мы настоятельно рекомендуем создать резервную копию вашего проекта с помощью управления источником и использовать отдельную резервную копию для бета-сборки.",,beta channel splash 
Convert_ConfirmMessage,This project is of an older format and will need to be converted. Proceed?,"Это старый формат проекта, который требуется конвертировать в более новый формат. Продолжить?",,sequences project conversion confirmation dialogue message
Convert_Success_Title,Conversion Success,Процесс конвертации успешно завершен.,,Project Conversion success title
Convert_Success_Message,The Project has successfully converted,Конвертация проекта прошла успешно,,Project Conversion success message
Convert_Failed_Title,Conversion Failed,Ошибка конвертации,,Project Conversion failed title
Convert_Failed_Message,The Project conversion has failed,Во время конвертации произошла ошибка,,Project Conversion failed message
Convert_SameFolderMessage,You cannot save the converted project to the same folder as the original. Please select a new location.,"Вы не можете сохранить конвертированный проект в ту же папку, что и оригинал. Выберите новое местоположение.",,convert same folder dont do it message
exception_faq_button_caption,"To see what data this report contains, <a href="https://help.yoyogames.com/hc/en-us/articles/360028120992">нажмите здесь</a>","To see what data this report contains, <a href="https://help.yoyogames.com/hc/en-us/articles/360028120992">click here</a>",,exception faq button caption
exception_fatal_error_header_caption,A fatal exception has occurred in GameMaker and the program needs to close.\n\nWe are sorry for the inconvenience.,"В GameMaker произошло фатальное исключение, требуется закрыть программу.\n\nПриносим извинения за возникшие неудобства.",,exception fatal error header caption
exception_problem_header_caption,Please tell us about this problem.,Расскажите нам об этой проблеме.,,exception problem header caption
exception_blurb,"An error report has been created so that we can examine and prevent issues like this. It would be very helpful if you could provide further details relating to the context of this event. Specifically, what you were working on immediately beforehand.\n\nImportant\nBy pressing Send, you are providing consent for us to process the data detailed below in line with our Privacy Policy.","Создан отчет об ошибке, чтобы мы смогли изучить возникшую проблему и предотвратить ее возникновение в будущем. Нам бы очень помогло, если бы вы предоставили дополнительную информацию об обстоятельствах этого события. В особенности нас интересует, над чем вы работали непосредственно перед ошибкой.\n\nВажно\nНажав «Отправить», вы даете нам право обрабатывать приведенные ниже данные в соответствии с нашей политикой конфиденциальности.",,exception blurb
exception_send_caption,Send,Отправить,,exception send button caption
exception_dont_send_caption,Don't Send,Не отправлять,,exception dont send button caption
exception_privacy_policy_caption,Privacy Policy,Политика конфиденциальности,,exception privacy policy
exception_form_version,crash-0.2,crash-0.2,,exception form version
exception_upload_caption,Upload Status,Загрузить статус,,exception form confirmation box caption
exception_upload_confirmation,Upload Successful.,Загрузка прошла успешно.,,exception form confirmation box message
Project_OldFormat_Title,Old Project Format,Формат старого проекта,,Old Project Format
Project_OldFormat_Message,Project was created in an older IDE which may have format changes,"Проект был создан в более старой версии IDE, формат мог быть изменен",,Project was created in an older IDE which may have format changes
ImportFromYY_Title,Importing Resources,Импортирование ресурсов,,Importing Resources Title
ImportFromYY_NoProjectFound,Could not find a project for the resource file at {0},Не удалось найти проект для файла ресурса на {0},,Project not found message for the given resource
ImportFromYY_OldFormat,The project at {0} requires upgrading before you can import the requested resource(s). Do you want to do this now?,"Требуется обновление проекта на {0} перед тем, как вы сможете импортировать запрошенный ресурс (запрошенные ресурсы). Вы хотите сделать это сейчас?",,The project requires an update do a newer format before we can import from it
ImportFromYY_NothingToImport,There no resources found that we can import,"Не найдены ресурсы, которые можно импортировать",,We cannot import any resources within the given set
