Name,English,Translation,Restrictions,Comment
OverwriteFramesTitle,Replace all frames,Alle Frames ersetzen,,image editor replace frames with os GML Visual files dialog title
OverwriteFramesMessage,Do you wish to replace ALL the frames with the dropped image files?,Möchten Sie ALLE Frames mit den gezogenen Bilddateien ersetzen?,,image editor replace frames with os GML Visual files dialog title
ListBoxEnum_eSymbolType_eNone,Unknown,Unbekannt,,Symbol type
ListBoxEnum_eSymbolType_eEnumEntry,Enum Field,Enum-Feld,,Symbol type
ListBoxEnum_eSymbolType_eGlobal,Global Variable,Globale Variable,,Symbol type
ListBoxEnum_eSymbolType_eLocal,Local Variable,Lokale Variable,,Symbol type
ListBoxEnum_eSymbolType_eVariable,Variable,Variable,,Symbol type
ListBoxEnum_eSymbolType_eBuiltInVariable,Built-in Variable,Integrierte Variable,,Symbol type
ListBoxEnum_eSymbolType_eMacro,Macro,Makro,,Symbol type
ListBoxEnum_eSymbolType_eEnum,Enum,Enum,,Symbol type
ListBoxEnum_eSymbolType_eKeyword,Keyword,Schlüsselwort,,Symbol type
ListBoxEnum_eSymbolType_eConstant,Constant,Konstant,,Symbol type
ListBoxEnum_eSymbolType_eFunction,Function,Funktion,,Symbol type
ListBoxEnum_eSymbolType_eScript,Script,Skript,,Symbol type
ListBoxEnum_eSymbolType_eResource,Resource,Ressource,,Symbol type
ListBoxEnum_eSymbolType_eObsolete,Obsolete,Überflüssig,,Symbol type
Sprite_PreviewErrorMsg,The file '{0}' is not supported. See Compile Errors window.,Die Datei '{0}' wird nicht unterstützt. Siehe Kompilierfehler-Fenster.,,Generate preview error message
serverportunavailable_title,Webserver Port Unavailable,Webserver-Port nicht verfügbar,,Webserver Port Unavailable title message
Marketplace_MyLibrary_Empty,Your library is empty.,Ihre Bibliothek ist leer.,,Empty library
Marketplace_MyLibrary_ClickToBrowse,Click here to browse the marketplace.,"Klicken Sie hier, um im Marketplace zu stöbern.",,Click to browse marketplace
StartPage_Offline,This link cannot be opened as you are currently offline.,"Dieser Link kann nicht geöffnet werden, da Sie aktuell offline sind.",,User is offline and trying to open an external url
debuggerporttouse,Debugger port,Debugger-Port,,Port for Debugger to use label in Settings
realtimedebugging,Enable real-time debugging,Echtzeit-Debugging aktivieren,,Enable real-time debugging label in Settings
syntaxcheckingdelay,Syntax Checking delay (ms),Syntax-Überprüfungsverzögerung (ms),,Syntax Checking delay (ms) setting label
codecompletiondelay,Code Completion delay (ms),Code-Vervollständigungsverzögerung (ms),,Code Completion delay (ms) setting label
ggs_draw_colour,Default draw colour,Standard-Zeichenfarbe,,the option for the default draw colour
defaultprojectdrawcolour_description,Initial default draw colour for new projects,Anfängliche Standard-Zeichenfarbe für neue Projekte,,the preference for setting the default draw colour option on project creation
macroeditor_title,IDE Environment Variables,IDE-Umgebungsvariablen,,MacroEditor title
GMLVisualModule_LivePreview_Text,Preview (Read-Only),Vorschau (schreibgeschützt),,GML Visual module live preview top comment text
No_Resources_To_Add,No resources to add,Keine Ressourcen zum Hinzufügen,,Add from Default View status message
FreeVersion_ProjectInvalid,The project '{0}' cannot be loaded with GameMaker Trial,Das Projekt '{0}' kann mit der Testversion von GameMaker nicht geladen werden,,Error message when the user tries to load a project that exceeds free limits
FreeVersion_ResourceLimitReached,You have reached the limits of GameMaker Trial for '{0}'.,Sie haben die Grenzen der Testversion von GameMaker für ‚{0}‘ erreicht.,,Error message when the user tries to create more resources than the Trial version allows
FreeVersion_SpineNotSupported,Spine files are not supported in GameMaker Trial,Spine-Dateien werden in der Testversion von GameMaker nicht unterstützt,,Spine files are not supported in the Trial version of GameMaker error message
FreeVersion_SWFNotSupported,SWF files are not supported in GameMaker Trial,SWF-Dateien werden in der Testversion von GameMaker nicht unterstützt,,SWF files are not supported in the Trial version of GameMaker error message
FreeVersion_ImportNotSupported,Importing projects is not supported in GameMaker Trial,Das Importieren von Projekten wird in der Testversion von GameMaker nicht unterstützt,,Importing projects is not supported in the Trial version of GameMaker error message
FreeVersion_MarketplaceNotSupported,Marketplace cannot be accessed in GameMaker Trial,Der Marketplace ist in der Testversion von GameMaker nicht zugänglich,,Marketplace cannot be accessed from the Trial version of GameMaker error message
FreeVersion_UnsupportedResources,'{0}' contains resources not supported by GameMaker Trial,"'{0}' enthält Ressourcen, die von GameMaker Trial nicht unterstützt werden",,Unsupported resources error message
SpriteResizeTileset,Recalculate tile set after resize,Tileset nach Größenänderung neu berechnen,,Resize dialog checkbox for sprite used as tileset
SpriteResizeTilesetSelect,This sprite is used by multiple tile sets of varying tile sizes. Select a reference tile set for this operation.,Dieses Sprite wird von mehreren Tilesets mit verschiedenen Tile-Größen verwendet. Wählen Sie ein Referenz-Tileset für diesen Vorgang.,,Multiple tilesets pick one
SelectTileSetTitle,Select Reference Tile Set,Referenz-Tileset auswählen,,Pick a tile set dialog title
SelectTileSet_NoneSelected,No tile set was selected. Cannot complete operation.,Kein Tileset ausgewählt. Vorgang kann nicht abgeschlossen werden.,,No tile set selected message
DocumentWindow_Title_FragmentShader,{0} Fragment Shader,{0} Fragment Shader,,Fragment Shader title
DocumentWindow_Title_VertexShader,{0} Vertex Shader,{0} Vertex Shader,,Vertex Shader title
DocumentWindow_Title_CombinedShader,{0},{0},,Combined Shader title
DocumentWindow_Title_ObjectEvent,{0}: {1},{0}: {1},,Single Object Event title
DocumentWindow_Title_ObjectMultipleEvents,{0}: Events,{0}: Ereignisse,,Single Object Multiple Events
DocumentWindow_Title_Note,{0},{0},,Single Note
DocumentWindow_Title_Notes,Notes,Notizen,,Multiple Notes
DocumentWindow_Title_Script,{0},{0},,Single Script
DocumentWindow_Title_TimelineMoment,{0}: Moment {1},{0}: Moment {1},,Single Timeline Single Moment
DocumentWindow_Title_TimelineMultipleMoments,{0}: Moments,{0}: Momente,,Single Timeline Multiple Moments
DocumentWindow_Title_RoomCreationCode,{0} Creation Code,{0} Erstellungscode,,Room Creation Code
DocumentWindow_Title_RoomInstanceCreationCode,{0}:{1} - Creation Code,{0}:{1} - Erstellungscode,,Single Room Single Instance Creation Code
OutputWindowTextSettings,Output Window Font Settings,Schriftarteinstellungen für Ausgabefenster,,Output Window Font Settings
SourceControlTextSettings,Source Control Window Font Settings,Schriftarteinstellungen für Quellkontrollfenster,,Source Control Window Font Settings
BreakpointTextSettings,Breakpoint Window Font Settings,Schriftarteinstellungen für Breakpoint-Fenster,,Breakpoint Window Font Settings
SearchReplaceTextSettings,Search Result Window Font Settings,Schriftarteinstellungen für Suchergebnisfenster,,Search Result Window Font Settings
SyntaxErrorsTextSettings,Syntax Error Window Font Settings,Schriftarteinstellungen für Syntaxfehlerfenster,,Syntax Error Window Font Settings
CompileErrorsTextSettings,Compile Error Window Font Settings,Schriftarteinstellungen für Kompilierfehlerfenster,,Compile Error Window Font Settings
desktop_ctrlmousewheelzoom,Mouse wheel zoom requires ${ctrl} key,Mausrad-Zoom erfordert ${ctrl}-Taste,,Preference description for whether the user needs to hold ctrl to zoom in/out
dpi_setting_change,DPI override changes requires a restart of the IDE. Do you want to restart now?,Änderungen an DPI-Überschreibungen erfordern Neustart der IDE. Jetzt neu starten?,,Restart IDE after a DPI change
dpi_override,Enable DPI override,DPI-Überschreibung,,DPI Override
ggs_allow_game_statistics,Allow anonymous game statistics,Anonyme Spielstatistiken gestatten,,Allow anonymous game statistics
LicenceExcluded_ggs_allow_game_statistics,Statistics cannot be turned off on 'Creator' platforms,Statistiken können auf ‚Creator‘-Plattformen nicht deaktiviert werden,Do not localise 'Creator' it's a product name,Trial stats tooltip on checkbox
LicenceFree_ggs_allow_game_statistics,Statistics cannot be turned off in GameMaker Trial,Statistiken können bei Testversion von GameMaker nicht deaktiviert werden,,Trial stats tooltip on checkbox
ggs_statistics_off,Are you sure you want to turn statistics off?\n\nAnonymous statistics allow us to provide developers with info about their target audience and focus development in key areas,"Möchten Sie die Statistiken wirklich deaktivieren?\n\nAnonyme Statistiken stellen Entwicklern Informationen zur Zielgruppe bereit und ermöglichen es, Entwicklungsschwerpunkte zu setzen",,Message when turning off anonymous statistics
ggs_statistics_choice,Automatic response to turning off anonymous statistics,Automatische Reaktion auf Deaktivierung anonymer Statistiken,,Confirm dialog option
ResourceTree_DataFileAlreadyExists,Included file '{0}' already exists.\nOperation cancelled.,Die enthaltene Datei '{0}' existiert bereits.\nVorgang abgebrochen.,,Warn the user that an included file already exists and therefore the operation has been cancelled
RestoreResourceName_DirectoryFailure,Renaming failed: unable to restore directory '{0}' to its original name. Please see the output panel for more details.,Umbenennung fehlgeschlagen: Verzeichnis ‚{0}' kann nicht auf Originalnamen zurückgesetzt werden. Weitere Einzelheiten im Ausgabefenster.,,Error message when attempting to restore a bad resource rename fails
RestoreResourceName_FilesFailure,Renaming failed: unable to restore files to their correct state. Please see the output panel for more details.,Umbenennung fehlgeschlagen: Dateien können nicht in ihren korrekten Zustand zurückgesetzt werden. Weitere Einzelheiten im Ausgabefenster.,,Error message when attempting to restore a bad resource rename fails
SaveFailures_Title,Save Project Failed,Projektspeicherung fehlgeschlagen,,Save project failed dialog title
SaveFailures_Message,Unable to save the following files (please see the output panel for more details).,Die folgenden Dateien konnten nicht gespeichert werden (weitere Einzelheiten im Ausgabefenster).,,Save project failed dialog message
GMLVisualMaker_CantRegenerateAction,Cannot regenerate this action.,Diese Aktion kann nicht regeneriert werden.,,Cant regenerate
PNG2Tileset_ImportDialog,Import image and convert to Tilemap,Bild importieren und in Tilemap umwandeln,,Import an image and convert to a tilemap dilog
PNG2Tileset_ImageLeft,Left Edge,Linker Rand,,Pixel offset to left edge of image
PNG2Tileset_ImageTop,Top Edge,Oberer Rand,,Pixel offset to top of image
PNG2Tileset_ImageRight,Right Edge,Rechter Rand,,Pixel offset to right edge of image
PNG2Tileset_ImageBottom,Bottom Edge,Unterer Rand,,Pixel offset to bottom of image
PNG2Tileset_TilesetSpriteWidth,Destination Width,Zielbreite,,Target width of the new tileset sprite
PNG2Tileset_ImportOptions,Import options,Importoptionen,,Options for importing an imate and converting to tilesets
PNG2Tileset_GenerateButton,Generate Map,Map erstellen,,Button to create the tileset and map!
PNG2Tileset_SpriteName,Sprite Name,Sprite-Name,,Text for sprite name label
PNG2Tileset_TilemapName,Tilemap Name,Tilemap-Name,,Text for tilemap name label
PNG2Tileset_LayerName,Layer Name,Ebenenname,,Text for layer name label
PNG2Tileset_ColourLabel,Remove Colour,Farbe entfernen,,Colour to remove on import
PNG2Tileset_ImageTooLarge,The selected image is too large to display,Das ausgewählte Bild ist zur Anzeige zu groß,,Error message to display if the map is > max texture size
platformdevice_detect_browsers,Detect Browsers,Browser erkennen,,Button to auto-detect installed web browsers
RoomEditor_GenerateTileMapFromImage,Convert Image to Tilemap,Bild in Tilemap umwandeln,,menu entry for taking an image and building a tileset/tilemap from it
ResourceTree_SetRoomParent,Are you sure you want to set '{0}' as the room inheritance parent of '{1}'?,Möchten Sie '{0}' wirklich als übergeordnetes Raumvererbungselement für '{1}' festlegen?,,message displayed when attempting to drag a room onto another in the resource tre
resourcetree_automaticsetparentroom,Automatic response to setting a room parent via node drag,Automatische Reaktion auf Festlegung von Raum übergeordnetem Element per Knoten-Ziehen,,the automatic response to dragging rooms to become child rooms in the resource tree
resourcetree_automaticviewdeletion,Automatic response to deleting custom views,Automatische Reaktion auf Löschen benutzerdefinierter Ansichten,,the automatic response when deleting a custom view
RoomEditor_InstanceLockToolTip,Lock Instance,Instanz sperren,,tooltip for instance lock
RoomEditor_GraphicLockToolTip,Lock Graphic,Grafik sperren,,tooltip for graphic lock
FontEditor_ReplacementGlyphError,Using symbols not found in font (?),"Verwenden von Symbolen, die nicht in Schriftart enthalten sind (?)",,Font glyph error
FontEditor_ReplacementGlyphError_Tooltip,This font is missing one or more symbols and will get replacements from other fonts,Bei dieser Schriftart fehlen ein oder mehrere Symbole und diese werden aus anderen Schriftarten ersetzt,,Tooltip
Font_TooLargeTexPage,Font ""{0}"" packs more characters than can fit on the texture page. Some characters will not be visible.,Font ""{0}"" beinhaltet mehr Zeichen"," als auf die Texturseite passen. Einige Zeichen werden nicht zu sehen sein.,,Font too large for texture page warning dialog
Event_Gesture,Gesture,Geste,,Gesture event name
Event_Gesture_Global,Global,Global,,Gesture event subtype
Event_Gesture_Tap,Tap,Tippen,,Tap gesture event name
Event_Gesture_DoubleTap,Double Tap,Doppeltippen,,Double tap gesture event name
Event_Gesture_DragStart,Drag Start,Start von Ziehen,,Drag start gesture event name
Event_Gesture_DragMove,Dragging,Ziehen,,Dragging gesture event name
Event_Gesture_DragEnd,Drag End,Ende von Ziehen,,Drag end gesture event name
Event_Gesture_Flick,Flick,Schnipsen,,Flick gesture event name
Event_Gesture_PinchStart,Pinch Start,Start von Zusammenziehen,,Pinch start gesture event name
Event_Gesture_PinchIn,Pinch In,Zusammenziehen hinein,,Pinch in gesture event name
Event_Gesture_PinchOut,Pinch Out,Zusammenziehen heraus,,Pinch out gesture event name
Event_Gesture_PinchEnd,Pinch End,Ende von Zusammenziehen,,Pinch end gesture event name
Event_Gesture_RotateStart,Rotate Start,Start von Drehen,,Rotate start gesture event name
Event_Gesture_Rotating,Rotating,Drehen,,Rotating gesture event name
Event_Gesture_RotateEnd,Rotate End,Ende von Drehen,,Rotate end gesture event name
Event_Gesture_Global_Tap,Global Tap,Tippen (global),,Global tap gesture event name
Event_Gesture_Global_DoubleTap,Global Double Tap,Doppeltippen (global),,Global double tap gesture event name
Event_Gesture_Global_DragStart,Global Drag Start,Start von Ziehen (global),,Global drag start gesture event name
Event_Gesture_Global_DragMove,Global Dragging,Ziehen (global),,Global dragging gesture event name
Event_Gesture_Global_DragEnd,Global Drag End,Ende von Ziehen (global),,Global drag end gesture event name
Event_Gesture_Global_Flick,Global Flick,Schnipsen (global),,Global flick gesture event name
Event_Gesture_Global_PinchStart,Global Pinch Start,Start von Zusammenziehen (global),,Global Pinch Start gesture event name
Event_Gesture_Global_PinchIn,Global Pinch In,Zusammenziehen hinein (global),,Global Pinch In gesture event name
Event_Gesture_Global_PinchOut,Global Pinch Out,Zusammenziehen heraus (global),,Global Pinch Out gesture event name
Event_Gesture_Global_PinchEnd,Global Pinch End,Ende von Zusammenziehen (global),,Global Pinch End gesture event name
Event_Gesture_Global_RotateStart,Global Rotate Start,Start von Drehen (global),,Global Rotate Start gesture event name
Event_Gesture_Global_Rotating,Global Rotating,Drehen (global),,Global Rotating gesture event name
Event_Gesture_Global_RotateEnd,Global Rotate End,Ende von Drehen (global),,Global Rotate End gesture event name
MarketplaceFilter_Downloaded,Downloaded,Heruntergeladen,,Downloaded filter name for marketplace library
MarketplaceFilter_GMS2Only,GMS 2.x,GMS 2.x,,Studio 2 assets filter name for marketplace library
MarketplaceFilter_GMS1Only,GMS 1.x,GMS 1.x,,Studio 1 assets filter name for marketplace library
ide_language_description,IDE language,IDE-Sprache,,Label beside the IDE language selection
notification_popups,Enable notifications,Benachrichtigungen aktivieren,,Enable Notification messages
notification_timeout,Notification timeout (ms),Benachrichtigungs-Zeitüberschreitung (ms),,Notification timeout in ms
android_linktoamazonsubmit,Link to Amazon Submission Guide,Link zu Amazon-Einsendungsleitfaden,,Link to Amazon Submission Guide
RemoteWorker_AddWorker,Add Worker,Worker hinzufügen,,Add Worker Dialog Title
RemoteWorker_DeleteDialogMessage,Are you sure you wish to delete this remote?,Möchten Sie dieses Remote wirklich löschen?,,the message when a user tries to delete a remote
RemoteWorker_DeleteDialogTitle,Delete Remote,Remote löschen,,message title when the user wants to delete a remote
Settings_VCVARS32,You must specifiy the full path to the VCVARS32.BAT file,Sie müssen den vollen Pfad zur Datei VCVARS32.BAT angeben,,Shown when you don't specify the vcvars32.bat file
Error_PS4ParamEditor,PARAM.SFO editor not available on Mac.\nPlease edit on Windows and copy to {0}/options/ps4/sce_sys/PARAM.SFO,PARAM.SFO Editor nicht auf Mac verfügbar.\nBitte unter Windows bearbeiten und nach {0}/options/ps4/sce_sys/PARAM.SFO kopieren,,Shown when trying to edit PARAM.SFO on the Mac
Error_PS4TrophyEditor,Trophy editor not available on Mac.\nPlease edit on Windows and copy to {0}/options/ps4/sce_sys/trophy/trophy00.trp,Trophäeneditor nicht auf Mac verfügbar.\nBitte unter Windows bearbieten und nach {0}/options/ps4/sce_sys/trophy/trophy00.trp kopieren,,Shown when trying to edit PS4 trophies on the Mac
FindReplace_Title,Find and Replace,Suchen und Ersetzen,,Find and Replace title
FindReplace_ToggleReplace,Toggle Replace,Ersetzen ein/aus,,Toggle Replace Options
FindReplace_WholeWord,Whole Word Only,Nur ganzes Wort,,Whole Word Only Option
FindReplace_CaseSensitive,Case Sensitive,Unterscheidet Groß- und Kleinschreibung,,Case Sensitive Option
FindReplace_FindPrevious,Find Previous,Vorheriges finden,,Find Previous
FindReplace_FindNext,Find Next,Nächstes finden,,Find Next
FindReplace_ReplaceNext,Replace Next,Nächstes ersetzen,,Replace Next
FindReplace_ReplaceAll,Replace All,Alle ersetzen,,Replace All
Preferences_iOS_suppress,Suppress build and run (only create Xcode project on macOS),Build und Ausführung unterdrücken (nur Xcode-Projekt auf macOS erstellen),,Preferences/Platform Settings/iOS
Preferences_iOS_install_path,macOS Install Path,macOS-Installationspfad,,Preferences/Platform Settings/iOS
Preferences_iOS_default_team_id,Default team identifier,Standard-Teamidentifikator,,Preferences/Platform Settings/iOS
Preferences_android_sdk_location,Android SDK location,Ort von Android-SDK,,Preferences/Platform Settings/Android
Preferences_android_ndk_location,Android NDK location,Ort von Android-NDK,,Preferences/Platform Settings/Android
Preferences_android_jdk_location,Java JDK location,Ort von Java-JDK,,Preferences/Platform Settings/Android
Preferences_windows_vs_path,Visual Studio location,Ort von Visual Studio,,Preferences/Platform Settings/Windows
Preferences_winuwp_vs_path,Visual Studio location,Ort von Visual Studio,,Preferences/Platform Settings/WinUWP
Preferences_winuwp_tools_folder,Win UWP Tools location,Ort von Win UWP Tools,,Preferences/Platform Settings/WinUWP
Preferences_macos_default_team_id,Default team identifier,Standard-Teamidentifikator,,Preferences/Platform Settings/macOS
Preferences_ps4_sdk_dir,PS4 SDK location,Ort von PS4-SDK,,Preferences/Platform Settings/PS4
Preferences_ps4_tools_dir,PS4 Tools location,Ort von PS4-Tools,,Preferences/Platform Settings/PS4
Preferences_ps4_vs_path,Visual Studio location,Ort von Visual Studio,,Preferences/Platform Settings/PS4
Preferences_xbone_xdk_dir,XDK location,Ort von XDK,,Preferences/Platform Settings/Xbone
Preferences_xbone_tools_dir,Xbox One Tools location,Ort von Xbox One-Tools,,Preferences/Platform Settings/Xbone
Preferences_xbone_xbone_dir,Xbox One SDK location,Ort von Xbox One-SDK,,Preferences/Platform Settings/Xbone
Preferences_xbone_vs_path,Visual Studio location,Ort von Visual Studio,,Preferences/Platform Settings/Xbone
ProjectLoad_BadPathTitle,Unsafe Path,Unsicherer Pfad,,Bad Path message title when failing badpath check on load
ResourceTree_Search_Filters,Filters:,Filter:,,Filter label on Resource Tree search
ResourceTree_Search_Go,Go,Los,,Go Button Label
ResourceTree_Search_Reset,Reset,Zurücksetzen,,Reset Button Label
ResourceTree_Views_Views,Views,Anzeigen,,Views label
ResourceTree_Views_Clone,Clone,Klonen,,Clone resource tree view label
ResourceTree_Views_Delete,Delete Current,Aktuelles löschen,,Delete Current Resource Tree View Label
ResourceTree_HorizontalSeparators,Show horizontal separators,Horizontale Trennzeichen anzeigen,,Show Horizontal Separators in Resource Tree
ResourceTree_HorizontalSeparatorColour,Horizontal separator colour,Farbe für horizontale Trennzeichen,,Choose colour for Horizontal Separators in Resource Tree
ResourceTree_TreeLineColour,Tree line colour,Farbe für Baumlinien,,Choose colour for the Tree Lines
ResourceTree_DefaultBackgroundColour,Default background colour,Standard-Hintergrundfarbe,,Default Background Colour
ResourceTree_BackgroundColourHelp,Ensure alpha level is increased to display node highlight,"Sicherstellen, dass Alphastufe erhöht wird, um Knotenmarkierungen anzuzeigen",,Help label for the Resource Tree background colours
ResourceTree_SpriteBackgroundColour,Sprites background colour,Hintergrundfarbe für Sprites,,Background Colour for Sprites
ResourceTree_TileSetsBackgroundColour,Tile Sets background colour,Hintergrundfarbe für Tilesets,,Background Colour for Tile Sets
ResourceTree_SoundsBackgroundColour,Sounds background colour,Hintergrundfarbe für Sounds,,Background Colour for sounds
ResourceTree_PathsBackgroundColour,Paths background colour,Hintergrundpfade für Pfade,,Backgound Colour for Paths
ResourceTree_ScriptsBackgroundColour,Scripts background colour,Hintergrundfarbe für Skripte,,Background Colour for Scripts
ResourceTree_ShadersBackgroundColour,Shaders background colour,Hintergrundfarbe für Shader,,Background Colour for Shaders
ResourceTree_FontsBackgroundColour,Fonts background colour,Hintergrundfarbe für Schriftarten,,Background Colour for Fonts
ResourceTree_TimelinesBackgroundColour,Timelines background colour,Hintergrundfarbe für Zeitlinien,,Background Colour for Timelines
ResourceTree_ObjectsBackgroundColour,Objects background colour,Hintergrundfarbe für Objekte,,Background Colour for Objects
ResourceTree_RoomBackgroundColour,Rooms background colour,Hintergrundfarbe für Räume,,Background Colour for Rooms
ResourceTree_IncludedFilesBackgroundColour,Included Files background colour,Hintergrundfarbe für enthaltene Dateien,,Background Colour for Included Files
ResourceTree_ExtensionsBackgroundColour,Extensions background colour,Hintergrundfarbe für Erweiterungen,,Background Colour for Extensions
ResourceTree_OptionsBackgroundColour,Options background colour,Hintergrundfarbe für Optionen,,Background Colour for Options
ResourceTree_ConfigsBackgroundColour,Configurations background colour,Hintergrundfarbe für Konfigurationen,,Background Colour for Configurations
ResourceTree_NotesBackgroundColour,Notes background colour,Hintergrundfarbe für Notizen,,Background Colour for Notes
ResourceTree_MinItemSize,Minimum zoom (%),Mindestzoom (%),,Minimum Zoom on Resource Tree
ResourceTree_MaxItemSize,Maximum zoom (%),Maximalzoom (%),,Maximum Zoom on Resource Tree
ResourceTree_DefaultLabelColour,Default Label Colour,Farbe für Standardbeschriftung,,Default Label Colour
ResourceTree_SpriteLabelColour,Sprite Label Colour,Farbe für Sprite-Beschriftung,,Label Colour for Sprites
ResourceTree_TileSetsLabelColour,Tile Sets Label Colour,Farbe für Tileset-Beschriftung,,Label Colour for Tile Sets
ResourceTree_SoundsLabelColour,Sounds Label Colour,Farbe für Sound-Beschriftung,,Label Colour for sounds
ResourceTree_PathsLabelColour,Paths Label Colour,Farbe für Pfad-Beschriftung,,Backgound Colour for Paths
ResourceTree_ScriptsLabelColour,Scripts Label Colour,Farbe für Skript-Beschriftung,,Label Colour for Scripts
ResourceTree_ShadersLabelColour,Shaders Label Colour,Farbe für Shader-Beschriftung,,Label Colour for Shaders
ResourceTree_FontsLabelColour,Fonts Label Colour,Farbe für Schriftart-Beschriftung,,Label Colour for Fonts
ResourceTree_TimelinesLabelColour,Timelines Label Colour,Farbe für Zeitlinien-Beschriftung,,Label Colour for Timelines
ResourceTree_ObjectsLabelColour,Objects Label Colour,Farbe für Objektbeschriftung,,Label Colour for Objects
ResourceTree_RoomLabelColour,Room Label Colour,Farbe für Raumbeschriftung,,Label Colour for Rooms
ResourceTree_IncludedFilesLabelColour,Included Files Label Colour,Farbe für Beschriftung von enthaltenen Dateien,,Label Colour for Included Files
ResourceTree_ExtensionsLabelColour,Extensions Label Colour,Farbe für Erweiterungsbeschriftung,,Label Colour for Extensions
ResourceTree_OptionsLabelColour,Options Label Colour,Farbe für Optionsbeschriftung,,Label Colour for Options
ResourceTree_ConfigsLabelColour,Configurations Label Colour,Farbe für Konfigurationsbeschriftung,,Label Colour for Configurations
ResourceTree_NotesLabelColour,Notes Label Colour,Farbe für Notizenbeschriftung,,Label Colour for Notes
ResourceTree_DeleteView_Confirm,Delete the selected view: {0}?,Ausgewählte Ansicht löschen: {0}?,,Delete the currently selected view.
