Name,English,Translation,Restrictions,Comment
ResourceTree_ParticleSystemsIconColour,Particle Systems icon colour,Farbe des Partikelsystem-Symbols,,Icon Colour for Particle Systems
ResourceTree_SequencesIconColour,Sequences icon colour,Sequenzsymbolfarbe,,Icon Colour for Sequences
ResourceTree_Notes_Singular,Note,Hinweis,,Note resource name singular
ResourceTree_Objects_Singular,Object,Objekt,,Object resource name singular
ResourceTree_Paths_Singular,Path,Pfad,,Path resource name singular
ResourceTree_Rooms_Singular,Room,Raum,,Room resource name singular
ResourceTree_Scripts_Singular,Script,Skript,,Script resource name singular
ResourceTree_Shaders_Singular,Shader,Shader,,Shader resource name singular
ResourceTree_Sounds_Singular,Sound,Sound,,Sound resource name singular
ResourceTree_Sprites_Singular,Sprite,Sprite,,Sprite resource name singular
ResourceTree_Tilesets_Singular,Tile Set,Tile-Set,,Tileset resource name singular
ResourceTree_Timelines_Singular,Timeline,Zeitlinie,,Timeline resource name singular
ResourceTree_Fonts_Singular,Font,Schriftart,,Font resource name singular
ResourceTree_Sequences_Singular,Sequence,Sequenz,,Sequence resource name singular
ResourceTree_AnimCurves_Singular,Animation Curve,Animationskurve,,Animcurve resource name singular
ResourceTree_Extensions_Singular,Extension,Erweiterung,,Extension resource name singular
ResourceTree_IncludedFiles_Singular,Included File,Enthaltene Datei,,Included File resource name singular
RT_Unknown,Resource,Ressource,,unknown resource type name
RT_RoomInstance,Object Instances,Objektinstanzen,,room instance resource name
RT_RoomInstance_Singular,Object Instance,Objektinstanz,,room instance resource name singular
Sequences,Sequences,Sequenzen,,Sequences preference group heading
Animation Curves,Animation Curves,Animationskurven,,Animation Curves preference group subheading
Pick Whip,Pick Whip,Pick Whip,,Pick Whip preference group subheading
Smart Guides,Smart Guides,Smart Guide,,Smart Guides preference group subheading
Nine Slices,Nine Slices,Nine Slices,,Nine Slices preference group subheading
Audio Emitters,Audio Emitters,Audio-Emitter,,Audio Emitters preference group subheading
Particle Systems,Particle Systems,Partikelsysteme,,Particle Systems preference group subheading
Static Variables,Static Variables,Statische Variablen,,Static Variables preference group subheading
SyntaxError_ConstructorsOnly,only functions that are declared as constructors can use inheritance.,"Nur Funktionen, die als Konstruktoren deklariert sind, können Vererbung verwenden.",,syntax error
SyntaxError_InvalidFunctionModifier,unknown function atribute {0},Unbekannter Funktionsattribut {0},,syntax error
SyntaxError_InheritedFunctionArguments,Inherited argument "{0}" is not in function arguments,Inhärentes Argument "{0}" ist nicht in Funktionsargumenten,,syntax error
SyntaxError_Only16NamedArgs,only 16 named arguments supported in a function declaration,Es werden nur 16 benannte Argumente in einer Funktionsdeklaration unterstützt.,,syntax error
FileFilter_AndroidCreateExeMessage,Save as .aab or .apk,Speichern unter .aab oder .apk,,Save as .aab or .apk
ggs_ios_launchscreen,Launch Screen,Startbildschirm,,Launch Screen
ggs_ios_launchscreen_landscape,Launch Screen Landscape,Bildschirmlandschaft starten,,Launch Screen Landscape
ResourceMenu_CreateSequence,Create Sequence,Sequenz erstellen,,Resource menu entry
ResourceMenu_CreateParticleSystem,Create Particle System,Partikelsystem erstellen,,Resource menu entry
ResourceMenu_CreateCurve,Create Animation Curve,Animationskurve erstellen,,Resource menu entry
ResourceMenu_CreateAudioEmitter,Create Audio Emitter,Audio-Emitter erstellen,,Resource menu entry
ResourceTree_Sequences,Sequences,Sequenzen,,Resource tree label
ResourceTree_Particles,Particle Systems,Partikelsysteme,,Resource tree label
ResourceTree_Curves,Animation Curves,Animationskurven,,Resource tree label
ResourceTree_AudioEmitters,Audio Emitters,Audio-Emitter,,Resource tree label
ResourceTree_CreateVectorSprite,Create Vector Sprite,Vektor-Sprite erstellen,,Resource tree label
ResourceTree_OpenInShapeViewer,Open in Shape Viewer,Im Shape-Viewer öffnen,,Resource tree label
SequenceEditor_Title,Sequence: {0},Sequenz: {0},,Sequence editor window title
SequenceEditor_Pref_AutoRecord,Automatically record changes,Änderungen automatisch aufzeichnen,,Sequence auto record preference
SequenceEditor_Pref_PauseCanvas,Pause when clicking on canvas,Beim Klicken auf die Arbeitsfläche anhalten,,Sequence pause canvas preference
SequenceEditor_Pref_OverlapDelay,Overlap selection delay in milliseconds,Überlappung der Auswahlverzögerung in Millisekunden,,Sequence canvas preference
SequenceEditor_Pref_ShowBackdrop,Show canvas frame on newly created sequences,Arbeitsflächen-Frame in neu erstellten Sequenzen anzeigen,,Show canvas frame newly created sequence preference
SequenceEditor_Pref_BackdropWidth,Canvas frame width on newly created sequences,Arbeitsflächen-Frame-Breite bei neu erstellten Sequenzen,,canvas frame width newly created sequence preference
SequenceEditor_Pref_BackdropHeight,Canvas frame height on newly created sequences,Arbeitsflächen-Frame-Höhe bei neu erstellten Sequenzen,,canvas frame height newly created sequence preference
SequenceEditor_Toolbar_Design,Design,Design,,Design button
SequenceEditor_Toolbar_Code,Code,Code,,Code button
SequenceEditor_Toolbar_Split,Split,Teilen,,Split button
AnimCurveEditor_Title,Animation Curve: {0},Animationskurve: {0},,Animation Curve editor window title
ShapeViewerEditor_Title,Shape Viewer: {0},Formen-Viewer: {0},,Shape Viewer editor window title
AudioEmitterEditor_Title,Audio Emitter: {0},Audio-Emitter: {0},,Audio Emitter editor window title
DopeSheet_Column_Tracks,Tracks,Spuren,,Dope sheet column tracks
Sequence_Dopesheet_Empty_TrackPanel_Header,Track Panel,Spuren-Bedienfeld,,empty track panel header
Sequence_Dopesheet_Empty_TrackPanel_Description,Click or drag an asset here to create an asset track. Organise & order your tracks in this panel.,"Klicken oder ziehen Sie ein Asset hierher, um eine Asset-Spur zu erstellen. Organisieren und ordnen Sie Ihre Spuren in diesem Bereich.",,empty track panel description
Sequence_Dopesheet_Empty_Header,Dope Sheet,Dope Sheet,,empty dopesheet panel header
Sequence_Dopesheet_Empty_Description,'Tracks' appear here when assets have been added to the project. Click or drag assets here.,"„Spuren“ erscheinen hier, wenn dem Projekt Assets hinzugefügt wurden. Klicken oder ziehen Sie Assets hierher.",,empty dopesheet panel description
SequenceDopesheet_FPS,fps,FPS,,dopesheet timeline FPS label
SequenceDopeSheet_Timeline_Frames,Frames (f),Frames (f),,timeline time mode setting for frames
SequenceDopeSheet_Timeline_Time,Time (h:m:s),Zeit (h:m:s),,timeline time mode setting for time
SequenceDopeSheet_Timeline_Frames_Units,f,f,,timeline frames mode abbreviation
SequenceDopeSheet_Timeline_Frames_Units_Tooltip,Frames,Frames,,timeline frames mode tooltip
SequenceDopeSheet_Timeline_Time_Units,h:m:s,h:m:s,,timeline time mode abbreviation
SequenceDopeSheet_Timeline_Time_Units_Tooltip,Timestamp,Zeitstempel,,timeline time mode tooltip
SequenceDopeSheet_Timeline_Tooltip_HeadPos,Playhead position ({0}),Playhead-Position ({0}),,timeline playhead position textbox tooltip
SequenceDopeSheet_Timeline_Tooltip_Duration,Sequence length ({0}),Sequenzlänge ({0}),,timeline sequence length textbox tooltip
SequenceDopeSheet_Timeline_ChangeTimeUnitsTooltip,Change time units,Zeiteinheiten ändern,,timeline sequence time unit change tooltip
Seq_GoToTooltip,Go To Function,Zur Funktion,,go to function tooltip
Seq_AddStubTooltip,Add Function,Funktion hinzufügen,,add function tooltip
Seq_DeleteTooltip,Delete Moment,Moment löschen,,delete moment tooltip
Seq_DeleteEventpinTooltip,Delete Broadcast Message,Broadcast-Nachricht löschen,,Delete Broadcast Message tooltip
SE_Menu_Transform,Transform,Transformieren,,Transform menu
SE_Menu_RasterizeSprite,Rasterize as Sprite,Als Sprite rastern,,Rasterize as sprite menu
Tag_Disable_Name,Disable,Deaktivieren,,Disable tag name
Tag_Disable_Description,Disable a track,Eine Spur deaktivieren,,Disable tag description
Tag_Invisible_Name,Invisible,Unsichtbar,,Invisible tag name
Tag_Invisible_Description,Make a track invisible by disabling all rendering,Eine Spur durch Deaktivieren des Renderings unsichtbar machen,,Invisible tag description
Tag_Locked_Name,Locked,Gesperrt,,Locked tag name
Tag_Locked_Description,Prevent editing a track by locking it,"Verhindern Sie das Bearbeiten einer Spur, indem Sie diese sperren",,Locked tag description
Tag_TrackLink_Name,Link,Link,,Track link tag name
Tag_TrackLink_Description,Link a track to another to use its keyframes instead,"Verknüpfen Sie eine Spur mit einer anderen, um stattdessen die Keyframes zu verwenden",,Track link tag description
TagLink_CannotLinkTooltip_Type,This track is not compatible with the selected track,Diese Spur ist nicht mit der ausgewählten Spur kompatibel,,Not compatible track for linking tooltip
TagLink_CannotLinkTooltip_Circular,This would create a cyclic link,Dadurch würde eine zyklische Verknüpfung entstehen,,Cyclic link tooltip
Track_TrackInformation,Track Information,Spur-Informationen,,Track information label
Track_Name,Name,Name,,Name of track label
Track_Graphic,Graphic,Grafik,,Graphic track display nameSequenceParam_
Track_Particles,Particles,Partikel,,Particles track display name
Track_SpriteFrames,Frames,Frames,,Sprite frames track display name
Track_Text,Text,Text,,Text track display name
Track_Instance,Instance,Instanz,,Instance track display name
Track_Sound,Sound,Sound,,Sound track display name
Track_Sequence,Sequence,Sequenz,,Sequence track display name
Track_Code,Code,Code,,Code track display name
Track_Real,Real,Real,,Real track display name
Track_String,String,Zeichenfolge,,String track display name
Track_Resource,Resource,Ressource,,Resource track display name
Track_Color,Colour,Farbe,,Colour track display name
Track_Bool,Boolean,Boolesch,,Boolean track display name
Track_Width,Width,Breite,,Width parameter track display name
Track_Height,Height,Höhe,,Height parameter track display name
Track_Group,Group,Gruppe,,Group component track display name
Track_ClipMask,Clipping Mask,Schnittmaske,,Clipping Mask component track display name
Track_ClipMask_Mask,Mask,Maske,,Clipping mask mask child
Track_ClipMask_Subject,Subject,Subjekt,,Clipping mask subject child
Track_Position,Position,Position,,Track position
Track_UserDefined,Unnamed Variable,Unbenannte Variable,,User defined track
Track_Scale,Scale,Skalieren,,Track scale
Track_Rotation,Rotation,Drehung,,Track rotation
Track_Gain,Volume,Lautstärke,,Track gain
Track_Pitch,Pitch,Tonhöhe,,Track pitch
Track_Falloff,Falloff,Falloff,,Track falloff
Track_MultiplyColour,Colour Multiply,Farbe vervielfachen,,Track colour
Track_AddColour,Colour Add,Farbe hinzufügen,,Track colour
Track_Origin,Origin,Ursprung,,Sequence parameter
Track_ImageSpeed,Image Speed,Bildgeschwindigkeit,,Sequence parameter
Track_ImageIndex,Image Index,Bildindex,,Sequence parameter
Track_ImageAngle,Image Angle,Bildwinkel,,Sequence parameter
Track_ImageBlend,Image Blend,Bildmischung,,Sequence parameter
Track_Param_Channel_X,x,x,,sequence parameter channel x
Track_Param_Channel_Y,y,y,,sequence parameter channel y
Track_Param_Channel_Angle,angle,Winkel,,sequence parameter channel angle
Track_Param_Channel_Colour,colour,Farbe,,sequence parameter channel colour
Track_Param_Channel_Colour_A,alpha,Alpha,,sequence parameter channel colour alpha
Track_Param_Channel_Colour_R,red,rot,,sequence parameter channel colour red
Track_Param_Channel_Colour_G,green,grün,,sequence parameter channel colour green
Track_Param_Channel_Colour_B,blue,blau,,sequence parameter channel colour blue
Track_Param_Channel_Gain,volume,Lautstärke,,sequence parameter channel gain
Track_Param_Channel_Pitch,pitch,Tonhöhe,,sequence parameter channel pitch
Track_Param_Channel_Falloff,falloff,Falloff,,sequence parameter channel falloff
Track_Param_Channel_Index,index,Index,,sequence parameter channel index
Track_Param_Channel_Speed,speed,Geschwindigkeit,,sequence parameter channel speed
Track_Param_Channel_Generic,channel {0},Kanal {0},,sequence parameter channel generic title
AnimCurve_DoubleClickToEdit,Double-click to edit,Zum Bearbeiten doppelklicken,,Double-click to edit anim curve tooltip
AnimCurve_Spline,Curve,Kurve,,Spline submenu animation curve
AnimCurve_FunctionLinear,Linear,Linear,,Animation curve linear function
AnimCurve_FunctionCentripetalCatmullRom,Centripetal Catmull-Rom,Centripetal Catmull-Rom,,Animation curve centripetal catmull-rom function
AnimCurve_Single,Single channel,Einzelkanal,,Single channel animation curve
AnimCurve_Dual,Dual channel,Zweikanal,,Dual channel animation curve
AnimCurve_Color,Color channels,Farbkanäle,,Color channels animation curve
AnimCurveDesc_Single,A single channel animation curve,Eine Einzelkanal-Animationskurve,,Default animation curve description
AnimCurveDesc_Dual,A dual channel animation curve,Eine Zweikanal-Animationskurve,,Dual-channel animation curve description
AnimCurveDesc_Color,A color channel animation curve,Eine Farbkanal-Animationskurve,,Color animation curve description
AnimCurveChannelDesc_Default,The default curve channel,Der Standard-Kurvenkanal,,Default animation curve channel
AnimCurveChannelDesc_R,The red color channel,Der rote Farbkanal,,rgba animation curve channel
AnimCurveChannelDesc_G,The green color channel,Der grüne Farbkanal,,rgba animation curve channel
AnimCurveChannelDesc_B,The blue color channel,Der blaue Farbkanal,,rgba animation curve channel
AnimCurveChannelDesc_A,The alpha color channel,Alphafarbkanal,,rgba animation curve channel
AnimCurve_ZoomIn,Zoom In,Hereinzoomen,,zoom in
AnimCurve_ZoomOut,Zoom Out,Herauszoomen,,zoom out
AnimCurve_CentreFit,Centre Fit,Zentrieren,,centre fit
AnimCurve_PointLabel,point {0}:,Punkt {0}:,,curve point label
AnimCurve_SetRange,Set Range,Bereich festlegen,,set range
AnimCurve_Upper,Upper,Oberer,,range upper
AnimCurve_Lower,Lower,Unterer,,range lower
AnimCurve_InsertPoint,Insert Point,Punkt einfügen,,insert point
AnimCurve_EditColour,Edit Colour,Farbe bearbeiten,,edit colour
AnimCurve_DeletePoint,Delete Point,Punkt löschen,,delete point
AnimCurve_DeletePoints,Delete Points,Punkte löschen,,delete points
AnimCurve_DeleteConfirm,Are you sure you want to delete {0}?,Möchten Sie {0} wirklich löschen?,,Delete confirmation
AnimCurve_DeleteAllConfirm,Are you sure you want to delete all curves?,Möchten Sie wirklich alle Kurven löschen?,,Delete confirmation
AnimCurveEditor,Anim Curve Editor,Animationskurven-Editor,,anim curved editor pref type name
animcurve_automaticdeletion,Automatic response to curve deletion,Automatische Reaktion auf Löschen von Kurven,,Automatic deletion in animation curve editor
animcurve_compactlayout,Use compact layout,Kompaktes Layout verwenden,,animcurve editor compact layout pref
KeyMenu_StretchParam,Stretch Parameter Key,Parameter-Key dehnen,,Stretch key until sequence ends for parameters
KeyMenu_StretchAsset,Stretch Asset Key,Asset-Key dehnen,,Stretch key until sequence ends for assets
KeyMenu_DeleteParam,Delete Parameter Key,Parameter-Key löschen,,Delete key for parameters
KeyMenu_DeleteAsset,Delete Asset Key,Asset-Key löschen,,Delete key for assets
KeyMenu_CopyToEnd,Copy to End,An Ende kopieren,,Copy to end menu entry
KeyMenu_CopyToStart,Copy to Start,An Anfang kopieren,,Copy to start menu entry
KeyMenu_CopyKey,Copy Key,Key kopieren,,Copy key menu entry
KeyMenu_CutKey,Cut Key,Key ausschneiden,,Cut key menu entry
KeyMenu_PasteKey,Paste Key,Key einfügen,,Paste key menu entry
KeyMenu_PasteInPlaceKey,Paste Key In Place,Key an Position einfügen,,Paste key in place menu entry
Seq_KeyMenu_Disabled,Disabled,Deaktiviert,,Disabled key context menu entry
SequenceEditor_SetKeyAsset,Set Key Asset,Key-Asset festlegen,,set key asset dialog title
SelectTrackDialog_Title,Select Track,Spur auswählen,,Select track dialog title
SequenceTrackGroupName,Group,Gruppe,,Group
SequenceCanvas_Menu_Select,Select,Auswählen,,Select another canvas item submenu
SequenceCanvas_Menu_Rename,Rename,Umbenennen,,Rename selected canvas item
SequenceCanvas_Menu_GroupSelected,Group,Gruppe,,Group all selected canvas items together
SequenceCanvas_Menu_FindInDopeSheet,Find in Sheet,In Folie suchen,,Find the clicked item in the dope sheet
SequenceCanvas_Menu_FindOtherInDopeSheet,Find Other,Weitere suchen,,Find another item in the dope sheet
SequenceCanvas_Menu_CannotGroupSelected_Tooltip,The selected items cannot be grouped together because they do not have the same parent,"Die ausgewählten Elemente können nicht gruppiert werden, da sie nicht dasselbe übergeordnete Element besitzen.",,Tooltip reason for not being able to group selected items together
SequenceCanvas_Menu_Record,Record,Aufzeichnung,,Sequence canvas context menu entry to record something
SequenceCanvas_Menu_RecordTranslation,Record Position,Position aufzeichnen,,Sequence canvas context menu entry to record translation
SequenceCanvas_Menu_RecordScale,Record Scale,Skalierung aufzeichnen,,Sequence canvas context menu entry to record scale
SequenceCanvas_Menu_RecordRotation,Record Rotation,Drehung aufzeichnen,,Sequence canvas context menu entry to record rotation
SequenceCanvas_Menu_OpenEditor,Open Editor...,Editor öffnen ...,,Open editor for item resource
SequenceCanvas_Menu_Remove,Remove Key,Key entfernen,,Sequence canvas context menu entry to remove selected items
SequenceCanvas_Menu_RemoveTracks,Remove Track,Spur entfernen,,Sequence canvas context menu entry to remove selected tracks
SequenceCanvas_ToggleGizmos,Toggle Gizmos,Gizmos umschalten,,Toggle gizmos on/off tooltip
SequenceCanvas_ToggleGizmosSpecific,Toggle specific gizmos,Bestimmte Gizmos umschalten,,Toggle specific gizmos on/off tooltip
SequenceCanvas_ToggleTransformGizmo,Toggle Transform Gizmo Mode,Gizmo-Transformations-Modus umschalten,,Tooltip for transform gizmo settings button
SequenceCanvas_ToggleTransformGizmoSpecific,Select Transform Gizmo Mode,Gizmo-Transformations-Modus auswählen,,Tooltip for transform gizmo settings menu
SequenceCanvas_ToggleGizmoTranslate,Translate,Verschieben,,Toggle to translate canvas gizmo
SequenceCanvas_ToggleGizmoScale,Scale,Skalieren,,Toggle to scale canvas gizmo
SequenceCanvas_ToggleGizmoRotate,Rotate,Drehen,,Toggle to rotate canvas gizmo
SequenceCanvas_ToggleGizmoOrigin,Origin,Ursprung,,Toggle to origin canvas gizmo
SequenceCanvas_ToggleBackdrop,Toggle canvas frame,Arbeitsflächen-Frame umschalten,,Toggle canvas frame on/off tooltip
SequenceCanvas_ToggleBackdropSpecific,Canvas frame settings,Einstellungen für Arbeitsfläche-Frame,,canvas frame settings tooltip
SequenceCanvas_BackdropEnabled,Canvas frame enabled,Arbeitsflächen-Frame aktiviert,,canvas frame enabled label
SequenceCanvas_BackdropImageRefEnabled,Image reference enabled,Bildverweis aktiviert,,image reference enabled label
SequenceCanvas_BackdropWidth,Width,Breite,,canvas frame width label
SequenceCanvas_BackdropHeight,Height,Höhe,,canvas frame height label
SequenceCanvas_xorigin,Origin X,Ursprung X,,canvas origin x
SequenceCanvas_yorigin,Origin Y,Ursprung Y,,canvas origin y
SequenceCanvas_Toolbox_Events,Events,Ereignisse,,Toolbox events tooltip
SequenceCanvas_Toolbox_AddAction,Add action,Aktion hinzufügen,,Toolbox add action tooltip
SequenceCanvas_Toolbox_Edit,Edit,Bearbeiten,,Toolbox edit tooltip
SequenceCanvasWindow_Multiselect,Multiselect,Mehrfachauswahl,,Canvas window multiselect label
SequenceCanvas_Toolbox_MultiselectTooltip,Multiple targets,Mehrere Ziele,,Multiple toolbox targets tooltip
SequenceCanvas_EditWindow_Title,Edit,Bearbeiten,,Edit window title
SequenceCanvas_DeleteWindow_Title,Delete,Löschen,,Delete window title
SequenceCanvas_DeleteWindow_Message,Are you sure you want to delete {0}?,Möchten Sie {0} wirklich löschen?,,Delete confirmation label
SequenceCanvas_DeleteWindow_Multiselect_Message,Are you sure you want to delete the selected items?,Möchten Sie die ausgewählten Elemente wirklich löschen?,,Delete confirmation label
SequenceCanvas_EventsWindow_Title,Events,Ereignisse,,Events window title
SequenceCanvas_Toolbox_Delete,Delete,Löschen,,Toolbox delete tooltip
SequenceCanvas_Toolbox_SelectThisItem,Select {0},{0} auswählen,,Select item tooltip
SequenceCanvas_MousePosStatus,"({0}, {1})","({0}, {1})",,the mouse position label in the sequence editor canvas status bar
SequenceCanvas_SelectedItemStatus,{0},{0},,the current selection status label in the room editor status bar for one selection
SequenceAddAction_SelectEvent,Select Event,Ereignis auswählen,,Select event label
SequenceAddAction_SelectTarget,Select Target,Ziel auswählen,,Select target label
SequenceAddAction_SelectAction,Select Action,Aktion auswählen,,Select action label
SequenceAddAction_QuickAdd,Add Action,Aktion hinzufügen,,Add action window title
SequenceAddAction_EditAction,Action Properties,Aktionseigenschaften,,Action Properties window title
SequenceAddAction_NoProperties,This action has no properties,Diese Aktion besitzt keine Eigenschaften,,Action has no properties
SequenceAddAction_Search,Search...,Suche ...,,Search for action
SequenceAddAction_AddAction,Add Action,Aktion hinzufügen,,Add action button
SequenceAddAction_Event,Event,Ereignis,,Event label
SequenceAddAction_Target,Target,Ziel,,Target label
SequenceAddAction_Action,Action,Aktion,,Action label
SequenceAddAction_Properties,Properties,Eigenschaften,,Properties label
SequenceAddAction_AddActionDialog,Are you sure you want to add this action?,Möchten Sie diese Aktion wirklich hinzufügen?,,Are you sure
SequenceAddAction_ActionAdded,Action added!,Aktion hinzugefügt!,,Action added to event confirmation message
SequenceAddAction_EventActionLabel,On {0}: {1},Bei {0}: {1},,What action was added to what event label
SequenceAddAction_AddAnotherAction,Continue,Fortfahren,,Continue button label
SequenceEditWindow_Position,Position,Position,,Position label
SequenceEditWindow_CannotBulkEdit,The selected items cannot be edited in bulk.,Die ausgewählten Elemente können nicht in großen Mengen bearbeitet werden.,,Cannot edit in bulk label
SequenceEditWindow_Scale,Scale,Skalieren,,Scale label
SequenceEditWindow_Flip,Flip,Spiegeln,,Flip label
SequenceEditWindow_Horizontal,Horizontal,Horizontal,,Horizontal label
SequenceEditWindow_Vertical,Vertical,Vertikal,,Vertical label
SequenceEditWindow_Arrange,Arrange,Anordnen,,Arrange render order label
SequenceEditWindow_Volume,Volume,Lautstärke,,Volume label
SequenceCanvas_UnnamedTrack,'???','???',,Unknown track name
SequenceGizmo_MissingResource,Missing Resource,Fehlende Ressource,,Missing resource gizmo text
SequenceGizmo_AudioEmitter,Audio Emitter,Audio-Emitter,,Audio emitter gizmo text
SequenceGizmo_ClippingMask,Clipping Mask,Schnittmaske,,Clipping mask gizmo text
SequenceGizmo_Sound,Sound,Sound,,Sound gizmo text
SequenceGizmo_Sequence,Sequence,Sequenz,,Sequence gizmo text
SequenceGizmo_Group,Group,Gruppe,,Group gizmo text
SequenceGizmo_Ghosting,Delta Ghosting,Delta-Ghosting,,Ghosting gizmo text
SequenceGizmo_Origin,Origin,Ursprung,,Origin gizmo text
SequenceGizmo_ZeroZero,Zero zero,Null Null,,Zero zero gizmo text
SequenceGizmo_AxisTransform,Transform,Transformieren,,Transform gizmo text
SequenceGizmo_ShowAxes,Show Axes,Achsen anzeigen,,Show axes gizmo text
SequenceGizmo_TranslationPath,Translation Path,Verschiebungspfad,,Translation path gizmo text
Sequence_AddTagTooltip,Add tag,Tag hinzufügen,,Add tag tooltip
Sequence_RemoveTagsTooltip,Remove selected tags,Ausgewählte Tags entfernen,,Remove selected tags tooltip
DopeSheet_Tooltip_NewKey,Record a new key ,Neuen Schlüssel aufzeichnen ,,New key tooltip
DopeSheet_Tooltip_AutoRecord,Automatically record changes ,Änderungen automatisch aufzeichnen ,,Auto record tooltip
DopeSheet_Tooltip_SplitKey,Split the selected keys ,Ausgewählte Schlüssel teilen ,,Split key tooltip
DopeSheet_Tooltip_DeleteKey,Delete the selected keys ,Ausgewählte Schlüssel löschen ,,Delete key tooltip
DopeSheet_Tooltip_RaiseEvent,Broadcast message,Broadcast-Nachricht,,Broadcast message tooltip
DopeSheet_Tooltip_GlobalSpace,Global space,Globaler Raum,,Current space is global
DopeSheet_Tooltip_LocalSpace,Local space,Lokaler Speicherplatz,,Current space is local
DopeSheet_Tooltip_GlobalLocalSpace,Toggle between local and global space,Zwischen lokalem und globalem Raum umschalten,,Toggle local-global space tooltip
DopeSheet_Tooltip_TrackOptions,Options,Optionen,,Track options tooltip
DopeSheet_Tooltip_Tags,Tags,Tags,,Tags options tooltip
DopeSheet_Tooltip_TrackLink,Link to another track,Mit einer anderen Spur verknüpfen,,Track link to other tooltip
DopeSheet_RootNode,Root,Stamm,,Root node
ContextMenu_AddCodeKey,Add code,Code hinzufügen,,Add a code key
ContextMenu_AddCurveKey,Add curve,Kurve hinzufügen,,Add an animation curve
ContextMenu_TrackInterpolation,Interpolation,Interpolation,,Real number interpolation
ContextMenu_TrackInterpOff,Off,Aus,,Real number interpolation off
ContextMenu_TrackInterpLerp,Linear,Linear,,Real number interpolation linear
ContextMenu_Cut,Cut,Ausschneiden,,Cut
ContextMenu_Copy,Copy,Kopieren,,Copy
ContextMenu_Paste,Paste,Einfügen,,Paste
ContextMenu_AddResourceTrack,New Resource,Neue Ressource,,Create resource track
ContextMenu_AddComponentTrack,New Component,Neue Komponente,,Create component track
ContextMenu_AddParameterTrack,New Parameter,Neuer Parameter,,Create parameter track
ContextMenu_DeleteTrack,Delete track(s),Spur(en) löschen,,Delete this track
ContextMenu_EditEvents,Edit Broadcast Message,Broadcast-Nachricht bearbeiten,,Edit broadcast message
ContextMenu_RemoveRaisedEvents,Remove Broadcast Message,Broadcast-Nachricht entfernen,,Remove broadcast message
ContextMenu_EditMoment,Edit Moment,Moment bearbeiten,,Edit Moment
ContextMenu_RemoveMomentKey,Remove Moment,Moment entfernen,,Remove Moment
ContextMenu_EditCode,Edit code,Code bearbeiten,,Edit code
