Name,English,Translation,Restrictions,Comment
ggs_network_config_manifest,Network Manifest,Netzwerkmanifest,,Network Config Manifest
ggs_small_logo,Small Logo,Kleines Logo,,Small Logo
ggs_store_logo,Store Logo,Logo in Shop,,Store Logo
ggs_large_logo,Large Logo,Großes Logo,,Large Logo
ggs_wide_logo,Wide Logo,Breites Logo,,Wide Logo
ggs_small_cycle_image,Small Cycle Image,Kleines Zyklusbild,,Small Cycle Image
ggs_wide1_cycle_image,Wide Cycle Image 1,Breites Zyklusbild 1,,Wide Cycle Image 1
ggs_wide2_cycle_image,Wide Cycle Image 2,Breites Zyklusbild 2,,Wide Cycle Image 2
ggs_wide3_cycle_image,Wide Cycle Image 3,Breites Zyklusbild 3,,Wide Cycle Image 3
ggs_wide4_cycle_image,Wide Cycle Image 4,Breites Zyklusbild 4,,Wide Cycle Image 4
ggs_wide5_cycle_image,Wide Cycle Image 5,Breites Zyklusbild 5,,Wide Cycle Image 5
ggs_wide6_cycle_image,Wide Cycle Image 6,Breites Zyklusbild 6,,Wide Cycle Image 6
ggs_wide7_cycle_image,Wide Cycle Image 7,Breites Zyklusbild 7,,Wide Cycle Image 7
ggs_wide8_cycle_image,Wide Cycle Image 8,Breites Zyklusbild 8,,Wide Cycle Image 8
ggs_wide9_cycle_image,Wide Cycle Image 9,Breites Zyklusbild 9,,Wide Cycle Image 9
ggs_copy_runner_to_dest,Copy exe to output folder,exe in Ausgabeordner kopieren,,Copy exe to output folder
Import,Import,Importieren,,Import
Convert,Convert,Konvertieren,,Convert
movedegreerange_description,Workspace keyboard navigation degree range,Navigationsbereich für Workspace-Tastatur in Grad,,Description for degree range of moving a window
resetzoomonmoving_description,Workspace keyboard navigation resets zoom,Navigation mit Workspace-Tastatur setzt Zoom zurück,,Description for reset zoom
background_image,Background Image,Hintergrundbild,,Background Image
workspacebackground_skin_description,IDE skin,IDE-Skin,,Label to use to prompt the user to pick a new skin for the IDE
workspacebackgroundfit_description,Image Scaling,Bildskalierung,,Description for workspace background fit
showworkspacebackground_description,Show background image on workspaces,Hintergrundbild in Workspaces zeigen,,Description for showing workspace background
adddefaultlayers_description,Add default room layers,Standard-Raumebenen hinzufügen,,Description for adding default layers
defaultbackgroundroomcolour_description,Default background layer colour,Standardfarbe für Hintergrundebene,,Description for the default colour for a room background layer
roomdefaultwidth,Default room width,Standard-Raumbreite,,Default width of a room
roomdefaultheight,Default room height,Standard-Raumhöhe,,Default height of a room
roomdefaultspeed,The default speed of a new room in frames per second (FPS),Die Standardgeschwindigkeit eines neuen Raums in Frames pro Sekunde (FPS),,Default speed of a room
exitconfirmation,Automatic response to exit confirmation,Automatische Reaktion auf Beendigungsbestätigung,,Exit Confirmation Setting
showcompilewindow,Show the compile window during compilation,Kompilierfenster während Kompilierung anzeigen,,Show compile window setting
showsyntaxwindow,Automatically open syntax error window on error detection,Bei Fehlererkennung automatisch Syntaxfehler-Fenster öffnen,,Automatically pop up Syntax Errors when an error occurs setting
showcommandsincompilewindow,Show compiler commands in compile output,Compiler-Befehle in Kompilierungsausgabe anzeigen,,Show Commands in the Compile Window setting
showverbosecompilercommands,Show verbose compiler output,Umfangreiche Compiler-Ausgabe anzeigen,,Show Verbose Compiler commands setting
usesubstfordrivepaths,Use subst for drive paths,Verwenden Sie den SUBST-Befehl für Laufwerkspfade,,Use subst for drive paths to avoid long path errors
temp_location,Temp directory,Temp-Verzeichnis,,Temp location setting
autodeletetempfolder,Automatically delete temp directory on close,Temp-Verzeichnis beim Schließen automatisch löschen,,Auto delete of temp folder setting
deletetempfolder,Delete Temp Folder,Temp-Ordner automatisch löschen,,Delete the temp folder setting
restoredefaults,Restore defaults,Standardwerte wiederherstellen,,Restore default settings
assetcachelocation,Asset cache directory,Asset-Cache-Verzeichnis,,Location of Asset Cache setting
myprojectslocation,'My Projects' directory,Verzeichnis ‚Meine Projekte‘,,My Projects location setting
autoreloadchangedfiles,Automatically reload changed files,Geänderte Dateien automatisch neu laden,,Automatically reload changed files setting
deleteassetcache,Delete Asset Cache,Asset-Cache löschen,,Delete the asset cache now
deleteassetcacheonquit,Automatically delete asset cache directory on close,Asset-Cache-Verzeichnis beim Schließen automatisch löschen,,Delete the asset cache on quit setting
deletetemponquit,Delete temp folder on quit,Temp-Ordner beim Beenden automatisch löschen,,Delete the temp folder on quit setting
opennewresources,Open new assets for edit on creation,Neue Ressourcen bei Erstellung zur Bearbeitung öffnen,,Open new resources setting
alwaysopendroppedresources,Open new assets for edit on dragging files into IDE,Neue Ressourcen beim Ziehen von Dateien in IDE zur Bearbeitung öffnen,,Setting to stop the IDE from opening new resources via drag/drop
externalswfeditor,SWF files,SWF-Dateien,,Path to external swf editor
externalspineeditor,Spine files,Spine-Dateien,,Path to external spine editor
androidsdkpath,Path to Android SDK,Pfad zu Android-SDK,,Path to Android SDK
clearfontcache,Clear font cache,Schriftarten-Cache löschen,,Clear the font cache setting
openscriptsfullscreen,Open scripts in a full screen editor,Skripte in einem Vollbildeditor öffnen,,Open scripts in a full screen editor setting
openshadersfullscreen,Open shaders in a full screen editor,Shader in einem Vollbildeditor öffnen,,Open shaders in a full screen editor setting
openobjecteventsfullscreen,Open object events in a full screen editor,Objektereignisse in einem Vollbildeditor öffnen,,pref full screen object events
openeventtabsinsamewindow,Open event scripts as tabs in same window,Ereignisskripte als Reiter im gleichen Fenster öffnen,,Open the event tabs in the same window
openscripttabsinsamewindow,Open linked scripts as tabs in same window,Verknüpfte Skripte als Reiter im gleichen Fenster öffnen,,Open script tabs in the same window
focuspantexteditor,Pan text editor into view on focus,Texteditor bei Fokus in sichtbaren Bereich verschieben,,auto pan text editor on focus
texteditor_defaultwidth,Default code window width,Standardbreite des Code-Fensters,,default code window width
texteditor_defaultheight,Default code window height,Standardhöhe des Code-Fensters,,default code window height
texteditor_minwidth,Minimum code window width,Mindestbreite des Code-Fensters,,min code window width
texteditor_minheight,Minimum code window height,Mindesthöhe des Code-Fensters,,min code window height
webserverport,Help manual port,Hilfehandbuch-Port,,The port number to use for the help web server setting
externalbrowserforhelp,Use an external browser for help,Externen Browser für Hilfe verwenden,,Use an external browser for help setting
imageeditor_buttonchoiceonframedelete,Automatic response to deleting frames,Automatische Reaktion auf Löschen von Frames,,Automatic button choice on frame deletion setting
imageeditor_choicefortoolchanges,Automatic response to committing changes on tool change,Automatische Reaktion auf Änderungsübernahmen bei Tool-Änderung,,Choice for tool changes setting
imageeditor_layerlockeddisplay,Automatic response to locked layer warning,Automatische Reaktion auf Warnung über gesperrte Ebenen,,Layer locked display setting
imageeditor_groupselecteddialog,Automatic response to group selected warning,Automatische Reaktion auf Warnung für gewählte Gruppe,,Group selected dialog setting
imageeditor_createFromStripConfirm,Automatic response to replacing images during strip import,Automatische Reaktion auf Ersetzen von Bildern während Strip-Import,,create from strip confirm dialog setting
imageeditor_drawthinselection,Draw thin selection outline,Dünnen Auswahlrahmen zeichnen,,Draw Thin selection setting
imageeditor_selectioncolour1,Selection outline primary colour,Primärfarbe des Auswahlrahmens,,Selection colour 1
imageeditor_selectioncolour2,Selection outline secondary colour,Sekundärfarbe des Auswahlrahmens,,Selection colour 2
imageeditor_backgroundcolour,Editor background colour,Editor-Hintergrundfarbe,,Background colour in image editor
imageeditor_transparentbackgroundstyle,Canvas style,Canvas-Style,,Transparent background style in image editor
imageeditor_transparentcolour1,Canvas primary colour,Primärfarbe des Canvas,,Transparent background colour 1 in image editor
imageeditor_transparentcolour2,Canvas secondary colour (block pattern style),Sekundärfarbe des Canvas (Blockmuster-Style),,Transparent background colour 2 in image editor
imageeditor_transparentblocksize,Canvas block size (block pattern style),Canvas-Blockgröße (Blockmuster-Style),,Transparent block size in image editor
imageeditor_gridsettings,Grid Settings,Gittereinstellungen,,grid settings pref
imageeditor_defaultloopmode,Default loop mode,Standard-Schleifenmodus,,image editor setting Default playback loop mode
gridsettings_displaygrid,Display grid,Gitter anzeigen,,GridSettings.DisplayGrid pref
gridsettings_snaptogrid,Snap to grid,An Gitter einrasten,,GridSettings.SnapToGrid pref
gridsettings_xspacing,Grid horizontal spacing (px),Horizontaler Gitterabstand (Pixel),,GridSettings.XSpacing pref
gridsettings_yspacing,Grid vertical spacing (px),Vertikaler GItterabstand (Pixel),,GridSettings.YSpacing pref
gridsettings_colour,Grid line colour,Gitterlinienfarbe,,GridSettings.Colour pref
arctool_colourofknots,Anchor point colour,Ankerpunktfarbe,,Colour of Knots in Arc Tool
arctool_colourofcontrolpoints,Control point colour,Steuerpunktfarbe,,Colour of Control Points in Arc Tool
arctool_colourofcontrollines,Tangent line colour,Tangentenlinienfarbe,,Colour of Control Lines in Arc Tool
arctool_colourofselectedpoints,Selected point colour,Farbe für ausgewählten Punkt,,Colour of Selected Points in Arc Tool
arctool_sizeofpoints,Point size,Punktgröße,,Size of Points in Arc Tool
objecteditor_buttonchoiceondeletion,Automatic response to deleting event,Automatische Reaktion auf Löschen von Ereignis,,Automatic button choice on event deletion in Object Editor
patheditor_linecolour,Path colour,Pfadfarbe,,Line Colour in Path Editor
patheditor_lineerrorcolour,Invalid path colour,Farbe für ungültigen Pfad,,Line Error Colour in Path Editor
patheditor_anchorerrorcolour,Invalid anchor point colour,Ungültige Ankerpunktfarbe,,anchor Error Colour in Path Editor
patheditor_linehighlight,Highlighted path segment colour,Farbe für markiertes Pfadsegment,,Line Highlight in Path Editor
patheditor_anchorcolour,Anchor point colour,Ankerpunktfarbe,,Anchor colour in Path Editor
patheditor_anchorhighlight,Selected anchor point colour,Farbe für gewählten Ankerpunkt,,Anchor highlight colour in Path Editor
patheditor_anchorerrorhighlight,Selected invalid anchor point colour,Farbe für gewählten ungültigen Ankerpunkt,,Anchor error highlight colour in Path Editor
patheditor_anchoractive,Mouseover anchor point colour,Farbe für Mouseover-Ankerpunkt,,Active Anchor colour in Path Editor
patheditor_anchorerroractive,Mouseover invalid anchor point colour,Farbe für ungültigen Mouseover-Ankerpunkt,,error Active Anchor colour in Path Editor
patheditor_insertionprecision,Insert path point precision (px),Präzision für Einfügen von Pfadpunkten (px),,Insertion Precision in Path Editor
patheditor_rotatesensitivity,The path rotation sensitivity,Pfad-Rotationsempfindlichkeit,,Rotation sensitivity in Path Editor
patheditor_scalesensitivity,The path scale sensitivity,Pfad-Skalierungsempfindlichkeit,,Scale Sensitivity in Path Editor
patheditor_anchorwidth,Anchor point width,Ankerpunktbreite,,Anchor width in Path Editor
patheditor_anchorheight,Anchor point height,Ankerpunkthöhe,,Anchor Height in Path Editor
patheditor_maskoverlay,Enable mask overlay for point insertion,Masken-Overlay für Punkteinfügung aktivieren,,Mask Overlay in Path Editor
patheditor_maskcolour,Mask overlay colour,Farbe des Masken-Overlays,,Mask colour in Path editor
resourcetree_automaticdeletion,Automatic response to Asset deletion,Automatische Reaktion auf Löschen von Assets,,Automatic deletion on resource tree
resourcetree_automaticopenall,Automatic response to opening multiple Assets,Automatische Reaktion auf Öffnen mehrerer Assets,,Automatic button choice on opening multiple resources
resourcetree_maxresourcesbeforewarning,Maximum number of Assets to open simultaneously without warning,"Maximale Anzahl an Assets, die ohne Warnung gleichzeitig geöffnet werden können",,Max resources to open before showing a warning
roomeditor_automaticparentitemdeletion,Automatic response to parent room item deletion,Automatische Reaktion auf Löschen von übergeordnetem Raumelement,,Automatic parent item deletion in room editor
roomeditor_automaticparentlayerdeletion,Automatic response to parent room layer deletion,Automatische Reaktion auf Löschen von übergeordneter Raumebene,,Automatic parent layer deletion in room editor
roomeditor_automaticitemdeletion,Automatic response to room item deletion,Automatische Reaktion auf Löschen von Raumelement,,Automatic item deletion in room editor
roomeditor_automaticlayerdeltion,Automatic response to room layer deletion,Automatische Reaktion auf Löschen von Raumebene,,Automatic layer deletion in room editor
roomeditor_automaticacceptitemdrag,Hide warnings when dragging unusable assets onto room layers,Warnungen beim Ziehen nicht verwendbarer Assets auf Raumebenen ausblenden,,Automatic drag acceptance on invalid items in room editor
roomeditor_automaticacceptlayerdrag,Automatic response to invalid layer selection drag error,Automatische Reaktion auf Fehlermeldung bei Ziehen von ungültiger Ebenenauswahl,,Automatic layer drag acceptance in room editor
roomeditor_automaticacceptlockedinvisiblelayerdrag,Automatic response to locked/invisible layer drag error,Automatische Reaktion auf Fehlermeldung bei Ziehen von gesperrter/unsichtbarer Ebene,,Automatic layer drag acceptance for locked or invisible layer in room editor
roomeditor_linkcolour,Chain link colour,Kettenverbindungsfarbe,,Link Colour in Room Editor
roomeditor_chainalphafalloff,Chain fade out start distance (px),Startdistanz für Ketten-Ausblendung (px),,Alpha Fall Off of chain in Room Editor
roomeditor_chainalphadistance,Chain fade out stop distance (px),Enddistanz für Ketten-Ausblendung (px),,Distance of chain alpha fall off in Room Editor
roomeditor_minfalloffalpha,Chain minimum alpha,Ketten-Mindest-Alpha,,Minimum Alpha fall off in Room Editor
roomeditor_multiselectcolour,Area select highlight colour,Markierungsfarbe für Bereichsauswahl,,Colour of the multi select area in Room Editor
roomeditor_tileselectcolour,Selected tile highlight colour,Markierungsfarbe für gewähltes Tile,,Tile Select colour in Room Editor
roomeditor_tilehighlightcolour,Mouseover tile highlight colour,Markierungsfarbe für Mouseover-Tile,,Tile Highlight Colour in Room Editor
roomeditor_tileinheritcolour,Inherited tile highlight colour,Markierungsfarbe für geerbtes Tile,,Tile Inherit colour in Room Editor
roomeditor_showviews,Show room views,Raumansichten anzeigen,,Show Views in Room Editor
timeline_noundoactions,Automatic response to permanent action warning,Automatische Reaktion auf Warnung für permanente Aktion,,No Undo Actions in Timeline Editor
timeline_opennewmoments,Open new moments for edit on creation,Neue Momente bei Erstellung zur Bearbeitung öffnen,,Open newly created moments for editing preference
CMenu_CloseAllButThis,Close All But This,Alles außer dies schließen,,Close all but this context menu
codeeditor_textcolour,Colour of text,Textfarbe,,Text Colour in Code Editor
codeeditor_font,Font to use,Zu verwendende Schriftfarbe,,Font to use in Code Editor
codeeditor_fontstyle,Font Style,Schriftartstil,,Font Style to use in Code Editor
codeeditor_fontaa,Font AA,Schriftart-Antialiasing,,Anti-Alias Font in Code Editor
codeeditor_textsize,Size of text,Textgröße,,Size of Text in Code Editor
codeeditor_normaltext,Normal Text,Normaler Text,,Colour of Normal Text in Code Editor
codeeditor_keywords,Keywords,Schlüsselwörter,,Colour of Keywords in Code Editor
codeeditor_values,Values,Werte,,Colour of Values in Code Editor
codeeditor_strings,Strings,Zeichenfolgen,,Colour of Strings in Code Editor
codeeditor_comments,Comments,Kommentare,,Colour of Comments in Code Editor
codeeditor_constants,Constants,Konstanten,,Colour of Constants in Code Editor
codeeditor_builtinvariables,Built-in Variables,Integrierte Variablen,,Colour of Built-in Variables in Code Editor
codeeditor_builtinfunctions,Built-in Functions,Integrierte Funktionen,,Colour of Built-in Functions in Code Editor
codeeditor_scriptnames,Script names,Skriptnamen,,Colour of Script names in Code Editor
codeeditor_resourcenames,Resource names,Ressourcennamen,,Colour of Resource names in Code Editor
codeeditor_linenumbers,Line numbers,Liniennummern,,Colour of Line Numbers in Code Editor
codeeditor_readonlylines,Read only line style,Linienstil schreibgeschützt,,Style of read only lines in Code Editor
codeeditor_bookmarklines,Bookmark line style,Linienstil Lesezeichen,,Style of bookmark lines in Code Editor
codeeditor_selectedline,Selected line colour,Farbe ausgewählte Linie,,Selected line colour in Code Editor
codeeditor_changedline,Changed line colour,Farbe geänderte Linie,,Changed line colour in Code Editor
codeeditor_backgroundcolour,Background colour,Hintergrundfarbe,,Colour of Background in Code Editor
codeeditor_selection,Selection colour,Auswahlfarbe,,Colour of Selections in Code Editor
codeeditor_currentline,Current line colour,Farbe aktuelle Linie,,Colour of current line in Code Editor
codeeditor_errorline,Error line colour,Farbe für Fehlerlinie,,Colour of Error line in Code Editor
codeeditor_highlight,Highlight colour,Markierunsfarbe,,Colour of higlighted text in code editor
codeeditor_debugger,Debugger colour,Debugger-Farbe,,Colour of line the debugger is on
codeeditor_bracketmatchsuccess,Bracket/quote match colour,Klammer-/Anführungszeichen-Paarfarbe,,Colour of Successful bracket matches in code editor
codeeditor_bracketmatchfail,Failed bracket/quote match colour,Farbe für fehlende(s) Klammer-/Anführungszeichen,,Colour of failed bracket matches in code editor
codeeditor_statusbarselected,Pre cursor intellisense colour,Farbe für Prä-Cursor-Intellisense,,Status Bar selection colour in code editor
codeeditor_intellisenseleft,Post cursor intellisense colour,Farbe für Post-Cursor-Intellisense,,Colour of intellisense left in Code Editor
codeeditor_whitespacestyle,White space text style,Whitespace-Textstil,,White space style in Code Editor
codeeditor_keeptabs,Keep tabs,Reiter beibehalten,,Keep Tabs in Code Editor
codeeditor_tabsize,Tab size,Reitergröße,,Tab Size in Code Editor
codeeditor_showwhitespace,Show whitespace,Whitespace anzeigen,,Show Whitespace in Code Editor
codeeditor_showlinenumbers,Show line numbers,Liniennummern anzeigen,,Show Line Numbers in Code Editor
codeeditor_showtablines,Show tab lines,Reiterzeilen anzeigen,,Show Tab Lines in Code Editor
codeeditor_colourcoding,Enable colour coding,Farbkodierung aktivieren,,Enable Colour Coding in Code Editor
codeeditor_maxlinecount,Document line limit (<=0 no limit),Dokumentliniengrenze (<=0 keine Grenze),,Max Line Count in Code Editor
codeeditor_matchindent,Match indent on new lines,Einschub in neuen Zeilen anpassen,,Match indent in code editor
codeeditor_braceindent,Auto indent after brace,Autom. Einschub nach Klammer,,code editor curly brace indent pref
codeeditor_codecompletion,Enable code completion,Code-Vervollständigung aktivieren,,Enable Code Completion in Code editor
codeeditor_enablebrackets,Auto add function brackets,Autom. Hinzufügen von Funktionsklammern,,Enable adding brackets to functions in Code editor
codeeditor_contextmenu,Enable Context Menu,Kontextmenü aktivieren,,Enable Context Menu in Code Editor
codeeditor_columnselect,Allow column selection,Spaltenauswahl erlauben,,Allow column selection in Code Editor
codeeditor_breakpoints,Allow breakpoints,Breakpoints erlauben,,Allow breakpoints in Code Editor
codeeditor_blockcomment,Allow Block Comments,Blockkommentare erlauben,,Allow Block Comments in Code Editor
codeeditor_undostacksize,Undo/Redo stack limit (<0 unlimited),Stapellimit für Rückgängig machen/Wiederholen (<0 unbegrenzt),,Undo Stack Size in Code Editor
codeeditor_highlightmatches,Highlight selection matches,Auswahlübereinstimmungen hervorheben,,Highlight words which match selection in Code Editor
codeeditor_textcolours,Text colours and style,Textfarben und -stil,,Text colours and style in Code Editor
codeeditor_options,Options,Optionen,,Options for Code Editor
codeeditor_show_obsoletes,Colour coding/code completion enabled for obsolete content,Farbkodierung/Code-Vervollständigung aktiviert für überflüssige Inhalte,,code editor show obsolete symbols pref
codeeditor_highlight_pairs,Highlight symbol pairs,Symbolpaare hervorheben,,code editor highlight matching symbol pairs pref
codeeditor_obsolete_style,Obsolete functions etc,Überflüssige Funktionen usw.,,code editor text style for obsolete symbols
codeeditor_braces,Braces,Klammern,,code editor text style for braces
codeeditor_folded_region,Folded region,Eingeklappte Region,,text style for folded #region
codeeditor_folded_region_tag,Folded region name,Name der eingeklappten Region,,text style for folded region tag
dialogeditor_textcolours,Text colours and style,Textfarben und -stil,,Text colours and style in Dialog Editor
dialogeditor_options,Options,Optionen,,Options in Dialog Editor
sourcecontrolgit_username,Commit username,Commit-Benutzername,,Username to commit as for source control git
sourcecontrolgit_password,Password for Username,Kennwort für Benutzername,,Password for Username to commit as for source control git
sourcecontrolgit_email,Commit email address,E-Mail-Adresse für Commit,,Email for user to commit as for source control git
sourcecontrolgit_mergetoolpath,Tool location,Werkzeug-Pfad:,,Path to Tool for source control git
sourcecontrolgit_mergetooloptions,Options for Tool,Optionen für Werkzeug,,Options for Tool for Source Control Git
sourcecontrolgit_logging_verbose,Verbose logging,Umfangreiche Protokollierung,,Verbose Logging for Source Control Git
sourcecontrolgit_externaltoolerror,Source Control (Git) External Tool Error,Quellkontrolle (Git) - Externer Tool-Fehler,,Source Control (Git) External Tool Error message title
sourcecontrolgit_nomergetool,Merge Tool path is invalid,Pfad zum Merge-Tool ist ungültig,,Merge Tool path is invalid
sourcecontrolgit_nodifftool,Diff Tool path is invalid,Pfad zum Diff-Tool ist ungültig,,Diff Tool path is invalid
sourcecontrolgit_automatically_start,Automatically enable source control,Quellkontrolle automatisch aktivieren,,Automatically enable Source Control
ProgressBar_checking_device,Checking Device...,Gerät wird überprüft...,,Checking Device Connection Progress Bar Label
ProgressBar_detecting_devices,Detecting Devices...,Erkennen von Geräten...,,Detecting Devices Progress Bar label
ProgressBar_runtime_delete,Deleting Runtime...,Löschen von Runtime...,,Deleting Runtime Progress Bar Label
ProgressBar_sourcecontrolgit_push,Pushing...,Pushen...,,Push progress label
ProgressBar_sourcecontrolgit_pull,Pulling...,Pullen...,,Pull progress label
ProgressBar_sourcecontrolgit_checkout,Checking Out...,Auschecken...,,Checkout progress label
ProgressBar_sourcecontrolgit_revert_files,Reverting Files...,Wiederherstellen von Dateien...,,Revert Files progress label
ProgressBar_sourcecontrolgit_revert_revision,Reverting Revision...,Wiederherstellen von Revision...,,Revert Revision progress label
ProgressBar_sourcecontrolgit_clone,Cloning...,Klonen...,,Clone progress label
desktop_slowclicktime,Slow double-click time (ms),Langsame Doppelklickzeit (ms),,Slow double-click time in milliseconds
desktop_scrolllocktime,Scroll lock time (ms),Rollen-Zeit (ms),,The time in milliseconds to lock scrolling to the gadget scrolling started on as long as the mouse is still over it
desktop_acpowerspeed,AC power framerate (%),Framerate Netzstrom (%),,Speed of IDE while running on AC power
desktop_batterypowerspeed,Battery power framerate (%),Framerate Akkustrom (%),,Speed of IDE while running on battery power
desktop_focuspowerspeed,Background framerate (%),Framerate Hintergrund (%),,% when application is not in focus
desktop_scrollspeed,Scroll speed,Scrollgeschwindigkeit,,scroll speed preference
folderwatcher_frequency,File watcher frequency (ms),File-Watcher-Häufigkeit (ms),,File watcher frequency in milliseconds
folderwatcher_laptopfrequency,Laptop file watcher frequency (ms),Laptop-File-Watcher-Häufigkeit (ms),,File watcher frequency in milliseconds on laptops
ggs_enable_steam,Enable steam,Steam aktivieren,,Enable Steam
ggs_steam_id,Steam ID,Steam-ID,,Steam Id
ggs_enable_iap_sandbox,Enable IAP sandbox,IAP-Sandbox aktivieren,,Enable IAP Sandbox
ggs_tile_type,Type of Tiles to display,Arten von anzuzeigenden Tiles,,Type of Tiles to display
ggs_tiles_flip,Flip tiles,Tiles umkehren,,Flip tiles
ggs_tiles_iconic,Iconic tiles,Symbolartige Tiles,,Iconic tiles
ggs_tiles_cycle,Cycle tiles,Tiles durchlaufen,,Cycle tiles
ggs_new_guid,Create New GUID,Neue GUID erstellen,,Create New GUID
ggs_short_circuit_evaluations,Enable Short Circuit Evaluations,Short-Circuit-Evaluierungen aktivieren,,Enable Short Circuit Evaluations
ggs_delete_event_on_room_change,Delete Event on Room Changes,Ereignis bei Raumänderungen löschen,,Delete Event on Room Changes
ggs_use_fast_collisions,Enable Fast Collisions,Schnelle Kollisionen aktivieren,,Enable Fast Collisions
ggs_game_speed,Game frames per second,Spiel-Frames pro Sekunde,,Game Frames Per Second
